;Unnamed: 0;Id of comment.;Id of author of comment.;Id of post;Author of post;date;text;likes;Unnamed: 7;интенет-анализ;контент-анализ
13642;35409;236793;81045653;236792;25106701;24.08.2015 11:46;Если только в Москве;4;;б2;0
13643;35410;236794;278315067;236792;25106701;24.08.2015 11:48;Быть патриотом своей страны и своего народа по понятиям продажных либералов и жидомасонов значит быть фашистом))))Нет уж господа,мы будем национал-патриотами и точка;3;;б2,л2;1
13644;35411;236795;91376404;236792;25106701;24.08.2015 11:48;Очередной западный бред журналюги который и в России то небыл;1;;т2,л2;0
13645;35412;236796;27636981;236792;25106701;24.08.2015 11:49;Los Angeles Times безусловно непревзойдённый мировой эксперт по русскому национализму);6;;б2, ш2;0
13646;35413;236797;3061088;236792;25106701;24.08.2015 11:49;Дай Бог, чтоб у русских людей мозги стали на место, и они осознали необходимость национализма!!;10;;с3;0
13647;35414;236799;1705213;236792;25106701;24.08.2015 11:49; У национализма в России ? светлое будущее , ? сказал бывший скинхед Дмитрий Демушкин.  Если только в Москве , - ответил ему Айратин Гатауллин.;9;;с3;0
13648;35415;236801;56370101;236792;25106701;24.08.2015 11:50;И в их собственных квартирах , потому что в Москве им Кавказцы вмиг покажут кто в доме хозяин , пусть только вякнут .;0;;м4;1
13649;35416;236802;143263270;236792;25106701;24.08.2015 11:50;Это правда;0;;в3;0
13650;35417;236803;3485180;236792;25106701;24.08.2015 11:51;Проявление расизма и национализм это признак малообразованности, бескультурья и деградация населения страны. Страна большая, много разных народностей и национальностей проживает. И пока они все живут и являются гранждами России на равно с русскими светлого будущего у нацизма и расизма не будет. Только отдельные личности и компании будут проявлять, собственно они и проявляли это, и это все от малообразованности и интелектуальной недоразвитости.;4;;п3;1
13651;35418;236804;253652787;236792;25106701;24.08.2015 11:52;Новость высосана из пальца, уровень поддержки таких маргиналов как Демушкин ничтожно мал, он гордится только как пугалка для несведущего западного обывателя. Любой национализм смертелен для такой страны как Россия, все это знают.;4;;ч2;0
13652;35419;236805;83083060;236792;25106701;24.08.2015 11:54;[id56370101|Лариса], раньше детей бабой Ягой пугали,бабайкой,милиционером, а теперь - кавказцами в Москве ))) у вас фобии?)));3;;ц3;1
13653;35420;236806;253652787;236792;25106701;24.08.2015 11:58;[id83083060|Дмитрий], судя по подпискам на её странице, она обычный троль, вот и разжигает;0;;щ3;4
13654;35421;236808;197990243;236792;25106701;24.08.2015 12:00;Они че долбоебы что ли?;0;;л2;0
13655;35422;236809;282851448;236792;25106701;24.08.2015 12:04;[id56370101|Лариса], ой я вас таки умоляю)<br>Чурки покажут всю любовь к презику)только вот по большей части простым людям)<br>весь опыт намекает что при малейшем отпоре чурбанье ретируется<br>Жители Кондопоги соврать не дадут))));3;;м4,у4;1
13656;35423;236810;282851448;236792;25106701;24.08.2015 12:05;[id3485180|Марина], Происхождение лозунга[править | править вики-текст]<br>Авторство лозунга часто приписывают[4] одному из идеологов черносотенства В. А. Грингмуту, автору самой старой из известных публикаций с использованием этого лозунга[5]: ??Россия ? для русских?, ? таков лозунг Русской Монархической партии, ясно понимающей, что если предоставить Россию иноплеменникам, иноверцам и иностранцам, ? то не только в России не будет Самодержавной Монархии, но не будет и самой России?. Лозунг стал центральной идеей черносотенцев[6].<br><br>По другим версиям, лозунг появился в период царствования императора Александра III[7]. Так, есть версия, что сам император произнёс: ?Россия должна принадлежать русским, и всякий, кто живёт на этой земле, обязан уважать и ценить этот народ?. По словам генерала А. Н. Куропаткина, Александр III выбрал ?Россия для русских? своим девизом, поскольку считал необходимым удовлетворить народному чувству, по которому Россия должна принадлежать русским, освободить внешнюю политику России от опеки иностранных держав, упорядочить и скрепить внутренний строй управления, развить духовные и материальные силы русского народа[8].<br><br>Некоторые полагают, что автором является генерал М. Д. Скобелев, которому приписывают слова: ?Хочу написать на своем знамени: ?Россия для русских и по-русски?, и поднять это знамя как можно выше!?[7].<br><br>Лозунг ?Россия для русских!? был созвучен мыслям Ф. Достоевского, писавшего, что ?хозяин земли русской ? есть один лишь русский (великорус, малорус, белорус ? это всё одно)?[9].;0;;п3;1
13657;35424;236811;56370101;236792;25106701;24.08.2015 12:06;[id83083060|Дмитрий], я никого не пугаю , просто на смешите людей со своим русским национализмом в Москве )));0;;ф1;2
13658;35425;236812;197990243;236792;25106701;24.08.2015 12:10;Они че долбоебы что ли?;0;;л2;0
13659;35426;236813;197990243;236792;25106701;24.08.2015 12:12;Не, умные люди в правительстве этого не позволят ибо это приведет к краху россии;0;;у4;0
13660;35427;236814;83083060;236792;25106701;24.08.2015 12:12;[id56370101|Лариса], а в Москве нет национализма - нас толлерантный город(насколько это возможно )... просто западные журналюги настолько тупые, что пишут о том, чего не знают и никогда не узнают. .. умных из себя строят,тупорылые)));1;;ч2,л2;1
13661;35428;236817;282851448;236792;25106701;24.08.2015 12:22;[id56370101|Лариса], может был бы русский национализм в Москве и жизнь в стране была бы лучше);0;;с3;2
13662;35429;236818;301050906;236792;25106701;24.08.2015 12:31;Не пора ли включить мозги и понять, что национальность - это коллективная индивидуальность, которая скоротечна и временна, а вечна личная индивидуальность, которая имеет неповторимые отпечатки пальцев, сетчатку глаз и полную несовместимость своих органов организма при их замене на аналогичные органы из других организмов? http://vk.com/photo-25106701_376529969;0;;ж4;3
13663;35430;236819;175137603;236792;25106701;24.08.2015 12:32;Как показывает история - к краху приводят байки про многонациональность. Распад совка это наглядно показал.;2;;п3;3
13664;35431;236840;4260767;236792;25106701;24.08.2015 13:11;существование национальных республик это разве не местечковый национализм? или только у русских не должно быть национализма, а друим можно;8;;ч3;2
13665;35432;236863;309443528;236792;25106701;24.08.2015 14:42;[id4260767|Андрей], По сути, именно местечковый национализм оформленный большевиками в республики,автономии,округа и развалил Советы.Это угрожает и России(вспомним Чечню).Если бы России каким-нибудь образом удалось упразднить это порочное наследие,то национализм потерял бы почву в России.;0;;ж3, и4;2
13666;35433;236867;242888458;236792;25106701;24.08.2015 14:45;Мечта запада - националистическая Российская Федерация с нищетой и отстрелом людей на улице.;1;;т4;2
13667;35434;236875;282851448;236792;25106701;24.08.2015 14:55;[id242888458|Александр], дружок. ПО секрету тебе сказать, когда при Романовых в Российской империи велась политика национализма то запад люто её очковал : );0;;п3;3
13668;35435;236880;200680368;236792;25106701;24.08.2015 14:58;Сразу видно статейка из сшп...????;0;;н2;0
13669;35436;236890;309443528;236792;25106701;24.08.2015 15:11;[id282851448|Павел], Потому-что был бесконтрольный.<br>А вот такой как на Украине-приветствуется.;0;;ц3;2
13670;35437;236891;282851448;236792;25106701;24.08.2015 15:12;[id309443528|Анатолий], ой дурачок, а какой на украине?;0;;ш3;3
13671;35438;236892;309443528;236792;25106701;24.08.2015 15:14;Контролируемый,дурачок.;0;;п3;3
13672;35439;236894;282851448;236792;25106701;24.08.2015 15:16;[id309443528|Анатолий], ммммм, в каком городе Украины проживаете;0;;а3 ;4
13673;35440;236899;309443528;236792;25106701;24.08.2015 15:35;Вы хотите убедить меня что национализма в Украине нет,или, в этом надо убедиться собственными глазами.Даже не пытайтесь.Он есть везде и в России тоже,но в России с ним борются не выпуская за рамки бытовых проявлений.На Украине-то как раз наоборот,бытового нет,но есть государственный.;0;;ч3;3
13674;35441;236901;282851448;236792;25106701;24.08.2015 15:45;[id309443528|Анатолий], вы, недалекий мой, в какой стране изволите проживать?))));0;;ц3;4
13675;35442;236919;282851448;236792;25106701;24.08.2015 16:06;[id309443528|Анатолий], мне не о чем с космополитами разговаривать<br>Власть отстаивающая интересы государство образующего народа то есть тот самый пугающий вас национализм , это на мой взгляд основа любого сильного государства<br>на Украине в данный момент происходит процесс выработки национальной идентичности через язык и сознание, что несомненно благо для будущего страны;0;;г3, ж4;3
13676;35443;236921;309443528;236792;25106701;24.08.2015 16:18;[id282851448|Павел], вот это уже другой разговор,по крайней мере по теме.Но всё это прекрасно на бумаге,на деле же война,убийства,террор,ограничение свобод и прав.А демократия-подождёт?;0;;щ4;4
13677;35444;236923;282851448;236792;25106701;24.08.2015 16:23;[id309443528|Анатолий], до демократии нужно дорасти, бегая в штанишках made in USSR демократию не построить)<br>Опять же демократия это как минимум уважение к чужому мнению, наблюдаете ли вы оное в РФ?<br>ну и на закусочку, в америке любой негр или например моя знакомая- этническая японка на секундочку, считают себя американцами, они все нация американцев и правительство отстаивает их интересы) хотя демократия же);0;;и3,и4;4
13678;35445;236925;282851448;236792;25106701;24.08.2015 16:38;[id309443528|Анатолий], от тебе раз прям так таки и все равны?,а страна то как называется?))))<br>данные переписи;0;;ш3;4
13679;35446;236926;282851448;236792;25106701;24.08.2015 16:38;На её территории проживает более 190 народов, в число которых входят не только коренные малые и автохтонные народы страны. В 2010 году русские составили 80,9 % или 111,0 млн. из 137,2 млн. указавших свою национальную принадлежность, представители других национальностей ? 19,1 %;0;;ж4;1
13680;35447;236927;282851448;236792;25106701;24.08.2015 16:39;[id309443528|Анатолий], и теперь что, 81% Русских должен признать шариатский суд и начать жить по чеченским законам потому что 05% чеченцев так живет?);0;;ц3;3
13681;35448;236928;197990243;236792;25106701;24.08.2015 16:40;[id175137603|Алекс?й], Как бы ни было не хочется ни вражбы ни краха;0;;р4;3
13682;35449;236929;282851448;236792;25106701;24.08.2015 16:42;[id309443528|Анатолий], давайте мне ещё про равенство закона расскажите))))));0;;н3;4
13683;35450;236930;282851448;236792;25106701;24.08.2015 16:43;[id309443528|Анатолий], и да , в америке одна нация, американцы, это я как побывавший там могу заявить);0;;ж3;3
13684;35451;236932;309443528;236792;25106701;24.08.2015 16:46;[id282851448|Павел], зачем по чеченским законам?По конституции.Одной на всех.;0;;а3, ж4;1
13685;35452;236935;282851448;236792;25106701;24.08.2015 16:48;[id309443528|Анатолий], ахахахаха))))Так отсутствие шариатских судов оскорбляет чувства мусульман)))<br>а ещё по конституции нельзя 3 раза быть президентом;0;;ц3;4
13686;35453;236941;309443528;236792;25106701;24.08.2015 16:54;Вот так и вынужденна в противоречиях жить Россия,но это лучше, чем строить унитарное государство,а не согласных убивать или изгонять,ведь жизнь сложнее идеалов.;0;;п4;3
13687;35454;236944;57452729;236792;25106701;24.08.2015 16:56;[id282851448|Павел], 3 раза подряд нельзя, если ты про путина. Вообще чего вы все такие умные тут , в России делаете? Езжайте в Штаты и там оставайтесь.;1;;ж3, а3, с3;3
13688;35455;236945;282851448;236792;25106701;24.08.2015 16:56;[id309443528|Анатолий], понятно. никакой конкретики, все из разряда оставьте все как есть;0;;ж3;4
13689;35456;236947;282851448;236792;25106701;24.08.2015 16:59;[id57452729|Лёша], я такой умный тут живу и буду жить как и все мои предки пытаясь улучшить жизнь в стране и воспринимая опыт развитых стран, <br>что я такой умный ещё тут делаю, хмммммм, слегка страдаю от идиотских комментариев типа твоего, но даже отвечу, дружок, ты не говоришь мне что мне делать, а я не говорю тебе куда тебе идти))))<br>Это вот основной принцип демократии о котором тебе расскажет Анатолий);0;;е1,р3;4
13690;35457;236952;309443528;236792;25106701;24.08.2015 17:05;А вы считаете,что знаете все ответы,или,знают их американцы,японцы,китайцы?Если для вас все так просто,то вперёд.Умные люди говорят,что все кто думает,что идёт вперёд,на самом деле и идет по кругу.;0;;у4;4
13691;35458;236953;57452729;236792;25106701;24.08.2015 17:05;[id282851448|Павел], ок, только демократия это не то что ты себе там выдумал. Твои действия не должны мешать моим действиям и наоборот. Вот что такое демократия. А это в принципе невозможно, так что можешь идти и дальше дрочить на Америку;0;;ж4, л3;4
13692;35459;236977;282851448;236792;25106701;24.08.2015 17:28;[id57452729|Лёша], во второй раз менее интиллигентно, нахуй поди : )без деревенщины ростовской разберусь что мне делать))));0;;ч3, л3;4
13693;35460;236979;282851448;236792;25106701;24.08.2015 17:30;[id309443528|Анатолий], Критик должен быть готов и способен в любой момент и по первому требованию занять место критикуемого им и выполнять его дело продуктивно и компетентно :  в противном случае критика превращается в наглую самодовлеющую силу и становится тормозом на пути культурного прогресса<br>а от вас предложений я что то не вижу;0;;п3;4
13694;35461;237021;282851448;236792;25106701;24.08.2015 18:06;[id309443528|Анатолий], люди на Украине гибнут по одной простой причине, некая группа граждан захотела внести изменения в конституцию, и стала инсургентами;0;;и4;4
13695;35462;237027;309443528;236792;25106701;24.08.2015 18:12;[id282851448|Павел], опять же,за это люди не должны гибнуть.Что это за преступление-хотеть изменения конституции,той, тем более, которую уже дискредитировали майданом.;0;;ж3;4
13696;35463;237030;282851448;236792;25106701;24.08.2015 18:17;[id309443528|Анатолий], именно с этим вопросом к инсургентам);0;;ш3;3
13697;35464;237039;309443528;236792;25106701;24.08.2015 18:30;Понял.Приятно было обменяться мнениями.;0;;в3;3
13698;35465;237040;282851448;236792;25106701;24.08.2015 18:30;[id309443528|Анатолий], история нас рассудит;0;;в3;3
13699;35466;237043;309443528;236792;25106701;24.08.2015 18:33;Согласен,когда-нибудь прояснится всё.Дай Бог нам дожить.;0;;д3;3
13700;35467;237045;282851448;236792;25106701;24.08.2015 18:34;[id309443528|Анатолий], ну с такими грамотными менеджерами я то даже и не сомневаюсь в том что мы увидим крах загнившей европы);0;;у3;4
13701;35468;237088;282851448;236792;25106701;24.08.2015 19:11;[id309443528|Анатолий], эээээм, и об этом говорит человек не поддерживающий национализм?);1;;ш3;4
13702;35469;237255;9835519;236792;25106701;25.08.2015 0:27;Россия для русских? Тогда Татарстан для татар, Башкортостан для башкир, Удмуртия для удмуртов, Дагестан для дагестанцев, Чечня для чеченцев, Адыгея для адыгов, Калмыкия для калмыков, Мордовия для мордовов, Чувашия для чувашей, Бурятия для бурят, Чукотка для чукчей, Якутия для якутов... Список можно долго продолжать. Идиоты, что от России останется!;0;;у3;2
13703;35470;237260;55058528;236792;25106701;25.08.2015 2:05;Чё вы этого дёмушкина превозносите если бы он имел какой вес то давно бы уже червей кормил. А так он никто и звать его ни как;0;;з3, л3;2
13704;35471;237389;282851448;236792;25106701;25.08.2015 13:54;[id9835519|Денис], дурашка, князь багратион, на секундочку этнический грузин, считал себя русским офицером это раз)<br>всем этим малым народам русские несли бремя белого человека если ты понимаешь о чем я;0;;п3;2
13705;35472;237671;9835519;236792;25106701;25.08.2015 23:20;[id282851448|Павел], бремя белого человека? Вы часом не расист?;0;;а3;2
13706;35473;237801;38482970;236792;25106701;26.08.2015 8:37;На почве национализма и недокормешки регионов Кавказа и прочих... Рассея рухнет;0;;м4;1
13707;35474;237887;282851448;236792;25106701;26.08.2015 11:25;[id9835519|Денис], я часом называю вещи своими именами);0;;е1;3
13708;35475;237926;9835519;236792;25106701;26.08.2015 12:49;[id282851448|Павел], в таком случае скажи ка что останется от России если лозунг Россия для русских станет государственной программой? И тут не важно как считаешь ты, правильно это будет или нет с точки зрения русского, посмотри как это будет выглядеть с точки зрения других народов, даже самых малых. Я это говорю как этнический татарин у которого жена чувашка, которая в свою очередь родилась и выросла в Башкирии. И я прекрасно осознаю какую бомбу могут взорвать подобные идеи в нашей стране.;0;;у3у4;2
