13709;35476;237931;282851448;236792;25106701;26.08.2015 12:54;[id9835519|Денис], а для кого она Россия?Если мне не изменяет память то Россия это страна русских, так же как и америка страна американцев)И с любой точки зрения ты сейчас ставишь вопрос как татарско/бурятский : ) националист<br>ежели ты не уважаешь свою страну и государствообразующую нацию то почему мне должно быть интересно?))))<br>еще раз напоминаю о князе Багратионе, если в татарии он не известен то погугли);0;;п3;2
13710;35477;237942;9835519;236792;25106701;26.08.2015 13:16;[id282851448|Павел], Россия многонациональная и многоконфессиональная страна, и она для россиян, а не для какой то отдельной нации. Можно конечно отделить все национальные республики и оставить только территории где коренным народом является русский. Тогда это будет чисто русская страна, унитарная. Русский народ потому и является титульной нацией в России что у него хватает мудрости не превозноситься над всеми, не разделять, а объединять. <br>Америка если ты не знаешь не страна, а континент, вернее два континента. Если ты о США, то там под нацией понимается совершенно не этническое происхождение и такой национальности как американец не существует, это гражданство. И тут я повторюсь, Россия для россиян, более правильный лозунг. <br>Я вообще не понимаю в чем проблема, что вас этнических русских притесняют чтоли? Россия для русских это что? Выгнать всех не русских из России чтоли? Или поставить в неравное положение? Сделать людьми второго сорта? Я то вот как раз не националист, я интернационалист, за равенство всех народов в стране, националисты это те кто кричат Россия для русских.;1;;ж3, е1;0
13711;35478;237948;282851448;236792;25106701;26.08.2015 13:24;[id9835519|Денис], дружок, чтобы говорить о USA ты был там?<br>я вот был и моя коллега, этническая японка на вопрос what is your nationality<br>отвечала im amarican , смекаешь?<br>Русский народ нес бремя белых тут я с тобой согласен,;0;;а3, е1, ж4, в3;1
13712;35479;237949;282851448;236792;25106701;26.08.2015 13:25;[id9835519|Денис], князь Багратион был человеком второго сорта?;0;;а3;1
13713;35480;237951;9835519;236792;25106701;26.08.2015 13:26;[id282851448|Павел], я уважаю все национальности, в том числе и русских. Не делю никого. Князь Багратион был офицером русской армии, потому был русским офицером. Как и Екатерина 2 будучи совсем не русских кровей была русской императрицей. Или ты хочешь сказать что все россияне это русские?;0;;п3,с3;3
13714;35481;237961;282851448;236792;25106701;26.08.2015 13:32;[id9835519|Денис], я хочу сказать что указанные тобой выдающиеся люди считали себя русскими и лозунг Россия для русских не вызывал бы у них недоумения)<br>опять же национальная идентичность по принципу менталитет и сознание (в пример тебе Украина, где люди абсолютно разных кровей начали считать себя украинцами) не позволит считать кого либо людьми второго или третьего сорта<br>ты вот в первую очередь думаешь о себе как о татарине а не о русском, ты сам разжигаешь национальную рознь утверждениями что титульные русские не могут считать страну названную в честь народа своей);0;;ж3, т3;2
13715;35482;237983;9835519;236792;25106701;26.08.2015 13:59;[id282851448|Павел], когда я утверждал что русские не могут считать Россию своей страной? Что за бред. Ты хочешь чтобы только русские считали Россию своей страной? <br>Если русский это не этнос, а менталитет и сознание, то мы в России все русские. Какие проблемы? <br>Я не разжигаю рознь. Я просто констатирую факт, что поднятие в нашей стране вопроса о том что Россия должна принадлежать только русским, автоматически приведет к тому что многие народы просто перестанут считать себя частью этой страны со всеми вытекающими последствиями. <br>Зря ты привел в пример Украину, там идет гражданская война. Не хотел бы я повторения Чеченской войны. <br>США страна эмигрантов, коренным народом там являются только индейцы. Туда все понаехали и стали называть себя американцами. Неудачное сравнение с Россией.;0;;ф1, ж4;1
13716;35483;237984;282851448;236792;25106701;26.08.2015 14:02;[id9835519|Денис], раз ты считаешь себя русским то что тебя напрягает в лозунге, и зачем ты мне чтото о бурятах и татарах рассказываешь?<br>на Украине да война но вот никак не гражданская);0;;а3, ж3, б3;2
13717;35484;238332;9835519;236792;25106701;26.08.2015 20:56;[id282851448|Павел], я уже написал что меня напрягает в данном лозунге. Повторятся не буду.;0;;е1, г3;2
13718;35485;238569;282851448;236792;25106701;27.08.2015 10:07;[id9835519|Денис], так ты же русский);0;;ш3;3
