;Unnamed: 0;Id of comment.;Id of author of comment.;Id of post;Author of post;date;text;likes;Unnamed: 7;;
8204;10821;266579;82853210;266578;25106701;29.12.2015 7:03;...а цена на нефть стремится к 10 баксам...;0;;У4;1
8205;10822;266580;173188380;266578;25106701;29.12.2015 7:06;Выходим из ВТО и международного рынка!;0;;С4;1
8206;10823;266581;324261285;266578;25106701;29.12.2015 7:06;Истерия вокруг цен на нефть подогревается оскотиневшейся либеральной массой, подпитываемой как раз такими сми как Эль Паис. А наши предприниматели делают на этом деньги. Вчера зашла в магазин, купить батарейки на дистанционки - они уже не 15 а 20 стоят. Хех!;3;;Щ4;1
8207;10824;266582;309379415;266578;25106701;29.12.2015 7:08;все у России будет хорошо;6;;И4;1
8208;10825;266583;47540014;266578;25106701;29.12.2015 7:12;Будущее в цене на нефть ?! ПРАВЫ,ой как правы....НЕФТИ БОЛЬШЕ НЕ СТАНОВИТСЯ, а потребление растет. Второе...почему эти полу-пиндосы не могут понять,что не в Путине их проблема ? Большинство россиян поняли - все...это Сталинград ! Отступишь... СОМНУТ ОКОНЧАТЕЛЬНО и 90е будут вспоминаться раем. Россия сегодня в стадии  активной обороны ... что дальше ? А дальше  выборы в Америке  и нужно не упустить это момент... и нефти на этой планете больше не становится.;6;;Ж4;1
8209;10826;266588;252652514;266578;25106701;29.12.2015 7:32;Будущее будет зависеть от нашего хладнокровия и единства , у цены на нефть  роль весьма опосредованная..;4;;И4;1
8210;10827;266589;47540014;266578;25106701;29.12.2015 7:33;[id82853210|Сергей], и что ? Хохлам от этого легче ? Хе...может предел себестоимости еще и не пройден,но карман Пиндостана не бездонный(они активно скупают разорившиеся нефтеомпании). В 90х тоже упала до себестоимости,а потом скакнула до 150... Ну,а истинная цена, как говорят научники - 200-250  в долларовом эквиваленте . Якши,бледнолицие ?!;0;;Ж3;2
8211;10828;266590;252652514;266578;25106701;29.12.2015 7:44;Надо рвать все экономические связи и путы с Западом,прежде всего с Германией .Пусть потом кусают свои локти.<br>Якобы демократический Запад использовал экономику как рычаг давления на Россию , пытаясь заставить её принять политические решения, идущие во вред её национальным интересам, предать миллионы своих соотечественников,отдав их на растерзание  цепным шакалам Госдепа и правительства в Брюсселе....<br><br>Мы долго надеялись, что экономические реалии окажутся императивом , но увы, Запад ни на йоту не поменялся с 19 века  — та же злоба,ненависть и зависть к России . И если бы не ядерный зонтик, то нас давно ждала бы судьба Югославии.<br><br> Не питайте иллюзий — смерти тысяч людей на Украине только больше распалили аппетиты варваров с Запада.<br><br>Альтернативы усилению связей с Китаем,Индией,Ираном, Ираком, Южной Кореей , Въетнамом у нас нет.<br>Да , можно и дальше сотрудничать с Европой, брать всё самое лучшее, но держать этих уб.лю.д.ков на расстоянии.....;3;;Р4, И4;1
8212;10829;266591;47540014;266578;25106701;29.12.2015 7:48;[id252652514|Алан],  опосредованная  ? Да...это так. Но все ж приятно смотреть,когда количество студентов-бюджетников растет и пенсии у стариков  индексируются  на серьезные суммы. И второе (вчера с ученным-казахом разговаривал)... началось  опустынивание Южных регионов Евразии .Это планетой пока экономически не ощущается,но завтра  на полях Калифорнии и Италии будут расти только кактусы   В Казахстане это начали понимать на Украине - нет(он туда иследовать ездил) В большом плюсе будет только Россия и....Норвегия.;0;;И4;1
8213;10830;266592;71452420;266578;25106701;29.12.2015 7:56;[id82853210|Сергей], да срать на  твою  нефть.;0;;Б3;2
8214;10831;266593;47540014;266578;25106701;29.12.2015 7:58;[id252652514|Алан], насчет Германии не согласен... Меркели приходят и уходят.Германия остается .В силу причин это единственный естественный наш союзник в Европе.И в Германии это понимают...ну, некуда им больше развиваться кроме как врастать в Россию. Это выражается в том,что на одного француза в нашем ВУЗе приходится три,четыре немца (треть - восточники.Это разные немцы).То есть родители оплачивающие учебу своих киндеров понимают - будущее на Востоке,успеха можно добиться только зная русский язык.;0;;Б3, Ж4;3
8215;10832;266595;252652514;266578;25106701;29.12.2015 8:07;Николай, сейчас цена на нефть экономически необоснованная, политическая.<br>США, Саудовская Аравия , Катар пытаются разыграть свою старую партию, которая им удалась с СССР.Но думаю , они просчитались.<br>Экономика в РФ в значительной степени рыночная,государственных обязательств не так много , как было у СССР (который фактически полностью обеспечивал не только себя, но и страны Варшавского договора,плюс кучу  союзничков  по всей планете),и самое главное — руководит страной человек,который не сравним с малодушным и недалёким Горбачёвым, при этом обладая беспрецедентной поддержкой россиян.<br><br>Вот уже саудиты впервые в своей истории принимают бюджет с 20% дефицитом (сравните с истерикой по поводу 3% у нас, среди наших либерастов) — зрелище настолько невиданное,что ждёт нас много интересного в аравийских пустынях , особенно когда хусситы и армия  Йемена начнут жечь саудовские танки новейшими российскими ПТРК и обстреливать базы КСА  Точкой У  ,с перспективой гражданской войны в нефтеносных районах Саудовской Аравии с преимущественно шиитским населением.<br>В США тем временем  угрожающе надувается чёрный пузырь сланцевой нефтедобычи, себестомость которой уже год как в минусе !<br>Учитывая кредиты,полученные американскими сланцевыми компаниями на  перспективу   — а это между прочим суммы от 300 до 500 миллиардов $, фейерверк может быть впечатляющим ! Особенно интересно будет понаблюдать на кого янки повесят свои издержки !<br><br>Так что будущее довольно неопределённое,но скучно точно не будет.;0;;Ж3, У4;2
8216;10833;266596;22229939;266578;25106701;29.12.2015 8:14;Надо было просто тихо сидеть и ждать своей очереди. После 404 загорелось бы у нас. Только демократия вряд ли посетила бы наши края. Вместо этого гражданская война, голод и ненависть. Но зато в западной прессе бы написали что Россия избавилась от Кремлевского гнета и движется в направлении Демократии. А мы им еще оружие поставим - чтобы демократия побыстрее пришла. А дальше  миротворческий  контингент НАТО внутри страны и президент марионетка для вида. Все мировое сообщество разумеется аплодирует.;2;;У4;1
8217;10834;266597;82853210;266578;25106701;29.12.2015 8:14;[id71452420|Александр], срать на тебя,Александр.А на нефти мы живем,как негры на бананах.Благодаря плешивому вору...;2;;Н3, Л4, Т4;4
8218;10835;266598;6113382;266578;25106701;29.12.2015 8:20;Сергей Мирошниченко, ерунду не мели, аналитик нашелся по 10 баксов нефть ...;3;;Б3;1
8219;10836;266599;47540014;266578;25106701;29.12.2015 8:21;[id252652514|Алан], согласен...саудиты как обычно надули сами себя. Ну,а американские долги останутся  американцам  типа украинцев .Им расплачиваться...это радует.(ИМХО) И похоже, что  нескучно  будет в пользу РФ. Второе...третьей мировой , горячей , похоже что не будет. Не зря ВВП упорно демонстрирует ракеты  способные залетать в форточку .Этим он дает понять...о личной ответственности всех этих соросов. Еще раз ИМХО за отход от темы;0;;В3, У4, Ц4;3
8220;10837;266600;252652514;266578;25106701;29.12.2015 8:21;[id47540014|Николай], не знаю , но мне кажется вы ошибаетесь.<br><br>Да , Германия нуждается в России , её ресурсах и рынке.(старый добрый Дранг нах остен).<br>Но кто сказал,что это нельзя получить , как Берлин получил Югославию - по частям и без права голоса. Почему сейчас многие не помнят мрачную роль ФРГ в трагедии Югославии. Например армия Хорватии была вооруженна именно немцами.<br><br>Роль Германии в событиях на Украине может не так бросается в глаза,(а зачем им лезть под раздачу,если идиоты-американцы делают всю чёрную работу за них),но тем не менее именно Берлин главный выгодополучатель от отрыва Украины от России любой ценой.<br><br>Сбывается розовая мечта пангерманистов начала 20 века, развал большой России и поглощение Германией (сиречь Евросоюзом) её по частям .<br><br>Увы , ничто не ново под луной, и именно с Германией у нас будет самый яростный конфликт за Украину.<br>Только если в Берлине поймут , что их попытки дальнейшей экспансии на исторической территории большой России могут привести к новому маю 1945 (в переносном смысле) ,возможно они и сменят политику.<br>Хотя я в этом сомневаюсь.;0;;Б3, Ж4;3
8221;10838;266601;82853210;266578;25106701;29.12.2015 8:22;[id6113382|Сергей], а ты,патриот-недоумок,и не знал? Теперь и ты в курсе !;0;;Н3 ;4
8222;10839;266602;6113382;266578;25106701;29.12.2015 8:23;[id82853210|Сергей], недоумок здесь только ты! которому мозгов элементарно не хватает чтобы провокацию грамотно написать ))) с наступающим тебя!;1;;Н3;4
8223;10840;266603;223034241;266578;25106701;29.12.2015 8:23;Блин, как с комментов с утра поорать приятно) спасибо, политоты ));2;;Ц3;4
8224;10841;266604;82853210;266578;25106701;29.12.2015 8:23;[id6113382|Сергей], вали,вали,на Мурзилку,одноклеточный...Совсем без мозгов...;0;;Г3;4
8225;10842;266605;252652514;266578;25106701;29.12.2015 8:24;[id82853210|Сергей], ты как всегда, примат вырвался из клетки.....<br>Скачи , макак,пока можешь !!!)))??;2;;Н3;4
8226;10843;266606;82853210;266578;25106701;29.12.2015 8:25;[id6113382|Сергей], http://rusdemotivator.ru/uploads/07-13-2012/2012071320073961.png http://vk.com/photo-25106701_392855301;0;; - ; - 
8227;10844;266607;47540014;266578;25106701;29.12.2015 8:26;[id252652514|Алан], PS... сланец .Советская геология отбросила  сланцевые идеи  еще в 60х как экономически не выгодные...Американский сланец по большому счету это ...большая афера по получению безвозвратных кредитов. Но он есть и при повышение цены будет выгоден...дилема,однако.;0;;И4;4
8228;10845;266608;82853210;266578;25106701;29.12.2015 8:26;[id6113382|Сергей], http://demotivation.ru/images/20121229/s14frpntr6xo.jpg http://vk.com/photo-25106701_392855331;0;; - ; - 
8229;10846;266609;252652514;266578;25106701;29.12.2015 8:29;Так , веливозрастный дедуля Мирошниченко пустил в ход  тяжёлую артиллерию  — картиночки из своего свидомого бреда !;2;;Н3;4
8230;10847;266610;82853210;266578;25106701;29.12.2015 8:31;http://vk.com/photo-25106701_392855456;1;; - ; - 
8231;10848;266611;82853210;266578;25106701;29.12.2015 8:33;Горному тунеядцу Аслану деваться некуда,он кромке плешивого вора лизать,ничего не умеет.Вымрет завтра без его подачек.;2;;Н3;4
8232;10849;266612;47540014;266578;25106701;29.12.2015 8:33;[id82853210|Сергей], 15-20 % бюджета это нефть. В прошлом году 12-15 % бюджета дала торговля  зерновыми ... с учетом того,что ваши каклы опять обгадились,то в следующем году их долю поделит РФ и Казахстан....селяви и ничего личного.;0;;У4;2
8233;10850;266613;82853210;266578;25106701;29.12.2015 8:35;[id47540014|Николай], алло,гараж..?! 50% нефть.Остальное металлы, газ и тд и тп.Промышленность и науку плешивый вор убил.У нас их больше нет.Только нефть,-северные бананы!;1;;Б3, Т3;2
8234;10851;266614;71452420;266578;25106701;29.12.2015 8:37;[id82853210|Сергей], даже варя нефтепроводы я ни как не ощущал изменения цены на нефть.так что нехрен постоянно одну и туже хрень писать.;1;;Е1;2
8235;10852;266615;82853210;266578;25106701;29.12.2015 8:38;[id71452420|Александр], амёба тоже ничего не ощущает.Тоже мне,нашел аргумент??!;0;;Н3;4
8236;10853;266616;7442464;266578;25106701;29.12.2015 8:38;http://vk.com/photo-25106701_392855643;1;; - ; - 
8237;10854;266617;71452420;266578;25106701;29.12.2015 8:40;[id82853210|Сергей], а еслиб не так называемый плешивый вор может и страны бы уже небыло.помолись иди гайдара или еще кого нибудь<br>;0;;Х4;3
8238;10855;266618;252652514;266578;25106701;29.12.2015 8:41;[id82853210|Сергей], а чему ты радуешся , кре.т.ин, если Россию ждёт экономический коллапс, кто тебя , старого извращенца,содержать будет?<br>Пенсию тебе , ироду , платить ?<br>Дурень ??????????пескоструйный!!! Чему ты радуешся!???))));0;;Л3, У3;4
8239;10856;266619;153978963;266578;25106701;29.12.2015 8:45;[id82853210|Сергей], российскую промышленность угробил Ельцин со своими корешами типа Ходорковского с помощью так называемой  приватизации . А теперь, 20 с лишним лет спустя, мы это все разгребаем. Но вашу Украину уже ничто не спасет. Россия ей не поможет, а у ваших западных покровителей свои проблемы появились, им не до вас теперь.;1;;Т4, У3;3
8240;10857;266620;82853210;266578;25106701;29.12.2015 8:46;[id71452420|Александр], ты,одноклеточный,в параллельной реальности живешь! Что же тебя природа так так обидела,совсем на мозги поскупилась? Ты Киселев ТВ выкидывай и почитай чуток,поумнеешь может...;2;;Н3,Р3;4
8241;10858;266622;82853210;266578;25106701;29.12.2015 8:48;[id153978963|Алексей], не говори о том,чего не понимаешь! При Ельцине был переход из социализма в капитализм с перестройкой всей экономики при нефти 12-20 баксов.Заводы выпускающие ненужное при Совке стояли на консервации и ждали перепроффелирования.А угробил их глупый вор вова ,пришедший на всё готовое и польстившись на дорогую нефть!;2;;Б3, Т4;4
8242;10859;266623;82853210;266578;25106701;29.12.2015 8:53;http://vk.com/photo-25106701_392856355;1;; - ; - 
8243;10860;266625;82853210;266578;25106701;29.12.2015 8:54;http://vk.com/photo-25106701_392856385;0;; - ; - 
8244;10861;266626;309379415;266578;25106701;29.12.2015 8:55;без Путина путь России к трем буквам;0;;И4;1
8245;10862;266627;292196033;266578;25106701;29.12.2015 8:56;[id82853210|Сергей], в экономике все взаимосвязано! Вначале страдают окраины Империи, а уж потом метрополия! <br>Если у России орз, то у республик уже пневмания, а на Украине так вообще уже туберкулёз! http://vk.com/photo292196033_355147028;0;;И4;3
8246;10863;266628;82853210;266578;25106701;29.12.2015 8:57;[id292196033|Жеванже], ты,педрилла,Тимченко сообщи или Матвиенко...Ты чей вообще холоп то? Или чья?;0;;Н3;4
8247;10864;266629;47540014;266578;25106701;29.12.2015 8:57;[id82853210|Сергей], у НАС...не у вас. А у нас сегодня газ...;0;;Ц3;4
8248;10865;266630;82853210;266578;25106701;29.12.2015 8:59;[id47540014|Николай], а у меня с Тимченко что?;0;;А3;4
8249;10866;266631;47540014;266578;25106701;29.12.2015 8:59;[id82853210|Сергей], иззыди...хохол.;0;;Г3;4
8250;10867;266632;82853210;266578;25106701;29.12.2015 9:00;[id47540014|Николай], перебьешься,неведома зверушка...О стенку побейся,вырожденец...;0;;Н3;4
8251;10868;266633;292196033;266578;25106701;29.12.2015 9:01;[id82853210|Сергей], ВВП ничего Кадырову не дарил, просто всё вернул на свои места, Кадыров доказал свою рачительность и государственность! А хохлам вообще подарили передовое хозяйство и государственность и что в итоге...;1;;Х4,Ч4;3
8252;10869;266634;82853210;266578;25106701;29.12.2015 9:02;[id292196033|Жеванже], пшла подальше.Я с тобой и переписываться брезгую.Заднеприводный путенский электорат...;0;;Г3, Л3;4
8253;10870;266635;292196033;266578;25106701;29.12.2015 9:02;[id82853210|Сергей], http://vk.com/photo-25106701_392856805;1;; - ; - 
8254;10871;266639;82853210;266578;25106701;29.12.2015 9:04;[id41083702|Рустам], еще один невменяемый.Доказывал Ньютон и Ферми! А ты,неумный просто физдишь по глупости...;0;;Н3;4
8255;10872;266640;292196033;266578;25106701;29.12.2015 9:05;[id82853210|Сергей], на запей чайком свой хлебушек! http://vk.com/photo292196033_366165012;0;; - ; - 
8256;10873;266641;82853210;266578;25106701;29.12.2015 9:05;[id292196033|Жеванже], Мурзилка заднеприводная.С вовой общаться будешь,от меня привет не передавай...;0;;Н3;4
8257;10874;266642;292196033;266578;25106701;29.12.2015 9:09;[id82853210|Сергей], скоро на этой стене пиндосы будут вешат сушёные головы хохлов! http://vk.com/photo-25106701_392857112;0;;У3;4
8258;10875;266643;153978963;266578;25106701;29.12.2015 9:10;[id82853210|Сергей], неужели? А кто создал при Ельцине ЮКОС, кто скупил всю промышленность? Его кореша. Да и сам Ельцин - последователь дела Горбачева. Так что Ельцин был другом запада, а не России. Но вот с передачей власти Владимиру Владимировичу они просчитались) А вы скакали при Ющенко, скакали при Януковиче, теперь при Порошенко еще скачете, неугомонные вы наши??;2;;Т4, И3;4
8259;10876;266644;82853210;266578;25106701;29.12.2015 9:10;[id292196033|Жеванже], Не пойму,где Матвиенковская,где Тимченковская,а холоп хохляцкий?;0;;А3;4
8260;10877;266645;292196033;266578;25106701;29.12.2015 9:11;[id82853210|Сергей], http://vk.com/photo-25106701_392857259;1;; - ; - 
8261;10878;266646;82853210;266578;25106701;29.12.2015 9:12;[id153978963|Алексей], Алло гараж??! Ходор просто отстегивал в бюджет,а не в карман вору,за это вор его и съел.А вот Абрамович,Дерипаска и тд,с вором делятся и в шоколаде!;0;;Щ4;4
