12433;81048;178765;148058154;178530;25106701;25.03.2015 13:56;[id1045628|Вячеслав], вата -это жить прошлым, и не думать о будущем по причине того что вата в голове!;0;;П3;4
12434;81049;178767;1045628;178530;25106701;25.03.2015 14:00;[id148058154|Роман], вата в голове у вас, а у меня в голове мозги и понимание, что диалектически история развивается по спирали и будущий социализм и есть настоящее возрождение России. А капитализм - историческая ошибка, так как при обычных уровнях прибыли в России её удел в империализме - быть придатком и должником. Хоть вчера, хоть завтра.;0;;Н3, Е1, И4;4
12435;81050;178769;202959370;178530;25106701;25.03.2015 14:07;Легенда что Запад это эталон свободы, демократии и т.д давно закончилась . И мы видим ту истерию в СМИ запада что виноват в этом Путин и граждане его поддерживающие. А не сам Запад который сделал всё чтоб в нём разочаровались.;0;;П4;1
12436;81051;178775;148058154;178530;25106701;25.03.2015 14:16;[id1045628|Вячеслав], да да капитализьм ошибка но сосиализьм почему то ёбнулся;0;;Ц3;4
12437;81052;178776;1045628;178530;25106701;25.03.2015 14:16;[id202959370|Андрей], а была такая легенда?;0;;А3;1
12438;81053;178782;1045628;178530;25106701;25.03.2015 14:23;[id148058154|Роман], я вас не обрадую: мы пока живы только госсектором, т.е. островом социализма. Социализм накрыл фашисткую Европу. Конечно, Европа стала мстить. Да, в течение нескольких десятков лет относительно небольшой Союз противостоял огромной системе империализма. Извлечь урок из методов ведения Холодной войны не значит усвоить  неуспешность социализма : это, наоборот, архиуспешность - при Холодной войне и её реальных горячих конфлитках строить школы, дороги, заводы, университеты (напомню, что основная масса институтов в России создана в 1918 году), стадионы, ракеты, музеи и т.д. - это нереальная круть. Запад для этого был вынужден выкачивать ресурсы из стран-колоний по разным схемам: через прямую ли администрацию, как до 1960-х, через сеть ли кредитов и ТНК, как в неоколониализме, - не важно.<br>(и давайте без мата и проч., это не вызывает доверия);1;;Ч3;4
12439;81054;178786;148058154;178530;25106701;25.03.2015 14:25;[id1045628|Вячеслав], головушку вам лечить надо ! http://vk.com/photo-25106701_357545297;0;;Н3;4
12440;81055;178791;1045628;178530;25106701;25.03.2015 14:31;[id148058154|Роман], может, вы сможете объяснить свою позицию?;0;;А3;4
12441;81056;178792;202959370;178530;25106701;25.03.2015 14:32;[id1045628|Вячеслав], да вон Роман Суботин до сих пор под парами демократии находиться . Человек живет в Перми и так ненавидит ту страну где живет. Потому что есть легенда что Запад наше всё;2;;Н3;4
12442;81057;178794;1045628;178530;25106701;25.03.2015 14:35;[id202959370|Андрей], власовцы это, а не русские.;0;;Щ3;4
12443;81058;178798;148058154;178530;25106701;25.03.2015 14:51;[id1045628|Вячеслав], скорее власовцы это не совки! а совки -это не русские!)));3;;Н3;4
12444;81059;178799;148058154;178530;25106701;25.03.2015 14:51;[id202959370|Андрей], http://vk.com/photo-25106701_357547678;4;; - ; - 
12445;81060;178817;1045628;178530;25106701;25.03.2015 16:53;Все власовцы так и говорят.;0;;Н3;4
12446;81061;178824;148058154;178530;25106701;25.03.2015 17:13;[id1045628|Вячеслав], кто такие власовцы ватный калмунизд?;0;;А3, Л3;4
