;Unnamed: 0;Id of comment.;Id of author of comment.;Id of post;Author of post;date;text;likes;Unnamed: 7;;
12367;80982;178531;174876216;178530;25106701;25.03.2015 1:22;Конец легенды - начало правды. Что для вас  ужаснее  - решайте сами.;7;;П4;1
12368;80983;178532;24542251;178530;25106701;25.03.2015 1:22;АМЕРИКА!ЧИТАЙ! БОЖИЙ В ПОМОЩИ! ;0;;Ц4;1
12369;80984;178533;17287035;178530;25106701;25.03.2015 1:22;Сразу видно,что эти статьи пишут всякие буржуи которые до бесконечности отдалены от понимания как России так и россиян...нам в России плевать на санкции,мы ради их отмены не вернем Крым никогда пускай даже от этого упадет уровень жизни! Не стоит недооценивать нас!;40;;Ч2, И2;1
12370;80985;178534;223215432;178530;25106701;25.03.2015 1:23;Етишь его корень. Ну и статьи, кто их пишет, понять не могу.;8;;Н2;1
12371;80986;178536;17287035;178530;25106701;25.03.2015 1:24;[id6226856|Булат], есть и такие как вы);0;;Н3;4
12372;80987;178537;249030889;178530;25106701;25.03.2015 1:24;[id6226856|Булат], а ты агент госдепа;0;;Щ3;4
12373;80988;178538;148058154;178530;25106701;25.03.2015 1:26;[id17287035|Денис], ты правда ебнутый ведь! а я думал прикалываешься...;2;;Л3;4
12374;80989;178539;174876216;178530;25106701;25.03.2015 1:26; агент госдепа  и  срань господня  - слова синонимы.<br> ??;2;;Ц3;4
12375;80990;178540;10037324;178530;25106701;25.03.2015 1:27;[id17287035|Денис], людей никто и спрашивать не станет при любом раскладе<br> и референдумы у нас запрещены, даже губернаторов не выбирают, а геополитические вопросы государь решит без вашего ведома и согласия.;2;;Ч3;3
12376;80991;178541;11179915;178530;25106701;25.03.2015 1:28;Пошли они... Хоть и сладкие их цацки..;0;;Г4;2
12377;80992;178542;17287035;178530;25106701;25.03.2015 1:28;[id10037324|Владислав], ну если он их будет решать так,как решил вопрос с Крымом,то народ его поддержит<br>а насчет геополитических вопросов,то согласитесь было бы странно,если бы ими занимались простые граждане;5;;О1;1
12378;80993;178543;174876216;178530;25106701;25.03.2015 1:28;Быстро же они позабыли своего  пастыря . http://vk.com/photo174876216_360968563;1;;Ц3;3
12379;80994;178545;1954875;178530;25106701;25.03.2015 1:29;Странно, но раньше термины  вброс ,  высер  использовались в адрес глупых троллей. Теперь эти термины можно смело применять в адрес некоторых иностранных СМИ и журналистов. <br><br>p.s. Дешевеют люди, все дешевле продаются...;2;;Ч2;3
12380;80995;178546;49280135;178530;25106701;25.03.2015 1:31;Нашу элиту снова решили вывести на чистую воду! Да неужели?! И это при беспрецедентном размахе свободы слова (ну, то есть, беспочвенной критики), антикоррупционной риторики (а именно, разоблачения нехороших чинарей оппозицией и федеральными каналами) и общем подъеме патриотизма в стране (как ватного, так и псевдоинтеллектуального). Плохого в этом минимум, чистка мозгов подразумевает лишение сладкого. Это как воспитание избалованных детей.;2;;Ц4, П4;2
12381;80996;178548;151982648;178530;25106701;25.03.2015 1:32;Конец легенды?!О-о-о!О мистере Путине уже слагают на западе легенды,причем при жизни господина Путина!А пиндосы,и иже с ними,Путина богом не называли-нет,а то я может пропустил-че,а Путин уже бог у англосаксов,а?!;1;;Ц4;1
12382;80997;178549;269924132;178530;25106701;25.03.2015 1:33;Ничего нового, все таже  песня. Откуда они все это берут, рейтинги вообще видели?;0;;Ч2;1
12383;80998;178550;1300303;178530;25106701;25.03.2015 1:36;в паблике неадекватные количества диванных патриотов в комментариях. почему-то только они и бесятся над довольно разумными статьями, даже их не читая http://vk.com/video1300303_171012082;7;;Н3;1
12384;80999;178551;10037324;178530;25106701;25.03.2015 1:41;[id17287035|Денис], для глобальных вопросов вообще-то имеются вроде государственные институты, а Крым и есть геополитическое действие, от которого круги по всему мировому океану пошли. Я лично поддерживаю возвращение Крыма, но ни мое мнение, ни мнение миллионов других граждан в нашей стране не особо влияет на ход событий, которые происходят почему то в основном в интересах горстки людей (бывают правда и совпадения с народными интересами, что вообще редкость), так что не вижу особого смысла рвать на себе тельняшку, пока на нас никто не нападает. Стабильность, она, как-то лучше, когда перекосов нет и решения взвешенно принимаются людьми выбранными и корректируются образованными, в этом и смысл республики.;5;;Ч3, О1;3
12385;81000;178552;88710562;178530;25106701;25.03.2015 1:42;когда я все это читаю - так и слышу поступь призрака холодной войны и нового Карибского кризиса, а на заднем плане заунывно так играет Стинг и его песня тех лет http://vk.com/audio2000427331_353861338;0;;У4;2
12386;81001;178553;1045628;178530;25106701;25.03.2015 1:43;Истерические выкрики сплочистов слышны в вакууме политики, разгромившей настоящую оппозицию - коммунистов. Беда в том, что Путин прихватизировал левые настроения в России, оттого и расщепления сознания у нас.;1;;И4;2
12387;81002;178554;254284318;178530;25106701;25.03.2015 1:45;на нас не действуют ваши провакации)мы очухались и поняли что к чему)россия возродиться вот увидите;0;;И2;1
12388;81003;178555;22229939;178530;25106701;25.03.2015 1:48;Собеседник автора статьи - Андрей Грачев, проживающий ясное дело в Париже и зарабатывающий себе на хлеб такими статьями. Прошлый его хит - «Михаил Горбачев. Человек, который хотел как лучше». Оставьте кусок хлеба пожилому эмигранту ))) Критика России это его хлеб и он увы умрет если не будет писать подобные статьи. Проявите сочувствие )));4;;Ц2;1
12389;81004;178556;1045628;178530;25106701;25.03.2015 1:51;[id254284318|Дмитрий], возродится в социализме она, в этом историческая задача нашей страны!;0;;И3;3
12390;81005;178557;254284318;178530;25106701;25.03.2015 1:54;[id1045628|Вячеслав], на ошибках учаться,я думаю если у россии все получиться,а точнее излечиться от клещей,больше не будет всяких предателей горбачевых ,ельциных...и подчистят гнилье с гос аппарата,и будут смотреть в оба,чтобы ни одна проплаченая собака не пролезла.;0;;И3;3
12391;81006;178558;223525746;178530;25106701;25.03.2015 2:00;[id17287035|Денис], ,уровень жизни не нужно не дооценивать.,все нужно с разумом согласовываясь измерять.;0;;П3;3
12392;81007;178559;1045628;178530;25106701;25.03.2015 2:02;[id254284318|Дмитрий], золотые слова! Ещё бы я добавил, что закон развития по спирали никто не отменял: не возвращаться к тому социализму, а строить новый, учитывая опыт и первого социализма, и опыт триколорного капитализма.;0;;Х3;3
12393;81008;178560;223525746;178530;25106701;25.03.2015 2:06;Конец, не конец агрессивные по ту сторону ,пускай подсчитают во сколько раз Нато творило зло с другими странами и продолжают!;1;;Ж4, Х4;1
12394;81009;178561;36757634;178530;25106701;25.03.2015 2:14; Однако России пришлось заплатить страшную цену: экономический кризис, санкции, атмосфера войны с Европой, которая оставляет для России лишь мифическую перспективу Евразии, то есть сомнительного альянса с Китаем и всеми противниками европейских идей.  Страшная цена - это война на своей территории (ВОВ, Чечня... ) а то что сейчас происходит, это так, мелкие неприятности. После развала СССР люди не знали как относится к стране где они живут. Сейчас ярко видно, народ стал гордится своей страной. Нам ставили в пример США с флагами в каждом дворе, Германию с поголовным знанием гимна страны, Англию с гордостью за исторически сложившуюся королевскую династию. Я простой человек и общаясь с простыми людьми вижу и слышу гордость за свою страну.;1;;П4;1
12395;81010;178562;254284318;178530;25106701;25.03.2015 2:17;[id1045628|Вячеслав], работать много над чем,одна удавка цб чего стоит,потом развитие мне кажеться само собой пойдет,если весь мир не отвернеться как всегда;0;;И3;1
12396;81011;178568;57757243;178530;25106701;25.03.2015 2:47;пошли они на х.. западные сми!только лают на медведя,а укусить не могут сук.!!!;0;;Г2, Н2;1
12397;81012;178571;57757243;178530;25106701;25.03.2015 2:50;[id36757634|Роман], не неси чепуху про то что нам пришлось заплатить!мы,Русские это переживем!;1;;И4;4
12398;81013;178573;18855016;178530;25106701;25.03.2015 3:25;зарабатывайте, нищеброды ольгинские, зарабатывайте. вам за предательство и фальшь так окупится еще, охреневать будете от закона бумеранга;9;;Щ3, У3;4
12399;81014;178587;18753255;178530;25106701;25.03.2015 6:00;Ты не полностью пост Романа прочитал)));0;;Б3;4
12400;81015;178609;147633360;178530;25106701;25.03.2015 6:53;Короче все обосрались , но продолжали придерживаться позиции что дурак это Иван;3;;Ц2;1
12401;81016;178651;146499484;178530;25106701;25.03.2015 8:55;закат путина эпохи путина его поддерживаю какие то жалкие немногим более 80% процентов населения.;1;;Ц4;1
12402;81017;178658;53842937;178530;25106701;25.03.2015 9:21;в иносми работают лошки которые работают на пиндосов;1;;Щ2;4
12403;81018;178676;1045628;178530;25106701;25.03.2015 10:24;[id146499484|Александр], поддерживают не потому, что  поднял Россию с колен , а не от большого ума. У страны долг в 600 млрд долларов при падающем ВВП и растрате денег, отложенных для пенсионеров, солдат, врачей и т.д., у нас война на границе, бабки мрут из-за пачки масла, рубль болтается на биржах, аки говно в проруби, заводов десятки закрываются, акции компаний уходят на запад и в оффшоры, дети тупеют, спутники падают, по всей стране мафия, теперь, правда,   цивилизованные  и т.д. А ресурсы страны выкачиваются так, что Советам и не снилось. Умопомешательство народа необъяснимо! Во власти находятся компрадоры, а народ и доволен! Страну распродают, а народ называет это возрождением страны. Ум-то есть?;0;;Ч4;1
12404;81019;178679;146499484;178530;25106701;25.03.2015 10:29;[id1045628|Вячеслав], процветающею страну при ельцине до чего довёл , ужас какой . <br> А бабки тоже мрут из за путина , ох он коварный какой даже массовый мор бабок организовал .Вот если у вас от не свежей пищи диарея приключиться тоже пойдёте ненавистный режим обличать ?);1;;Ц3;3
12405;81020;178684;146499484;178530;25106701;25.03.2015 10:39;[id1954875|Владимир], некоторые сми и журналисты и есть глупые троли .;0;;Н2;3
12406;81021;178686;1045628;178530;25106701;25.03.2015 10:43;[id146499484|Александр], вы только про бабку и разглядели? Хм. А 600 млрд вас радуют? Вот оно где -  процветание : нереальный вывоз ресурсов и огромные долги.<br>Да мы ещё и США с Украиной кредитуем, умора! Донбассу они гумколонны, а Украине - миллионы долларов.;0;;Ч3,Ч4;3
12407;81022;178688;146499484;178530;25106701;25.03.2015 10:46;[id1045628|Вячеслав], я глупость расмотрел , смешали в кучу смерть бабушки и корпоративные , а обвинить умудрились путина .;0;;Н2;3
12408;81023;178690;1045628;178530;25106701;25.03.2015 10:57;[id146499484|Александр], потому что он - лицо системы, и как человек с рейтингом 88 уровня уже бы мог начать что-то делать, а он ограничился перекачкой миллиардов от ельцинской  семьи  на счета владельцев кооператива  озеро . При таком уровне доверия строят социализм без революции, а он отдаёт страну   на поток и разграбление  .;0;;Ч4;1
12409;81024;178691;146499484;178530;25106701;25.03.2015 10:59;[id1045628|Вячеслав], социализЬм уже строили , построили какого то мутанта , повторения как то не особо хочется .;0;;Б3;4
12410;81025;178694;1045628;178530;25106701;25.03.2015 11:03;[id146499484|Александр], мутанта, который твоих родителей и бабушек вывел из тьмы и поселил в городах со школами и ресторанами, обучил письму, выиграл самую страшную войну, делал ставку на развитие социальной сферы, на гордость за страну? Это - мутант?;0;;Б3,Ж3;4
12411;81026;178703;896443;178530;25106701;25.03.2015 11:28;[id1045628|Вячеслав], спроси у миллионов убитых и замученных - им стало лучше от  развитой социальной сферы ?;0;;Т4;4
12412;81027;178705;1045628;178530;25106701;25.03.2015 11:32;[id896443|Юрий], наверное, от 100 миллинов или у вас от 60 миллионов?;0;;Н3;4
12413;81028;178707;287804305;178530;25106701;25.03.2015 11:35;народ без царя жить не может. http://vk.com/photo-25106701_357530920;1;;Ц4;3
12414;81029;178723;48539826;178530;25106701;25.03.2015 12:26;Долой Путина! Ельцин наше все!<br>Видать так и думает запад.;0;;Ц4;3
12415;81030;178724;148058154;178530;25106701;25.03.2015 12:28;[id48539826|Илья], БЕДА В ТОМ ЧТО ВАТА НИХУЯ НЕ ДУМАЕТ-НЕЧЕМ!)))))) http://vk.com/photo-25106701_357534704;4;;Н3 ;4
12416;81031;178727;1045628;178530;25106701;25.03.2015 12:33;фу, какая мерзкая картинка.;0;;Г4;4
12417;81032;178729;48539826;178530;25106701;25.03.2015 12:35;Роман, откуда тогда нас столько?;0;;А3;4
12418;81033;178730;146499484;178530;25106701;25.03.2015 12:40;[id1045628|Вячеслав], в гражданскую войну это мутант , и то во что всё выродилось к 80м годам , то же мутант . Идея может и не плохая но реализация ни к чему хорошему не привела. Второй раз ставить эксперименты не тянет .;0;;Т4;4
12419;81034;178736;1045628;178530;25106701;25.03.2015 12:47;[id146499484|Александр], это не эксперимент, а единственный выход России. Реализация в условиях разрухи после Второй Мировой, когда были убиты миллионы мужчин, адекватная. Дороги, города, праздники, фильмы, музыка, образование, спортивные достижения, через 15 лет после войны мы уже запускаем спутники и ракеты с собаками, а потом и с человеком в космос. Это плохая реализация? Это отличная реализация. Всё это похерили те, кто хотел жить на откатах с нефти, газа и иностранных заводов и банков, которые будут вывозить из страны миллиарды, а ввозить китайские тряпки и голландские цветы. Социализм нужно было вести вперед, а не отбрасывать страну на 100 лет назад. У капитализма в России нет ни одного шанса, потому что нет никакого капитализма, а есть мировой империализм, а мы - его часть, без вариантов.;0;;Ч3, О1, Т4;4
12420;81035;178739;148058154;178530;25106701;25.03.2015 12:50;[id48539826|Илья], из совка ..из Ольгино - хуй вас знает откуда вы лезете..Пропадете разом как только полумный ботоксный упырь свалит )) http://vk.com/photo-65718178_358582202;0;;У3;4
12421;81036;178740;146499484;178530;25106701;25.03.2015 12:51;[id1045628|Вячеслав], в 17м году это эксперимент на лбдях с развалом страны , утерей иерриторий и гражданской войной , более менее исправить этот п...ц смон пожалуй сталин и то выесьма высокой ценой , а с его уходом всё практически просрали выстроив какую то гнилую систему с престарелым политбюро  , а горбачёв окончательно всё похерил со своей перестройкой , вот теперь китайцы пытаются не наступать на те же грабли .;1;;Ч4, У4;4
12422;81037;178742;148058154;178530;25106701;25.03.2015 13:03;[id1045628|Вячеслав], правдивая -калмунистов корежит!)));0;;Н3;4
12423;81038;178746;148058154;178530;25106701;25.03.2015 13:15;http://vk.com/photo-25106701_357539085;0;; - ; - 
12424;81039;178752;1045628;178530;25106701;25.03.2015 13:25;[id148058154|Роман], правдивая? Ну-ну);0;;Ц3;4
12425;81040;178753;48539826;178530;25106701;25.03.2015 13:28;[id148058154|Роман], все мы пропадем. Кроме тех конечно, кто задницу западу лижет.;1;;И3;4
12426;81041;178755;1045628;178530;25106701;25.03.2015 13:31;[id146499484|Александр], Гражданскую коммунисты начали? А не белые, не всякая шваль, купленная Англией и Францией (поддержанная их частями!)? Про интервенцию забыли?<br>А забыли, как, в каком дерьме жили русские крестьяне? Эксперимент по выведению людей из дерьма действительно окончился неудачей: некоторых хоть в золото обряди, а он срать посреди театра так и будет.<br>Конечно, Западу не нравился социализм, сколько тонн помоев они вылили на нас. А всё почему? Потому что ни одна капстрана не смогла стать успешной, капитализм - историческая неудача. Не социализм! А капитализм, который не может выжить вне нагибания и вывоза-ввоза капитала из колоний, без эскалации насилия и грабежа. Чем бы были капстраны без всех своих МВФ, МБРР, НАТО,  иностранных легионов  и борьбы за  права человека в Африке ?;0;;Ч3,Ч4;4
12427;81042;178758;148058154;178530;25106701;25.03.2015 13:38;[id1045628|Вячеслав], история -пробел в мозгах калмунистов!;0;;Н3;4
12428;81043;178759;36757634;178530;25106701;25.03.2015 13:44;[id57757243|Андрей], ты переживаешь а я живу. И люди окружающие меня живут. И что ты называешь чушью я искренне не понимаю!!!;0;;Е1 ;4
12429;81044;178761;1045628;178530;25106701;25.03.2015 13:47;Типа, Роман, крикнул из кустов  занято  - и порядок?));0;;Ц3;4
12430;81045;178762;148058154;178530;25106701;25.03.2015 13:48;[id1045628|Вячеслав], иди историю учи не по учебникам! вата!)));0;;Р3, Щ3;4
12431;81046;178763;1045628;178530;25106701;25.03.2015 13:49;[id148058154|Роман], ad personam, слив засчитан.;0;;Г3;4
12432;81047;178764;1045628;178530;25106701;25.03.2015 13:55;[id148058154|Роман], а вообще:  вата  это что? Если это означает коммуниста, который обожает свою страну, но ненавидит её капитализм и её компрадоров, тогда да, пусть так: я - вата.<br>И?;0;;А3, Е1;4
