4192;64963;199254;69583039;198828;25106701;18.05.2015 15:34;[id132608829|Александр], а потерями: Франция тут вовсе ни при чем. А вот Англия ещё как подготовилась - стратегически. И была и есть на коне, а СССР потерял сотни миллиардов долларов, миллионы людей и так и не вернул себе территории на постоянной основе. И, опять же , в отличие от Англии - не смог поменять стратегию управления территориями. И только;0;;И4;3
4193;64964;199257;69583039;198828;25106701;18.05.2015 15:37;[id60120722|Роман], Бородинское сражение - это, конечно, очень распиаренная битва. Но даже в общедоступных источниках численно в разных направления ополчения была 10% и больше. Ну хотя бы вот, раз уж так любы ссылки - <br><br>https://ru.wikipedia.org/wiki/%D0%91%D0%BE%D1%80%D0%BE%D0%B4%D0%B8%D0%BD%D1%81%D0%BA%D0%BE%D0%B5_%D1%81%D1%80%D0%B0%D0%B6%D0%B5%D0%BD%D0%B8%D0%B5<br><br>Накануне сражения 25 августа (6 сентября) по приказу Кутузова в район Старой Смоленской дороги был направлен 3-й пехотный корпус генерала Тучкова 1-го и до 10 тысяч ратников Московского и Смоленского ополчений.<br><br>А причина по ополчению простая:  Согласно сохранившимся ведомостям из архива РГВИА, русская армия потеряла убитыми, ранеными и пропавшими без вести 39 300 человек[67] (21 766 в 1-й армии, 17 445 во 2-й армии), но с учётом того, что данные ведомостей по разным причинам неполны (не включают потери ополчения и казаков) . Считали тогда людьми - офицеров, остальное - мясо, кот. учитывать не особо нужно. У казаков. правда, был свой учет, но и только;0;;Ч3;4
4194;64965;199260;69583039;198828;25106701;18.05.2015 15:38;[id60120722|Роман], отлично. Я против этого ничего не имею: я говорю о том, что а) пока власть не нашла контакт с народом - ничего не выходило :  б) стратегии не было, была тактика, разработанная по факту  превосходят ,  отличный стратег , а не было стратеги из-за п. а;0;;В3;4
4195;64966;199267;69583039;198828;25106701;18.05.2015 15:44;... ну и для всех: вводим - обычай захват столицы, капитуляция захват столицы, правовой обычай захвата столицы и т.д. в любом поисковике и получаем 100 примеров, где этот обычай раскрыт - от Европы Нового времени (да и Новоейшего) и до Древнего Китая. Если это не обычай, ну что ж, тогда и белый цвет чёрного цвета.;0;;Ж4;4
4196;64967;199272;132608829;198828;25106701;18.05.2015 15:48;[id69583039|Владимиръ], ну слава Богу я вас отвадил от  юрЫстической научности ??<br>»ждали до последнего<br>ну наверно аустерлиц, эйлау, фридланд были в какой-то параллельной вселенной<br>Не, я ,конечно, понимаю,что вы в тотал варе бы живо разделались бы с бонапартом, гитлером и прочими, но реальность посложнее штоле. А стратегия выжженной земли очень распространена еще со времён скифов. Для тех кто в танке еще раз: наполеоновская армия была численно и качественно (в плане логистики) лучше российской. Ни одна армия европы не могла добиться победы над наполеоном, не имея численного превосходства.<br>Ваши ссылки, меня порадовали, вы ими доказываете,то что я и не опровергал. То что офицерские партизанские отряды путали с французами -эта тема даже немного затронута в войне и мире. ну и это какбэ эксцесс войны, обыденно же. Хотя , куда куда кутузову , аракчееву и раевскому до диванных аналитиков вроде вас??<br>Нужно было сохранить армию и эта задача была выполнена, зато в испании-то руководство было лучше чем в  сраной рашке  и армия была рассеяна и с французами воевало лишь местное население,что вылилось в чудовищные жертвы для последних.<br>Еще раз, где пруфы билли? Где ссылки,что взятие столицы-автоматическое поражение и что москва была столицей? <br>»плевать она хотела на свой народ<br>То есть выбить наполеона из россии,чтобы он снова вернулся и на этот раз уже с опытом?  Дядя Петя ты дурак? (с)<br>»взятие столицы было обязательным<br>Обязательным был захват франции и капитуляция наполеона. Англичане и испанцы наступали с юга, австрийцы, русские и пруссаки с востока.<br>»т.к. Москву никто и никуда не переносил<br>Пока не будет пруфов -это твои фантазии<br>»И Смоленск и в 1812, и в 1940х был один и тот же<br>И ничего, что военная мысль после ПМВ кардинально изменилась и сравнивать те войны -глупо;0;;Ц3, И3;4
4197;64968;199282;132608829;198828;25106701;18.05.2015 15:56;[id69583039|Владимиръ], »потери России и Англии<br>»потери США и России<br>давай так: Если ты мне не найдёшь сухопутную  границу между германией, сша и англией за 10 минут, то можешь выбросить свой аргумент? Окей? А не то мне твою тупость разбирать неинтересно.<br>»И была и есть на коне, а СССР потерял сотни миллиардов долларов<br>Англичане же , как известно, не понесли финансовых потерь, ага<br>»миллионы людей<br>Победить германию с потерями в тысячи? Лол, это слабоумие<br>»и так и не вернул себе территории на постоянной основе<br>Дубль 2: если не покажешь мне нынешний контроль британии над индией и пакистаном, то можешь выбросить свой аргумент в помойку<br>»не смог поменять стратегию управления территориями<br>Какая стратегия? в британской империи начался процесс деколонизации, который ее и развалил. <br>И что вы чеченские кампании вспомнили? Потери ичкерии были больше чем у федеральных сил.;0;;Н3, И3;4
4198;64969;199291;69583039;198828;25106701;18.05.2015 16:05;[id132608829|Александр], остроумие - это лишь свидетельство отсутствия острого ума: ни от чего вы меня не отвадили. <br><br>01. Для тех кто в танке: да она была численно лучше и больше только потому. что ополчение не хотели призывать и обучать сразу. Если бы призвали 400 000 и дали бы им навыки - Наполеон бы 100 раз подумал, надо ли вообще идти. Он-то был стратег.<br>02. Диванный аналитик - это вы, я вам ссылки привел по 1 причине - вы просили. По факту: были крестьянские отряды 9см. ссылку выше), кот. работали лучше, эффективней, без всяких там  санкций  сверху, а партизанские отряды офицеров месяцы (!) не могли ничего сделать кроме единичных акций, т.к. с народом связи не было. Это как раз все описано выше. Войне 1812 г. я посвятил 2 года (2001-2002 г.) и поэтому знаю, о чем говорю. Более того, все в Вики есть, хоть я к ней и предвзято отношусь, но ссылок там хватает - можете проверить.<br>03. Армию сохранили и проч. - это никто и не оспаривает. Факт а) Москву потеряли, б) войну выиграли, когда вошли в контакт с населением, в) ополчение привлекли по факту, а не до начала военных действий<br>04. О военное обычае я уже написал - см. выше. По 2 раза обедню глухим не служат<br>05. Наполеона выбили с помощью народа, кот. поставили в известность ВО время, а не ДО войны - вот факт. И пошли брать Париж, дабы восстновить монархии, а не чтобы потом воздать должное своему народу. И закончилось все это в 1917 г. вполне ясно.<br>06. Идиотское слово - пруф, когда речь идет о русской истории. Ещё раз: ссылка - это лишь от того, что у вас дефицит знаний. Ну что - https://ru.wikipedia.org/wiki/%D0%A8%D1%82%D1%83%D1%80%D0%BC_%D0%91%D0%B5%D1%80%D0%BB%D0%B8%D0%BD%D0%B0  Захват немецкой столицы был кратчайшим путем к капитуляции Германии , ну или по 1814  https://ru.wikipedia.org/wiki/%D0%92%D0%B7%D1%8F%D1%82%D0%B8%D0%B5_%D0%9F%D0%B0%D1%80%D0%B8%D0%B6%D0%B0_%281814%29  Франции капитулировала на следующий день, прежде чем Наполеон успел перебросить войска для её спасения. Сражение за Париж стало в кампании 1814 года одним из самых к;0;;Б3, И3, Н3;4
4199;64970;199299;69583039;198828;25106701;18.05.2015 16:12;[id132608829|Александр], <br><br>01. я на ты не переходил. По факту: у Германии было все для захвата Англии, а потом - США. Но он все оттянули на Восточный фронт. Вот и вся песня. Сухопутная граница ни при чем. Немцы успешно воевали с Англией ровно до 2го фронта и выиграли (об этом писал Черчиль), если бы не открытие 2го фронта. <br>02. Понесли. Но несравненно меньшие - <br><br>CCСР 625   <br>США 341<br>   Великобритания 150<br><br>В 4 раза. А ещё сколько Англия заработала на поставках в СССР?<br><br>03. я не переходил на ты. Это хронологический нонсенс - мы ведем речь о 40-50 или о 15м 2000х? Разница есть. По факту: все фин. учреждения в Индии и Пакистане - евпропейские или американские. Нет? Как и в Малайзии и др. восточных странах. Хотя, конечно же, нужен пруф))) Увольте - это уже не смешно.<br>04. Деколанизацию начали сами англичане, кот. поняли, к чему она ведет (вливания с каждым годом были больше, а приход - меньше). И поэтому вместо полит. контроля они сделали экономический, кот. и есть до сих пор. Правда, США их переиграли этой же стратегией (а их _ Китай) .но это уже другая история, в кот. мы все равно не участвуем.<br>05. А вспомнил, потому что, подготовленная завершающая стадия и неподготовленная абсолютно 1я кампания - это как раз то, о чем говорю: когда власть готова и НЕ готова - потери разные и по качеству, и по количеству.;0;;Б3, И4;4
4200;64971;199319;132608829;198828;25106701;18.05.2015 16:38;[id69583039|Владимиръ], призвать 400.000 тысяч? России 19 века? ??<br>ну были крестьянские отряды, я это где-то отрицал? вспоминайте пример испании. Все ваши аргументы были бы прекрасными, но такая ситуация была во всех европейских странах.<br>»я посвятил 2 года<br>ну ладно<br>чувак, то что у тебя описывается в 03, я не оспаривал.<br>»О военном обычае<br>Да нигде вы не писали, это продолжение ваших фантазий войны проигрываются по разным причинам и не всегда из-за столиц, китай несмотря на потерю нанкина сопротивлялся японии, равно как и сша после потери вашингтона продолжали сражаться  в 1812 году.<br>»Идиотское слово - пруф<br>Конечно, подпиндоссовское, рептилоидное<br>»ссылка - это лишь от того,что у вас дефицит знаний<br>Лол, более абсурдного утверждения я еще не слышал, я могу написать, что наполеон сказал, что хабаровск-столица россии и когда вы потребуете от меня доказательств, сказать: это у вас от дефицита знаний<br>Еще раз:<br>Берете свой учебник географии<br>1)Смотрите территорию захваченную наполеоном в россии по отношению к остальной территории, <br>2)делаете то же самое с францией, если у вас даже после этого не дойдёт, то увы, медицина бессильна(<br>»в Ираке<br>Параллельно шёл захват всех крупных центров+багдад занимает центральное положение. Наполеон взял только москву, такие центры как киев, петербург были целы<br>»русские гибли больше: в 1МВ<br>Потери РИ такие же как и у противостоящих им турецких, австрийских и немецких частей<br>»во 2МВ<br>Потери СССР также сопоставимы с потерями стран ОСИ на востоке: 1.3 к 1. <br>»наплевательского отношения<br>Очередные слова без фактов, мне надоедает уже .<br>»Сухопутная граница не при чем<br>Да, одно дело через пролив тащить танки и пехоту, другое наступать по суше, вы надеюсь уже фельдмаршал?<br>»Немцы успешно воевали с Англией ровно  до 2го фронта<br>До Эль-Аламейна тащемта, хотя б про стратегические бомбардировки и итальянскую и африканскую кампании почитали бы...<br>»и выиграли (об этом писал Черчиль), если бы не открытие 2го фронта. А я знал, что СССР, ;0;;Ж3, К3, Ц3;4
4201;64972;199320;69583039;198828;25106701;18.05.2015 16:38;[id132608829|Александр], ну да... Там было и больше. И было по факту (ну хоть ссылку что ли посмотрите).;0;;Р3;4
4202;64973;199321;69583039;198828;25106701;18.05.2015 16:39;[id132608829|Александр], да, только Россия далеко не одновременно с евр. странами вступила в войну и все равно просила народ. Но этот факт почему-то вы признать не хотите.;0;;Б3;3
4203;64974;199328;69583039;198828;25106701;18.05.2015 16:53;[id132608829|Александр], купитуляция столицы - капитуляция в войне. Исключения были, но это именно исключения. Про Вашингтон - это не тот пример, кот. нужно приводить, т.к. это государство до конца формировалось и после. Я писал - в комм. не раз, и написал в комментарии выше. См., читайте.<br><br>Медицина бессильна лишь к хамам: остальное - дело желания и времени. По сути - география как раз утверждает, что время на подготовку стратегии и территория для этой стратегии у России были. а сделали все, повторюсь, по факту, а не до.<br><br>https://ru.wikipedia.org/wiki/%D0%9F%D0%BE%D1%82%D0%B5%D1%80%D0%B8_%D0%B2_%D0%9F%D0%B5%D1%80%D0%B2%D0%BE%D0%B9_%D0%BC%D0%B8%D1%80%D0%BE%D0%B2%D0%BE%D0%B9_%D0%B2%D0%BE%D0%B9%D0%BD%D0%B5 - это, конечно, можно по-разному смотреть, но факт есть факт: русских солдат гибло больше. <br><br>Потери СССР во 2МВ - я умолчу. Сопоставимы - так сопоставимы. Особенно мирных жителей. Пусть будет так. <br><br>У меня-то каждое слово с фактом, а вот я в ответ так и не дождался ваших ссылок:<br><br>что крестьянские отряды действовали хуже офицерских<br>что 400 000 чел. с лишним ополчения нигде не использовалось<br>что захват столицы - не есть правовой обычай международного права <br>что армия была готова, а потому нужды в ополчении - не было<br>что ополчение не участвовало в Бородиснком сражении<br>что налеты офицерских партизанских отрядов были на полностью эффективны до момента договоренности с населением<br><br>Итальянская и африканская кампании... замечательно: читал. И там проблемы немцев начались от итальянцев, как и на Балканах, а не от того, что проблемы были у немцев. И опять же - действия разведки Великобритании.<br><br>И не надо врать: я не унижал достоинств победы СССР, я лишь утверждаю, что Сталин не было готов к войне так, как должен был и то, что измучал народ, кот. победил и мучал после - тоже факт. Как и цари.<br><br>Да, признак господства, кот. выражется в курсе фунта и доллара, в том что РФ по плану стала сырьевым придатком, а Азия - работорговым регионом с дешевой рабочей силой, кот.;0;;Ж3, И4;3
4204;64975;199329;6113382;198828;25106701;18.05.2015 16:53;[id132608829|Александр], если бы были крупные восстания, то Наполеон бы до России не факт, что дошел бы, а вот держат войска, чтобы таких восстаний не было в оккупационных странах - это прописная истина. Плюсовать собираюсь через знак плюс (нигде именно 1812 год до этого не фигурировал - и это уже просто передергивание), а про Англию комментариев не будет? или удобно промолчали о факт, который неудобен. Вы не сказали что единственным, так же как и не написали одним из, более того, дважды повторили один и тот же довод, НИ РАЗУ не упомянув, что этот фактор не единственный, так что здесь уже игра слов, четкое изложение мысли полностью лежит на авторе этой мысли или высказывания. Великобритании и без Франции колоний хватало, плюс у Франции все равно еще много осталось земель заморских. На самом деле, Александр, то что излагаете, верно, я вступил в разговор только из-за того, что мне оскорбительным показались ваши высказывания в адрес с тем, с кем вы переписывались до меня, плюс ваши высказывания были истиной последней инстанции, по крайней мере мне так показалось, проявите чуть уважения к собеседникам, в конце конце другим только это важно, а не ваши, как и мои кстати познания или незнания в истории;0;;Ж3, Н3;4
4205;64976;199340;132608829;198828;25106701;18.05.2015 17:04;[id6113382|Сергей], ну крупных восстаний судя по всему у вас не будет -да?  Да, нужны были войска для порядка, но эьи территории поставляли новобранцев, поэтому эти территории мы и плюсуем.<br>»а про Англию комментариев не будет? или удобно промолчали о факт который неудобен<br>Если назовёте мне английские подразделения, воевавшие на стороне россии в русской кампании, то я с вами соглашусь, а так , увы, нет. <br>Ваши придирки в стиле  ты не уточнил  , неуместны.<br>»Великобритании и без Франции колоний хватало<br>Я это разве отрицал?<br>Не, мои слова не истина в последней инстанции,   я знаю,что ничего не знаю  (с)<br>;0;;Ц3, К3;4
