;Unnamed: 0;Id of comment.;Id of author of comment.;Id of post;Author of post;date;text;likes;Unnamed: 7;;
4102;64873;198829;82853210;198828;25106701;17.05.2015 11:05;Какой в этом смысл,если История учит,что она ни чему не учит,а полководцы всегда готовятся к прошедшей войне ?;1;;Ж4;1
4103;64874;198830;71481683;198828;25106701;17.05.2015 11:14;И главный из них. Нехер лезть на Россию;7;;П4;1
4104;64875;198832;82853210;198828;25106701;17.05.2015 12:05;Чингиз-Хан всего 300 лет дань собирал...;2;;Ц4;2
4105;64876;198833;69583039;198828;25106701;17.05.2015 12:07;[id82853210|Сергей], факт. А ещё мы проиграли 1ю Мировую, Русско-японскую и множество других войн... Факт всегда в том, что наша власть никогда не готовится к войне, а всегда противостояние выигрывает народ: будь то Смута или Великая Отечественная.;0;;Т4;2
4106;64877;198834;82853210;198828;25106701;17.05.2015 12:08;[id69583039|Владимиръ], здесь соглашусь...Всегда вопреки;0;;В3;3
4107;64878;198835;99062150;198828;25106701;17.05.2015 12:14;[id82853210|Сергей], народ вопреки руководству))) Вам нужно просто ознакомиться с приказами Сталина времен войны.;1;;Ц3;4
4108;64879;198836;82853210;198828;25106701;17.05.2015 12:15;[id99062150|Санат], людей не жалеть ? Знаем...;0;;В3;4
4109;64880;198837;99062150;198828;25106701;17.05.2015 12:16;[id82853210|Сергей], а есть источник??? Где документы, подтверждающие, что это было сказано?;0;;А3;4
4110;64881;198838;82853210;198828;25106701;17.05.2015 12:16;[id99062150|Санат], Историю почитай.Не в двух словах.;0;;Р3;3
4111;64882;198839;99062150;198828;25106701;17.05.2015 12:18;[id82853210|Сергей], какую историю? эта та, которую на гранты пишут иностранные, деньги Фонда Сороса, например? Конкретный источник назовите! Или  одна бабушка сказала  - такой источник у Вас;1;;Н4, А3;3
4112;64883;198840;82853210;198828;25106701;17.05.2015 12:19;[id99062150|Санат], мне пустословие не интересно.Хочешь верь,хочешь нет,мне параллельно...;0;;Г3;4
4113;64884;198841;99062150;198828;25106701;17.05.2015 12:21;[id82853210|Сергей], это кто пустословит? так и думал, что просто пи..те, не зная ничего конкретного. Вы хоть малым коллективом руководили??? Невозможно было победить в этой чудовищной войне без создания единого организма из народного хозяйства и армии, без пропаганды, переустройства жизни, стратегии ведения войны и много еще чего, что не делается без грамотного руководства;2;;Ф3, Н3, И4;4
4114;64885;198842;82853210;198828;25106701;17.05.2015 12:23;[id99062150|Санат], победили только вопреки всем этим  создателям  Как всегда трупами завалили,вопреки бездарности руководства.;0;;И3;3
4115;64886;198843;99062150;198828;25106701;17.05.2015 12:26;[id82853210|Сергей], боевые потери армий Германии и СССР примерно равны. Основные потери СССР по числу людей - это зверски убитые мирные граждане. Советские войска тоже могли бы поубивать беззащитных немцев и прочих фашиствующих, но не делали этого;2;;И3;4
4116;64887;198844;99062150;198828;25106701;17.05.2015 12:27;[id82853210|Сергей], почему тогда Франция не победила вопреки?;0;;А3;3
4117;64888;198845;99062150;198828;25106701;17.05.2015 12:27;[id82853210|Сергей], у них были лучшие в мире танки и по количеству больше, чем у немцев;0;;И3;4
4118;64889;198846;82853210;198828;25106701;17.05.2015 12:28;[id99062150|Санат], у них Крепостого права не было,а у нас фактически было. Ни шагу назад,и расстрел и репрессии семьи.А во Франции люди главным были.;1;;И3;3
4119;64890;198847;99062150;198828;25106701;17.05.2015 12:29;[id82853210|Сергей], бред, короче. Давай до свидания;0;;Г3;4
4120;64891;198848;82853210;198828;25106701;17.05.2015 12:30;[id99062150|Санат], танки наши были расчитаны на Германские шоссе,на колесах,а на гусянках появились только в 42-м году.;0;;И3;3
4121;64892;198849;82853210;198828;25106701;17.05.2015 12:31;[id99062150|Санат], учи Историю не по официальным источникам.;0;;Р3;4
4122;64893;198850;217353012;198828;25106701;17.05.2015 12:31;[id82853210|Сергей], ой не смеши . Во Франции людей за людей не считали . Инквизиция чего стоит . А так там любой может не дожить до завтра . И солдат тоже гнали на убой и командовали ими командиры .;1;;Б3, И3;4
4123;64894;198851;82853210;198828;25106701;17.05.2015 12:32;[id217353012|Sergey], ага 15-й век и 20-й.Так и говорят,что на 500 лет от людей отстаем...;1;;Т1;4
4124;64895;198853;132608829;198828;25106701;17.05.2015 13:05;Сергей, <br>»Чингих-Хан всего 300 лет дань собирал<br>Настало время охуительных историй:<br>1) чингисхан умер задолго до батыева нашествия<br>2) россии как единого государства не существовала, тот же новгород так и не был атакован монголами<br><br>»вопреки<br>Ну да, и аустерлиц французы выиграли вопреки наполеону, и измаил русские брали вопреки суворову<br>И в чем же выражалось  бережность людей  у французов?;0;;Б3, Ж3;3
4125;64896;198854;82853210;198828;25106701;17.05.2015 13:06;[id132608829|Александр], а вы образы понимаете?;0;;А3;4
4126;64897;198855;82853210;198828;25106701;17.05.2015 13:07;[id132608829|Александр], всего зоо !!!!!!!!!!!!!;0;;Ц3;4
4127;64898;198856;132608829;198828;25106701;17.05.2015 13:09;[id82853210|Сергей], безграмотность сваливаемаю на образы-ну так бы и сказали.;0;;Н3;4
4128;64899;198857;132608829;198828;25106701;17.05.2015 13:10;[id69583039|Владимиръ], »наша власть никогда не готовится к войне<br>Александр 1 с аракчеевым и барклаем-де-толли в 1811-1812 дико посмеялись над этим;0;;Б3, Ц3;4
4129;64900;198858;82853210;198828;25106701;17.05.2015 13:11;[id132608829|Александр], почему же ? На  образ  граматешки вот хватило...А где Аустерлиц и Измаил и где Рязань,не в курсе ? Опять Великодержавные понты и позор...;0;;Ж3, Н3;4
4130;64901;198860;132608829;198828;25106701;17.05.2015 13:14;[id82853210|Сергей], »где Аустерлиц и Измаил и где Рязань,не в курсе<br>Ну это ваши проблемы если не знаете.<br>»Опять Великодержавные понты и позор<br>лол??;0;;Ц3;4
4131;64902;198861;82853210;198828;25106701;17.05.2015 13:14;[id132608829|Александр], а что,в составе РФ что ли ? Я не о Рязане...;0;;К3;4
4132;64903;198863;132608829;198828;25106701;17.05.2015 13:20;[id82853210|Сергей], я вам говорю про сражения, вы мне ,не понять зачем толкаете географию<br>Кто там еще? Вопреки Пожарскому и Минину выгнали польских интервентов, вопреки Воротынскому разбили крымчаков в битве у молодях, да чего уж там, у нас ведь и ВКОНТАКТЕ вопреки Дурову рослоO забавный же у вас виртуальный мирок;0;;Ч3;4
4133;64904;198864;82853210;198828;25106701;17.05.2015 13:22;[id132608829|Александр], и я о сражениях...Какого черта мы туда людей положить водили ? Что это как не Великодержавные понты ? А Минин и Пожарский,-это как раз не Власть,а народ вопреки бездарной Власти. Как и всегда...;0;;Ж3;2
4134;64905;198865;132608829;198828;25106701;17.05.2015 13:46;[id82853210|Сергей], <br>»Измаил<br>Турция объявила войну России, вопросы?<br>»Аустерлиц<br>Ну да, великодержавные понты, равно как и понты Австрии воевавшей в италии, равно как и понты пруссии, объявившей войну франции годом позже, а о британских армиях воевавших в португалии вообще молчу.<br>»Минин и Пожарский,-это как раз не Власть<br>дык они и создали власть в противовес семибоярщине- совет всей земли  и руководили ополчением. Вы же выше утверждали ,что выигрывали  вопреки =&gt :  по вашей логике, и второе ополчение выиграло вопреки минину и пожарскому.<br>Да ,кстати, когда, вы выше говорили, что вот в ссср людей не жалели, а на западе берегли. Мне вот интересно, когда англичане с французами в пмв платили десятками тысячами убитых за жалкие километры-они таким образом людей берегли или же в англо-французское командывание пробрался сталин?;0;;Ж3, Б3;3
4135;64906;198866;82853210;198828;25106701;17.05.2015 13:47;[id132608829|Александр], вот так вот,ни с того,ни с сего ?;0;;А3;4
4136;64907;198867;82853210;198828;25106701;17.05.2015 13:49;[id132608829|Александр], а в ПМВ стратегия и тактика соответствовали имеющимуся в то время оружию.А во Вторую оружие было уже совсем другое.Так что,не аргумент...;0;;Б3;2
4137;64908;198868;60120722;198828;25106701;17.05.2015 14:00;[id82853210|Сергей], за период с высадки в норамндии до взытия берлина союзники на германском фронте потеряли 2.8 миллиона человек за это же время советская армия потеряла 1.6 миллиона человек . за всю войну боевые потери советского союза составили 11.4 миллиона человек германии на советском фронте 8.7 миллиона человек. это без рассчета потерь союзников германиии таких как франция , румыния , болгария, финляндия, словакия.;0;;Щ4;3
4138;64909;198869;132608829;198828;25106701;17.05.2015 14:00;[id82853210|Сергей], »вот так вот,ни с того, ни с сего<br>Я не знаю ,что у вас там<br>»во Вторую оружие было уже совсем другое.<br>А это-то причем? Вы же выше рассказывали пахомкины истории про  не жалели людей ,  английский командующий спокойно держал на ипрском выступе людей, не взирая, что те тысячами гибли от обстрелов. Поэтому ваш тезис полная чепуха, все в одинаковой степени ценили людей.;0;;И3, Б3;3
4139;64910;198870;82853210;198828;25106701;17.05.2015 14:01;[id60120722|Роман], ..И ?;0;;А3;4
4140;64911;198871;132608829;198828;25106701;17.05.2015 14:01;[id82853210|Сергей], »вот так вот,ни с того, ни с сего<br>Я не знаю ,что у вас там<br>»во Вторую оружие было уже совсем другое.<br>А это-то причем? Вы же выше рассказывали пахомкины истории про  не жалели людей ,  английский командующий спокойно держал на ипрском выступе людей, не взирая, что те тысячами гибли от обстрелов. Поэтому ваш тезис полная чепуха, все в одинаковой степени ценили людей.;0;;И3, Б3;3
4141;64912;198872;60120722;198828;25106701;17.05.2015 14:01; Трупами забрасали   бред были ошибки командования но трупами ни кто не забрасывал;0;;Б3;4
4142;64913;198873;60120722;198828;25106701;17.05.2015 14:01;в америке же людей берегут а потреряли народа больше хотя сражализь с вразы меньшим колличество войск;0;;Х4;4
4143;64914;198874;60120722;198828;25106701;17.05.2015 14:01;сражались;1;;Ж4;4
4144;64915;198875;82853210;198828;25106701;17.05.2015 14:02;[id132608829|Александр], а мне  на всех  как то до лампочки,я о отношении нашей Власти озабочен.;0;;Е1;2
4145;64916;198876;82853210;198828;25106701;17.05.2015 14:03;[id60120722|Роман], и на минные поля не гнали ?;0;;А3;4
4146;64917;198877;82853210;198828;25106701;17.05.2015 14:04;[id60120722|Роман], и заградотрядов не было ?;0;;А3;4
4147;64918;198878;60120722;198828;25106701;17.05.2015 14:06;было в 42 году и только в сталинграде. за всю войну расстреляли 4500 тыс человек.причем сдесь не только за трусость но и за измену и за всю херню. на минные поля не гнали если знали что минные поля есть а разминировали саперами или тральшиками;0;;Б3;3
4148;64919;198879;60120722;198828;25106701;17.05.2015 14:08;численность заград отрядов была мизерной;0;;И3;3
4149;64920;198880;82853210;198828;25106701;17.05.2015 14:09;[id60120722|Роман], вы прямо по трафарету ! Смерть одного человека трагедия,а смерть тысяч,уже статистика.Не надо тысячи считать.Лучше скажите,в какой Армии Мира было еще такое отношение к своему солдату ?;0;;П3, А3;2
4150;64921;198881;60120722;198828;25106701;17.05.2015 14:11;расстрел за трусость, предательство ? во всех армиях мира;0;;И4;4
4151;64922;198883;60120722;198828;25106701;17.05.2015 14:12;в америке за это время войны народу больше к смертной казни приговорили;0;;Ц4;4
4152;64923;198884;82853210;198828;25106701;17.05.2015 14:13;[id60120722|Роман], это относительно.В разных Армиях разное понятие о  трусоссти .Есть еще понятие,- Преступый приказ  А вот заградотряды и штафбаты,это уже конкретика.;0;;П4;3
4153;64924;198885;60120722;198828;25106701;17.05.2015 14:15;у нас и за преступный приказ расстреливали, штраф баты это кокраз повод не расстреливать трусов;0;;И1;4
4154;64925;198886;60120722;198828;25106701;17.05.2015 14:15;как раз;0;;Ж3;4
4155;64926;198887;82853210;198828;25106701;17.05.2015 14:19;[id60120722|Роман],  трусов ,которые на минное поле не пошли ? На которое их отправило бездарное командование ?;0;;Ц3;4
4156;64927;198888;60120722;198828;25106701;17.05.2015 14:20;трусов которые позицию оставили и изза них колонну с ранеными расстреляли;0;;П4;4
4157;64928;198889;82853210;198828;25106701;17.05.2015 14:23;[id60120722|Роман], это уже лирика-демагогия.;0;;Ч3;4
4158;64929;198890;60120722;198828;25106701;17.05.2015 14:23;[id82853210|Сергей], про минные поля тоже;0;;Ч3;4
4159;64930;198891;82853210;198828;25106701;17.05.2015 14:24;[id60120722|Роман], про минные поля есть много задокументированных фактов.;0;;Ф3;4
4160;64931;198892;60120722;198828;25106701;17.05.2015 14:34;во первых не много, а несколько во вторых может, где нибудь в горячке боя какое нибудь подразделение и попадало на минное поле, так это случалось в любой армии, в том числе американской.;1;;Б3, И4;4
4161;64932;198893;60120722;198828;25106701;17.05.2015 14:37;и да если подразделение погибало от действий командира то командира расстреливали;0;;И3;3
4162;64933;198906;132608829;198828;25106701;17.05.2015 16:08;[id82853210|Сергей], ну раз вам все равно на  всех , то тогда не утверждайте, что наша власть  людей не жалеет . Она как и в других странах в равной степени заботится о людях.;0;;П3, Х4;3
4163;64934;198908;82853210;198828;25106701;17.05.2015 16:15;[id132608829|Александр], я как раз и сказал,что озабочен отношением нашей Власти,которая постоянно сокращает расходы на медицину,образование,культуру,науку...И не жаплеет денег только на свой пустой пиар,воровство и войну.;0;;Щ4;1
4164;64935;198909;132608829;198828;25106701;17.05.2015 16:20;[id82853210|Сергей], <br>»воровство<br>Ну оно присутствует во всех государствах<br>»пустой пиар<br>Опять же, это во всех государствах<br>»войну<br>Но увы, это геополитически вынужденно<br><br>Хотя с другой стороны, можно вспомнить Йемен, где наша авиация спасала наших граждан, а заодно американских, польских и украинских<br>;0;;Ф3;2
4165;64936;198910;82853210;198828;25106701;17.05.2015 16:21;[id132608829|Александр], ага,плавали,знаем,-Дьявол кроется в деталях. (с) Масштабы уж очень разнятся.В Разы ! Качественно...;0;;Б3, П4;3
4166;64937;198915;217353012;198828;25106701;17.05.2015 16:54;[id82853210|Сергей], так разговор о 19 веке . И мне будешь доказывать что во Франции уже жили как сейчас .;0;;Б3;4
4167;64938;198917;260062371;198828;25106701;17.05.2015 17:25;а Наполеона жаль!;0;;Е1;4
4168;64939;198918;60120722;198828;25106701;17.05.2015 17:28;[id82853210|Сергей], за последнии 15 лет индекс ппс в России поднялся в 5 раз . и составляет 25000 при этом мы все равно отстаем от германии почти в два раза 45000.;0;;Ч3;3
4169;64940;198919;69583039;198828;25106701;17.05.2015 18:08;[id132608829|Александр], пока они смеялись - французы били всех и вся. Ровно до ополчения. Сожженная Москва, напомню, была до момента полной консолидации не основных сил, а именно ополчения. Это потом  казаки по Парижу гуляли , вначале же они с треском провалили всё, что можно и дали взять Москву, что вообще-то по международным обычаям тех лет означало проигрыш в войне. Или может быть не в ту войну нам не хватило ружей, чтобы вооружить ополченцев? Или не в ту ли войну началась знаменитая народная война, т.е. партизанщина и война именно ополчения, потому как власть была бессильна? А может Давыдов, Сеславин и проч. - это были регулярные войска, а не партизанские, т.н.  летучие  отряды? <br><br>В общем, они смеялись - а народ шёл и гиб, т.к. власть в 1101й раз была не готова. Не готова и сегодня.;0;;Щ4;4
