4206;64977;199343;132608829;198828;25106701;18.05.2015 17:24;[id69583039|Владимиръ], »купитуляция столицы - капитуляция в войне<br>Теперь уже  и ким ир сен смеется со мной<br>Действительно, оборонять российские просторы легко<br>»гибло больше<br>Так где доказательства? Берем российские потери, к ним прибавляем 4/5 австро-венгерских, 40% германских и 80% турецких, вполне сопоставимо<br>»Особенно мирных жителей<br>Ну да, деревни сжигали-то нквдэшники, а гитлеровцы не при чем. <br>»каждое слово с фактом<br>Шутка дня????????, мне вспомнить про  москву -столицу  о  которой вы забыли?<br>»400 000 чел. с лишним ополчения нигде не использовалось<br>Странно, то у вас  проклятый царизм   людей ест, то ополченцев на регуляров не бросает, опредклитесь уже)<br>ну про итальянскую и африканскую кампании - сути не меняет, немцы  и итальянцы потерпели фиаско.  И да, когда будете сравнивать потери англии и ссср, то сравните,уроны,нанесенные ими германии;0;;П4, Ч3;4
4207;64978;199347;69583039;198828;25106701;18.05.2015 17:37;[id132608829|Александр], <br><br>01. Да смейтесь сколько угодно: вы путаете обычай и фактические обстоятельства. Факты в руки я вам дал, как и подбор ключевых слов.<br>02. Очень сопоставимо, учитывая разброс фронтов. Прямо так сопоставимо, что нет: все потери учитывать не возможно, т.к. русские на всех фронтах не воевали. Или это тоже не факт?<br>03. Гитлировцы - причем. Только вот всего этого можно было бы избежать, если бы подготовились к обороне лучше: даже Жуков в Воспоминания и размышлениях говорит об этом, да Рокоссовский с Коневым. Не говоря уже о фактических обстоятельствам: мы хотели войну наступательную, а получили - оборонительную. И к ней готовы не были. Факт.<br>04. Москва - была фактической столицей. Обратных доказательств вы не привели. Да и их нет, т.к. даже постановления 1918 г. говорят о ПОЛНОМ переносе столицы в Москву. Ну не было в вашей истории двух столиц. Суть в том, что в Имперской России было 2 столицы. И юридически оформление переноса столицы в Питер в 1730 г. так и не было завершено, только фактически. Или м.б. удосужитесь объяснить, зачем Москва вообще нужна была тогда Наполеону?<br>05. Да я определился. Вопросы выше. - фактов и ссылок вы так и не привели. И это ваш пресловутый пруф во все расцвете: вы изначально спорили о том, чего не знали.<br>06. Меняет и ещё как, вы сами сказали - сами отреклись: проиграли итальянцы, а не немцы. Немцы даже резервные силы туда бросили в показательных целях, т.к. для них это не было стратегическим направлением, а Балканы нужны были дуче и вовсе на все 100%. <br><br>07. Ну  уроны , кот. нанесла Германии как раз и доказывают, что СССР к войне готов не был на столько, на сколько Великобритания с её разведкой, кот. сделала разведку СССР на 101%, к сожалению.<br><br>P.S. Ссылок от вас в очередной раз по основным тезисам - нет. За сим - разговор окончен.;0;;И3, Н3;4
4208;64979;199348;6113382;198828;25106701;18.05.2015 17:39;[id132608829|Александр], прежде чем ждать ответов, научитесь отвечать, а главное слышать суть мысли. То, как воспринимаете мои  придирки , ваши проблемы - я лишь высказал мнение, как и ваша писанина, а главное стиль воспринимается со стороны. Я нигде не указал, что вы отрицали факта наличия множества колоний у Франции. Польшу приплели к Франции? Я с таким же успехом приписал Англию, или у вас много аргументов об огромной польской армии против России?;0;;Н3, Е1, А3;4
4209;64980;199352;132608829;198828;25106701;18.05.2015 17:49;[id6113382|Сергей], »прежде чем ждать ответов, научитесь отвечать<br>Вас перенаправить на паблики с цитатами? ??<br>Польские войска, таки в значительном количестве участвовали в походах наполеона, британских войск в русской кампании не было<br>Вопросы?;0;;А3, Ц3;4
4210;64981;199373;132608829;198828;25106701;18.05.2015 18:00;Владимиръ, <br>»Факты в руки я вам дал<br>Рука-лицо<br>»русские на всех фронтах не воевали<br>я утверждал обратное? 4/ 5 австрийских потерь-восточный фронт, 40% немецких потерь- восточный фронт, значительная часть турок-кавказский фронт, я это выше описал.<br>А кто к войне был готов? Франция? Югославия? Польша? Англия чьи войска с треском вылетели с франции , норвегии и балкан? (Дюнкерк, дьепп).<br>»Москва - была фактической столицей<br>Ааа, то у вас она официальная, то теперь фактическая, не увиливайте , лучше признайте свою неправоту. Но резиденция и правительство были в питере, увы(<br>Москва -важный путевой и стратегический центр, вот и всё. <br>»Немцы даже резервные силы<br>У вас опять противоречия, то англичане берегут людей  и у них поэтому маленькие потери, то теперь немцы -то кидали самые лучшие части на восток.<br>Какие у пруфы?) Ссылки на википедию, где если бы вы прочитали полностью статьи, то увидели бы мою правоту? <br>Ссср был не готов к войне, равно как и другие страны. Ну да, рихард зорге, титаническая борьба смерша и абвера-так, пустышки, верно?;0;;Е1,Ч3;4
4211;64982;199376;69583039;198828;25106701;18.05.2015 18:15;[id132608829|Александр], фактическая официальная столица - да. И поэтому был перенос столицы в Москву формальный в 1918, не нужно было ничего переносить, кроме правительство - все и так было, вся бюрр. инфраструктура. Я и не увиливаю, просто надо знать понятие де юре и де факто.<br><br>По Войне:<br>01. да, СССР был не готов. Это признали все, даже Сталин и Жуков. Были готовы Англия и США. Они в ней и победили. К сожалению, но факт.<br>02. Про фронт - у вас как раз противоречия, если брать по соотношению количества - Россия потеряла больше всех. Это факт. См. ссылку<br><br>По 1812 г.: <br>в ссылках все тезисы об участии ополчения есть, обратных ссылок вы не дали (да и не сможете - это противоречило бы понятию Народной войне)<br>Ссылки на вики не устраивают? Так от вас я и того не получил. Да и в ней есть ссылки на др. источники<br>Аналогично - по столице и по её капитуляции.<br><br>P.S. Странно смотреть, когда русский мужик просит что-то доказать  пруфом , а в ответ отправить обычную ссылку с обратными фактами и тем самым сам себя оправдать (относительно формальной истины спора) не может. <br><br>Повторять 3й раз не буду: без доказательств спор не имеет смысла в продолжении, т.к. я тратил время на поиск общеизвестных и общедоступных фактов, а в ответ получил измышления о не ключевых (в данной дискуссии) вопросах.;0;;И3;3
4212;64983;199383;132608829;198828;25106701;18.05.2015 18:36;[id69583039|Владимиръ], действительно, по вашей логике столицей являлся киев, рига и одесса, тоже крупные города с инфраструктурой. А при  де юре  и  де факто , вы выше называли москву юридической столицей, теперь фактической, через 2 сообщение скажите,что вообще такого не говорили<br>»Были готовы Англия<br>Сколько раз мне эту чепуху опровергать? Английская и французская армии каечственно отставали от рейха во многих сферах и кампания 1940 года прекрасно это проявила.<br>»США<br>да, сша были очень готовы к перл-харбору<br>»Они в ней и победили. К сожалению, но факт<br>а что к сожалению-то? Победили вместе с ссср,только ссср с сша стали сверхдержавами, а ссср вдобавок отстоял своё существование, а британская империя рухнула. И где мои противоречия?  Соотношение потерь России и центральных держав на востоке 1:1.25, но это без кавказского фронта, где турки теряли намного больше русских. Точно такое же соотношение было и на западном фронте.<br>»об участии ополчения<br>Я это отрицал?<br>ну вы же с пеной у рта доказывали  ,что москва столица. https://ru.m.wikipedia.org/wiki/Столицы_России<br>По столицам и капитуляциям вы так ничего и не привели<br>Интересно, с чего это у вас так бомбит с пруфов? Может потому что вы их подобрать не можете<br><br>Ну так сливайтесь, если у вас нет доказательств -это не моя вина;0;;Ц3, Ч3;4
4213;64984;199389;69583039;198828;25106701;18.05.2015 18:51;[id132608829|Александр], пока вы не дадите мне ссылки по основным аспектам спора:<br><br>что крестьянские отряды действовали хуже офицерских<br>что 400 000 чел. с лишним ополчения нигде не использовалось<br>что захват столицы - не есть правовой обычай международного права <br>что армия была готова, а потому нужды в ополчении - не было<br>что ополчение не участовавло в Бородиснком сражении<br>что налеты офицерских партизанских отрядов были на полностью эффективны до момента договоренности с населением<br><br>остальные - обсуждать не вижу смысла.<br><br>По Москве: вот так и рождаются мифы. 1728 г. - туда вернули столицу, в 1732 г. двор переехал и вернул столичный статус Питеру. Вопрос - в каком году (между 1728 и 1732 г.) у Москвы забрали столичный статус?;0;;Г3, Ц3;4
4214;64985;199393;69583039;198828;25106701;18.05.2015 18:53;[id132608829|Александр], это у вас нет доказательств - ни 1 ссылку вы не оспорили, ни одной, кроме той, что выше - не предоставили. А вопрос про столицу между тем был побочный раз и второе - см. выше: все, что я сказал - это факт. Вычеркнуть это можно, но не выходит, т.к. в этом случае логика Наполеона - не ясна, а обратное вы так и не доказали: слиться - нет, а вот уйти от бессмысленно спора с человеком, кот. на столько не уважает себя, что требует с других ссылки, а сам их не предоставляет и не читает предоставленные, - самое то решение;0;;Н3, Ф3;4
4215;64986;199394;69583039;198828;25106701;18.05.2015 18:54;[id132608829|Александр], о 2МВ и проч. - см. выше, только после ссылок, отрицающих мои основные тезисы по Войне 1812 г.;0;;Р3;4
4216;64987;199459;132608829;198828;25106701;19.05.2015 3:25;[id69583039|Владимиръ], лол<br>Вот например про аракчеевскую реформу артиллерии  http://echo.msk.ru/programs/netak/882535-echo/<br>Вообще реформы тогдашнего военного министра Барклая- http://encyclopedia.mil.ru/encyclopedia/history/more.htm?id=11052905@cmsArticle<br>Можете почитать Бориса Юлина: Бородинская битва <br> »захват столицы - не есть правовой обычай<br>Смешно, вы так ничего не смогли предоставить и теперь требуете  от меня?? как я могу приводить что-то, о том чего нет?<br>»что армия была готова, а потому нужды в ополчении - не было<br>Армия была готова в меру своих возможностей , читайте вашу википедию по 1812 году. <br>Я не собираюсь доказывать, то что вы придумали и приписали мне.<br>»вот так и рождаются мифы<br>Не знаю,что родилось у вас, но там черным по белому написано: в 1730 г. питеру был ПОТВЕРЖДЕН столичный статус, то есть при петре 2, питер даже официально был столицей<br>»ни 1 ссылку вы не оспорили<br>Оспаривать статьи википедии, которые  опровергали,то чего я не отверждал и в которых, если бы вы их прочитали, были бы мои доводы? браво, вы лучший юморист???????? ?? ??<br>»вопрос про столицу между тем был побочный<br>Теперь он побочный<br>»что я сказал - факт<br>Ну да, москва столица российской империи, военные поселения и аракчеевщины до 1812 года, бездарный кутузов сдавший Москву, плохой СССР потерявший больше англичан и американцев.<br>»логика Наполеона - не ясна<br>Москва-важный , стратегический центр и древняя столица ( не официальная/ фактическая)<br>»на столько не уважает себя,что требует с других ссылок<br>То ли дело вы: про столицы промолчу, кидаете ссылки на то,что я и не отрицал , не знаю, с кем вы спорите, но раздвоение личности у вас точно есть<br>»а сам их не предоставляет<br>А что мне нужно предоставить? Реформы в армии до 1812 года? Если вы якобы изучали этот вопрос 2 года, то вы должны были это знать. Ссылку на опровержение того, чего не существует?<br><br>Еще раз- вашей ссылкой на первую мировую была таблица, но там не было разделений по фронтам. 4/5 австрийских войск и 40% н;0;;Ж3, Е1, Ц3;4
4217;64988;199650;69583039;198828;25106701;19.05.2015 14:54;[id132608829|Александр], <br><br>Записка военного министра М.Б. Барклая де Толли «О защите западных пределов России» от марта 1810 года: <br>«Москва будет служить главным хранилищем, из которого истекают действительные к войне способы и силы»<br><br>«Я иду в Москву и в одно или два сражения все кончу. Император Александр будет на коленях просить мира. <br>Я сожгу Тулу и обезоружу Россию. Меня ждут там. Москва сердце Империи :  <br>без России континентальная система есть пустая мечта», – <br>говорит Наполеон французскому посланнику в Варшаве аббату де Прадту накануне вторжения в Россию<br><br>Я пришел, чтобы раз навсегда покончить с колоссом северных варваров…. <br>Надо отбросить их во льды, чтобы в течение 25 лет они не вмешивались в дела цивилизованной Европы…. <br>Мир я подпишу в Москве…. Цивилизация отвергает этих обитателей севера. Европа должна устраиваться без них»<br>Цит. по: Дубровин Н.Ф. Русская жизнь в начале XIX века. СПб., 2007. С. 557-558. <br><br>Да и какие последствия будут, если сражение вами проиграно будет? Последствия те, что я займу Москву, <br>и какие б я меры ни принимал к сбережению ее от разорения, никаких достаточно не будет: <br>завоеванная провинция или занятая неприятелем столица похожа на девку, потерявшую честь свою. <br>Что хочешь после делай, но чести возвратить уже невозможно. <br>Арман де Коленкур. Поход Наполеона в Россию (Мемуары). Смоленск, 1991. С. 81-82.<br><br>Я знаю, у вас говорят, что Россия еще не в Москве, но это же самое говорили и австрийцы, <br>когда я шел на Вену, но когда я занял столицу, то совсем другое заговорили. И с вами то же случится. <br>Столица ваша Москва, а не Петербург. <br>Петербург не что иное, как резиденция, настоящая же столица России – Москва<br>Цит. по: Отечественная война 1812 г. Сб. док. и мат. Л.-М., 1941. С. 52.<br><br>Про обычай захвата столицы - я дал не просто ссылки, а целые ключевые слова с выдачей сотней примеров. Собственно, критика взятия Берлина в 1945 г. как раз строилась на том, что Берлин можно было бы и не брать, т.к. можно было бы;0;;Ж4, К3;4
4218;64989;199651;69583039;198828;25106701;19.05.2015 14:55;[id132608829|Александр], http://echo.msk.ru/programs/netak/882535-echo/ - теперь ясно, откуда растут ноги измышлений: про реформу я все сказал и также указал, что она а) была запоздалой, б) в итоге не дала нам преимуществ :  в) никак не влияет на основной вопрос обсуждения о народе (ополчении);0;;Ц3, Е1;4
4219;64990;199652;69583039;198828;25106701;19.05.2015 14:58;[id132608829|Александр], http://encyclopedia.mil.ru/encyclopedia/history/more.htm?id=11052905 - а вот это хорошая ссылка. По крайне мере есть, что проверить. <br><br>Но вывод, кот. там указан, говорит о том, что мой тезис правильный: Россия к началу вторжения «Великой армии» в ее пределы обладала значительной военной силой. Она была способна отразить нашествие воинства, собранного императором французов Наполеоном I с покоренной им пол-Европы. Однако собственно на театре военных действий оказалась только треть этих воинских сил, что и определило характер первой половины Отечественной войны 1812 г<br><br>Т.е. да, готовились, но а) т.к. армия изначально отстала, б) сделали акцент на той самой логистики, муштре и военном оснащении, а об организации стратегии - забыли. И пришлось, как всегда, все делать впопыхах. Ничего иного вам никто и не скажет - так оно и было;0;;Р3, Е1, И4;4
