4170;64941;198921;132608829;198828;25106701;17.05.2015 18:41;[id69583039|Владимиръ], действительно, 600.000 солдат Наполеона прошедших испанию, италию, австрию и русская армия в 200.000-300.000 солдат. Ну давайте, расскажите, как вы бы погнали наполеона с 3-х кратным перевесом от границ россеюшки. И да, наверно,  не было реформ Аракчеева, создавшего лучшую артиллерию Европы и не было Барклая улучшевшего армейскую логистику до французского уровня,  все выдумки рептилоидов, верно?<br>»с треском провалили всё,что можно и дали взять Москву, что вообще-то по международным обычаям тех лет означало проигрыш в войне<br>А где провал-то? Армия была сохранена, противник по плану Барклая, а позже Кутузова был измотан и понёс  потери превышающие наши. Какие международные обычаи? Можно ссылку? Москва не была даже столицей если что.<br>»Или может быть не в ту войну нам не хватило ружей,чтобы вооружить ополченцев<br>Как интересно вы подсчитаете нужду в оружии для ополчения? там впринципе не известно сколько человек в него пойдёт, и так везде, в 1940 английское ополчение из нужды вооружали саблями и алебардами. Только англичане, которым так и не довелось сражаться на своём острове с немцами, гордятся этим, своей храбростью и самоотверженностью, а у нас наоборот, пустили шюточки про винтовку на троих.<br>»может Давыдов, Сеславин и проч.-это были регулярные войска, а не партизанские<br>Действительно, царский офицер давыдов, с санкции багратиона создавший отряд из казаков и гусар у нас теперь пример бездействия власти...смешно.<br>»а народ шёл и гиб<br>Ну ,конечно , на войне ведь не убивают<br>Власть в 1101й раз была не готова<br>Но тогда по вашей теории, ни одна страна не была готова к войне;1;;Ц3, Ж3;3
4171;64942;198922;69583039;198828;25106701;17.05.2015 19:07;[id132608829|Александр], <br><br>01. Кто не давал царю сделать армию больше? У России на то были и резервы, и время. Все же прекрасно видели куда идёт Наполеон и чем это закончится. Реформы как раз были, но проводились они как всегда впопыхах - и это факт, т.к. если бы начали это делать загодя, не случилось бы другого факта: не потребовалось бы сдача Москвы и привлечение крестьян, кот. не обученные шли в бои. Или этого тоже не было?<br>02. Не знаете обычаев - так хотя бы не пишите  ссылку  или, не дай бог, пруф... Вы серьёзно? Фактическое поражение всех армий - это всегда вхождение в столицу. Это закреплено во всех значимых документах: иначе может быть постараетесь объяснить, зачем русские шли в Париж, когда уже явно Отечественная была на нашей территории выиграна? Или в Берлин в 45м? Ссылка на обычай, Александр, это нонсенс, т.к. обычай - это совокупность норм, а не законов. Если не сильны в юриспруденции, хотя бы не грешите словами. Не верите мне - пройдите курс международного права и почитайте историю международного гуманитарного права - есть в любом уважающем себя юр. ВУЗе. <br>А Москва с 1728 г. была столицей и именно поэтому Наполеон целенаправленно к ней шёл. Если Вам нужна ссылка, честное слово, вбейте в гугл и раз уж не хватает знаний - проверьте. Вы когда факт утверждаете, хотя бы на общеизвестные факты смотрите: ещё Пётр 2 в ней проживал, а потом и вовсе всю резиденцию туда перенесли. То, что было 2 столицы - вопрос отдельный.<br>И да, мы по факту проиграли, т.к. отступали не потому, что тактика такая была, а потому что без ополчения ничего не смогли сделать. Это факт. Как и факт о том, что десятки тысяч ополченцев и партизан вооружать было некому и нечем, потому что Аракчеевщена кроме муштры и формальностей не успела толком ничего, что и подчеркивают события 1812 г. вполне. Или может быть понятие аракчеевщины - тоже фикция и выдумка?<br>03. Давыдов с санкции... Александр - садитесь хотя бы за учебник истории: какие санкции? Ну тогда точно такие же санкции были и у советской власти в 41-44 гг. на парти;0;;Ч4, Н3;4
4172;64943;198929;82853210;198828;25106701;17.05.2015 19:25;[id217353012|Sergey], не не буду...Мне одного  талантливого  хватило...;0;;Ф3;4
4173;64944;198940;132608829;198828;25106701;17.05.2015 19:45;Армию больше? Деньги нужны, сударь, и времени особо не было, да и привлекать крестьян из производства означало бы серьёзные проблемы для экономики, но даже в таком случае Россия не могла бы тягаться с населением европы, тогда население одной франции  было таким как в россии.<br>То что вы написали по 02-исключительно ваши фантазии, ваш отказ предоставить ссылку/пруф это наглядно демонстрирует. Ну какбэ петербург был столицей с 1712 года, кратковременное пребывание петра 2 не в счет.<br>»зачем русские шли в Париж,когда уже явно Отечественная была на нашей территории выиграна, 400.000-я армия бонапарта,собранная уже в 1813 года прекрасно илюстрирует несостоятельность вашего тезиса. Русская армия шла ,чтобы вернуть короны европейским монархам. Я ,конечно, понимаю,что у вас ,возможно, проблемы с историей и географией, но вы удосужтесь посмотреть на карте 1812 года территорию франции и россии ,а потом карту боевых действий в 1945 году,чтобы у вас не было глупых вопросов<br>»Ссылка на обычай, Александр, это нонсенс, т.к. обычай - это совокупность норм<br>???????? я 5 минут проигрывал от твоих мюслей, чувак, если у твоего обычая нет потверждений, то это плод твоего воображения, и юриспруденция здесь не при чем. И да, не стройте из себя юриста, не к месту и не к лицу.<br>»А Москва с 1728 г. была столицей <br>Вбил, питер столица с 1712-1918, википедия.<br>Чувак, ты б вместо того ,что молоть цитаты лучше б историю повторил, понятие  аракчеевщина  возникла после войны с созданием военных поселений. <br>»без ополчения ничего не смогло сделать<br>Тарутинский манёвр, Малоярославовец -это, наверно, в твоей реальности плоды деятельности ополчения.<br>опять же, вы не очень разбираетесь с деталях. <br>»какие санкции<br>Ну вы ж у нас юрЫст доморощенный, хотя б посмотрели значения этого слова. А знаете,что лучше возьмите рассказы Алексеева,если не ошибаюсь, для детей, там для думаю все станет понятнымO вашу остальную демагогию  не в тему  из серии 03 мне разбирать неинтересно.<br>»наши власти никогда не были готовы к войне<br>1812 го;0;;Ж3, Н3, И4;3
4174;64945;198965;289126783;198828;25106701;17.05.2015 20:55;Самый главный урок, который Запад может извлечь из <br>наполеоновских войн это не лезть в Россию.;0;;П4;1
4175;64946;198982;6113382;198828;25106701;17.05.2015 21:31;[id132608829|Александр], население Франции было на почти треть меньше населения России (28 и 36 примерно - 8 миллионов не в счет?) Русская армия вернуть короны шла? интересное субъективное мнение - видать Александр был очень добрым...;0;;Ж3;3
4176;64947;199016;60120722;198828;25106701;18.05.2015 1:32;[id69583039|Владимиръ], бред полнгейший. к войне были готовы и отступали до москвы не потомучто с треском проигрывали ,а потому что силы врага растягивали и москва в то время столицей не была и не по каким правилам ведения войны проигрышем это не считалось , и победили не столько из за ополчения(которое в боях кстати почти не участвовало) или из за партизан (которые кстати говоря были основаны офицером по приказу барклая де толли если не ошибаюсь, точную фамилию офицеров партизанских отрядов не вспомню) сколько из за грамотного руководства;0;;Б3, И4;3
4177;64948;199017;60120722;198828;25106701;18.05.2015 1:37;[id6113382|Сергей], фрвнция в тот момент была чуть в больших границах ну как в чуть больших почти вся европа её границы, и да александр шел возвращать короны и он их вернул);0;;Ш3;4
4178;64949;199020;132608829;198828;25106701;18.05.2015 2:59;[id6113382|Сергей], а вы прибавили к франции каталонский департамент, бельгию, голландию и северную германию, которые официально входили в состав франции? Не забудьте приплюсовать польшу, которая всецело поддержала наполеона, его протектораты в северной италии и южной германии. <br>Таки да, одна из причин заграничного похода-реставрация старых монархий.;0;;И4;4
4179;64950;199024;6113382;198828;25106701;18.05.2015 8:18;[id132608829|Александр], весьма сомнительно считать оккупационные территории  эффективным населением , в котором для поддержания порядка не нужны дополнительные войска. Если плюсовать отдельные государственные образования к Франции, то в целом к России можно таким же НЕПРАВИЛЬНЫМ подсчетом плюсовать Пруссию, Англию и Австрию. По поводу реставрации - смотрю, уже изменение в позиции и кардинальные -  добавились слова - одна из причин , хотя и такая формулировка требует уточнение, ибо неполная может нести ложную информацию - династию Бурбонов. А про влияние, а про то, чтобы агрессор больше не вернулся и не конкурировал на европейском театре с Россией не забыли? по мне эти 2 фактора гораздо важнее восстановление династии.;2;;Ч3;4
4180;64951;199206;132608829;198828;25106701;18.05.2015 14:17;[id6113382|Сергей], назовите мне крупные восстания против французов в северной италии или бельгии, хотя бы несколько. И каким образом вы собираетесь плюсовать россии пруссию австрию? Вы не в курсе,что австрия и пруссия в 1812 году были в состоянии войны с россией.<br>Вы могли бы меня укорить,если б я сказал,что реставрация была единственной целью, но я такого не сказал. Не ну безусловно, ваши факторы тоже верны, правда намбольшую выгоду получила Великобритания, которая заняла французское место в промышленности и получила ее колонии, в то время как россии досталась польша,которая весь 19 век будет головной болью;0;;Ч3;4
4181;64952;199218;69583039;198828;25106701;18.05.2015 14:50;[id60120722|Роман], конечно)) поэтому про ополчение и пишут до сих пор во всех учебниках истории, не говоря уже о солидных изданиях. И именно поэтому мы до сих пор верим, что отступали. потому что так было надо, а на вопрос, а что могли бы сделать не отступая, - молчим;0;;Ч3;3
4182;64953;199220;69583039;198828;25106701;18.05.2015 14:53;[id60120722|Роман], и да, в 41м мы тоже отступали, потому что была такая стратегия, а не из-за безграмотного руководства и проч. Стратегия на все времена.;0;;Ф3;3
4183;64954;199227;69583039;198828;25106701;18.05.2015 15:06;Раз уж все так любят ссылки, а не книги, то пожалуйста:<br><br>01. https://ru.wikipedia.org/wiki/%D0%97%D0%B5%D0%BC%D1%81%D0%BA%D0%BE%D0%B5_%D0%BE%D0%BF%D0%BE%D0%BB%D1%87%D0%B5%D0%BD%D0%B8%D0%B5_1812_%D0%B3%D0%BE%D0%B4%D0%B0 - 400 000 человек, кот., как пытаются мне доказать, нигде  не использовались  фактически.<br>02. https://ru.wikipedia.org/wiki/%D0%9F%D0%B0%D1%80%D1%82%D0%B8%D0%B7%D0%B0%D0%BD%D1%81%D0%BA%D0%BE%D0%B5_%D0%B4%D0%B2%D0%B8%D0%B6%D0%B5%D0%BD%D0%B8%D0%B5_%D0%B2_%D0%9E%D1%82%D0%B5%D1%87%D0%B5%D1%81%D1%82%D0%B2%D0%B5%D0%BD%D0%BD%D0%BE%D0%B9_%D0%B2%D0%BE%D0%B9%D0%BD%D0%B5_1812_%D0%B3%D0%BE%D0%B4%D0%B0 - внимательно читаем про отношения партизан с местным населением (а лучше всё же идем к первоисточникам) и выясняем, что пока НАСЕЛЕНИЕ не стало нормально контактировать с партизанскими отрядами, ничего, кроме единичных акций, не выходило. Более того, сугубо офицерские партизанские отряды часто путали с французами, что ещё раз подтверждает факт бездарного руководство. Эту  оплошность  исправили лишь не на местах, а не централизованно и сразу.<br>03. <br>https://ru.wikipedia.org/wiki/%D0%9E%D1%82%D0%B5%D1%87%D0%B5%D1%81%D1%82%D0%B2%D0%B5%D0%BD%D0%BD%D0%B0%D1%8F_%D0%B2%D0%BE%D0%B9%D0%BD%D0%B0_1812_%D0%B3%D0%BE%D0%B4%D0%B0#.D0.9A.D1.80.D0.B5.D1.81.D1.82.D1.8C.D1.8F.D0.BD.D1.81.D0.BA.D0.B8.D0.B5_.D0.BF.D0.B0.D1.80.D1.82.D0.B8.D0.B7.D0.B0.D0.BD.D1.81.D0.BA.D0.B8.D0.B5_.D0.BE.D1.82.D1.80.D1.8F.D0.B4.D1.8B;0;;И4;3
4184;64955;199230;69583039;198828;25106701;18.05.2015 15:08;Последнюю ссылку читаем про <br>Крестьянские партизанские отряды и опять уходим на первоисточники. И см., что даже в Москве французы потеряли 25 000 от партизан-крестьян.<br><br>В общем, не вижу смысла говорить оче-видное и тем более - унижать достойный народ, отдавая честь недостойной власти.;0;;И4;2
4185;64956;199244;69583039;198828;25106701;18.05.2015 15:25;[id132608829|Александр], <br><br>01. Время было, Наполеон с Европой воевал далеко ни 1 месяц. Просто и как всегда ждали до последнего. И потом, возникла  стратегия  растянуть войска наполеона: пусть так, только вот не складывается в картинку доблесть офицеров, кот. грудью шли вперед и казаков, кот. никогда не отступали и такая вот  стратегия .<br>02.  Пруф  - ниже. Читайте - хоть зачитайтесь. но вообще-то надо бы сначала самому научиться доказательства приводить, а общеизвестные факты - знать, а не просить их доказать.<br>03. После пребывания Петра 2 и до самого 1918 г. по факту было 2 столицы. Но а) Москва стратегиски была значимей Питера, т.к. в ней были сосредоточены все основные пути и б) окружить Питер после захвата Москвы - многим проще, чем сделать обратное (что и доказал Ленинград в последствии).<br>04. Вот именно: русская армия шла, чтобы вернуть короны. И плевать она хотела на свой народ, которому эти походы были не нужны. Только в чем же тут противоречие? Вы как раз мой тезис и доказываете, как и то, что взятие столицы было обязательным, иначе возврат этих самых империй был бы не возможен.<br>05. По поводу 45 года - это у вас проблемы с географией и историей: факт, т.к. Москву никто и никуда не переносил за это время. И Смоленск и в 1812, и в 1940х был один и тот же. И именно эти 2 населенных пункта сыграли ключевую роль и там, и там.;0;;Ч3, Н3;4
4186;64957;199245;69583039;198828;25106701;18.05.2015 15:26;[id132608829|Александр], ссылки ниже, читайте, чего не делали 400 000 с лишним человек ополчения.;0;;Р3;4
4187;64958;199247;60120722;198828;25106701;18.05.2015 15:27;[id69583039|Владимиръ], в отечественную войну это была стратегия разработанная барклаем де толи  и багратионом по другому победить такого военного гения как наполеон кторый к тому же имеет двух кратное превосходство не было возможным. И да кутузов был оочень хорошим полководцем. И единственный кто  побеждал наполеона  с меньшим количеством войск был суворов а это лучший полководец того времени а возможно и всех времен;0;;Х4;3
4188;64959;199248;69583039;198828;25106701;18.05.2015 15:27;[id132608829|Александр], никаких санкций не было, было распоряжение о партизанских отрядах, кот. были. Но которых было минимум. Они стали эффективны, когда договорились с населением и по сути - население стало им помогать. Факт, кот. опять же можно посмотреть по ссылке. Куда эффективней изначально действовали крестьянские отряды, т.к. им не нужно было с народом  ми роиться  - они и были народ;0;;И3;3
4189;64960;199249;60120722;198828;25106701;18.05.2015 15:30;[id69583039|Владимиръ], победить наполеона у которого было двухкратное превосходство? Смешной ты) ополчение участвовало в бородинском сражении так и не вступив в бой. И страна была готова к войне александр перед войной подписал кучу договоров которые сильно ослабили позиции наполеона;1;;Б3, И4;4
4190;64961;199251;69583039;198828;25106701;18.05.2015 15:30;[id132608829|Александр], 1) армия не была готова - это факт, кот. не понимаю почему нужно оспаривать, если везде указано обратное: опять же - ссылки выше. Ружей не хватало, ту же  логистику  делали по факту, а не до. И никаких укреп. сооружений толком так и не сделали. В той же Москве - сожгли, а не осадили. Это очень разные вещи.<br><br>2) Противник превосходил - факт. Но кто мешал нам набрать сразу ополчение, кот. потом с лихвой себя окупило и сделать тех же партизан - не ясно. Точнее ясно, т.к. царь у народа не просит. В этом и весь вопрос.<br><br>3) победа с наименьшими потерями - это хорошо. Поэтому по 1812 г. и нет вопросов у историков. Вообще нет :);0;;Ф3,И4;3
4191;64962;199253;69583039;198828;25106701;18.05.2015 15:31;[id132608829|Александр], слабоумный - это вы: сравните потери России и Англии - и все встанет на свои места. А потом - сравните потери США и России и все тоже станет ясным. Ну нет, так возьмите 1ю чеченскую и окончание 2й. И тоже все будет ясно;0;;Н3, Р3;4
