;Unnamed: 0;Id of comment.;Id of author of comment.;Id of post;Author of post;date;text;likes;Unnamed: 7;;
2423;71435;189820;5691529;189818;25106701;24.04.2015 12:41;Сейчас у патриотов будет разрыв шаблона);11;;Ц3;4
2424;71436;189821;224579200;189818;25106701;24.04.2015 12:43;Интересно что она выкинет в случае избрания? Муж её с негритянкой учудил, а она с кем?;0;;С4;3
2425;71437;189822;16668702;189818;25106701;24.04.2015 12:44;[id5691529|Артем], ты прав. шаблон порвался. кто такая Клинтон?<br>http://lurkmore.so/images/7/74/Shablon.jpg http://vk.com/photo-25106701_362993743;1;;Ц3;3
2426;71438;189823;6309141;189818;25106701;24.04.2015 12:44;[id5691529|Artem], и, судя по всему, именно у заокеанских патриотов. );1;;Ц3;3
2427;71439;189824;23325630;189818;25106701;24.04.2015 12:45;Artem, что именно должно вызвать  разрыв шаблона  у патриотов?;1;;А3;4
2428;71440;189826;16668702;189818;25106701;24.04.2015 12:46;[id23325630|Алексей], это походу не про нас а про пиндосов. Только зачем пиндосам пишут на русском языке? Они же тупые русского языка не знают.;0;;Н4;3
2429;71441;189832;4259812;189818;25106701;24.04.2015 12:56;Путин вас всех продаст и купит! купит ..и продаст но уже дороже (с);2;;Ш4;2
2430;71442;189834;16668702;189818;25106701;24.04.2015 13:02;[id4259812|Денис], вы свой опыт мне навязываете?;0;;А3;4
2431;71443;189839;4259812;189818;25106701;24.04.2015 13:05;[id16668702|Антон], при всем желании не могу за неимением) констатирую опыт кандидата демократическои партии в оплоте демократии на пост лавного демократизатора в мире);0;;Ш3;4
2432;71444;189840;6309141;189818;25106701;24.04.2015 13:07;[id282878909|Данияр], за Северный Казахстан переживаешь, или какая причина?;1;;Ш3;3
2433;71445;189842;6309141;189818;25106701;24.04.2015 13:11;[id282878909|Daniar], я тебе не хамил, чёрт ты приграничный.<br>Ага, и Украина тебя к этим влажным мечтам подтолкнула? Изучи подробнее актуальное состояние Украины, поможет разобраться в перспективах переживаний за Омск и Оренбург.;0;;Л3, Р3;4
2434;71446;189843;293775;189818;25106701;24.04.2015 13:12;Не здоровый взгляд.;0;;П4;1
2435;71447;189847;6309141;189818;25106701;24.04.2015 13:17;[id282878909|Daniar], испугал, игры покажутся играми, хорошо. Теперь не тронем, извини, я был недостаточно вежлив ??<br>К слову, ты разгневался и скатился в хамства раньше меня, я всего лишь спросил о причинах твоих беспокойств);0;;Ч3;4
2436;71448;189862;16668702;189818;25106701;24.04.2015 13:33;[id4259812|Денис], у нас главный демократ в мире повышает цены на бананы. И под дудку главного демократа в мире поляшут все страны мира. А недовольные облиты грязью. Есть конечно обезьяны которые ради банана разрушили свою страну. Это и ливия и сирия и хохляндия и прочие моральные уроды. http://vk.com/photo-25106701_362997824;1;;Щ4, Н4;3
2437;71449;189864;3024891;189818;25106701;24.04.2015 13:33;[id282878909|Данияр], Игры в национализм ещё ни кому не принесли блага... боюсь Казахстан сдерживает Назарбаев... и если националисты победят после него ... смотри Укрстрану;0;;У3;3
2438;71450;189868;4259812;189818;25106701;24.04.2015 13:35;[id16668702|Антон], но виноват то все равно Путин, не?));0;;Ц3;4
2439;71451;189871;3024891;189818;25106701;24.04.2015 13:36;[id282878909|Данияр], Вот в этом и проблема .... к вам ни кто не полезет... Но если вы будете считать себя новоУкрией ... судьба будет похожей...;0;;У3;3
2440;71452;189883;1701518;189818;25106701;24.04.2015 13:40;[id282878909|Данияр], а кто вас  трогать  собирается, опасные вы наши?) Бредишь что ли?;1;;Ц3;4
2441;71453;189884;6309141;189818;25106701;24.04.2015 13:40;[id282878909|Daniar], ну-ка, где ты разглядел нацизм, мне даже интересно стало, стеночник.;0;;А3, Н3;4
2442;71454;189900;6309141;189818;25106701;24.04.2015 13:43;[id282878909|Daniar], конкретнее факты.<br>Пока ты только хамишь и нервничаешь, это мешает хорошей дискуссии, согласись?);0;;Ч3, А3;4
2443;71455;189902;3024891;189818;25106701;24.04.2015 13:43;[id282878909|Данияр], Вы глухой, хотя слух у вас есть ....вы слепой, хотя можете видеть ... вы Тролль потому, что разжигаете вражду к стране в которой жил я и мои предки .... вы и есть предатель Казахстана.;2;;Щ3 ;3
2444;71456;189909;1701518;189818;25106701;24.04.2015 13:46;[id282878909|Данияр], до какого дела? Никто с казахами воевать не собирается! Ты лучше расскажи, что знаешь про ситуацию в Украине, что  топишь  против нашей страны?;0;;А3, Т3;4
2445;71457;189911;3024891;189818;25106701;24.04.2015 13:47;[id282878909|Данияр], Каждый ваш пост оскорбление, каждый раз вы кому то угрожаете ... пока вас тут не было, не думал что у Казахстана такое будущее...;0;;Т3;3
2446;71458;189913;282878909;189818;25106701;24.04.2015 13:48;[id6309141|Antony], вот тебе факт<br>У русских чуть что угрозы соседям??<br>Еще вопросы?<br>Или ты не русский? http://vk.com/photo-25106701_362998985;0;;Т3;4
2447;71459;189917;282878909;189818;25106701;24.04.2015 13:51;[id3024891|Александррр], зайди посмотри мои посты умник. <br>О будущем Казахстана не беспокойся. Мы как бы сами.<br>А угрожать так это ваш конек.<br>Думай что пишешь.;0;;Р3, Т3;4
2448;71460;189918;235920235;189818;25106701;24.04.2015 13:51;[id282878909|Данияр], а почему казахи с русскими заключили договор в древности не знаешь?Отвечу китайцы вас в момент к рукам приберут и ойкнуть не успеете. Сейчас в Поволжье у нас достаточно вашего брата, так что не выпендривайся. Cкажите спасибо дедушке Ленину, что земли южного Урала вам подарил.;0;;У3;3
2449;71461;189921;1701518;189818;25106701;24.04.2015 13:52;[id282878909|Данияр], в конце концов, Назарбаеву хватило ума правильно выбирать союзников, на фоне растущего Китая и его территориальных претезий! Но, судя по всему, его подданным это не до конца понятно.;1;;Х4, И4;3
2450;71462;189922;6309141;189818;25106701;24.04.2015 13:52;[id282878909|Daniar], так ты сказал, что изменил мнение, я предположил, что из-за Северного Казахстана, в чем проблема?<br>Ты не ответил по-человечески, разверещался, начал пугать и изображать грозную империю Средней Азии ?? <br>Потом вдруг вылез Оренбург вообще. Будто мы тут угрозами мериться собрались, в итоге сам слился на националистическую тему. Просто с одного лаконичного и уместного вопроса от меня.<br>Согласись, глупо поступил?;4;;Ч3;4
2451;71463;189925;5100394;189818;25106701;24.04.2015 13:54;[id6309141|Antony], не согласится он, у человека от простого вопроса  крышу сорвало  ;0;;Ч3;4
2452;71464;189926;5100394;189818;25106701;24.04.2015 13:55;[id6309141|Antony], агрессия признак слабости или страха.;0;;И3;4
2453;71465;189928;235920235;189818;25106701;24.04.2015 13:55;[id6309141|Antony], он забыл как китайцы им жить не давали, кочевники и есть кочевники, Россия их вытащила из каменного века, как быстро все забываеться.;0;;П4;4
2454;71466;189936;3024891;189818;25106701;24.04.2015 13:58;[id282878909|Данияр], и после ваших слов вы хотите, чтобы к вам относились как равному или союзнику ? да вы откровенный враг ))) не Казахстан вы лично )));3;;Т3;4
2455;71467;189941;235920235;189818;25106701;24.04.2015 14:01;[id282878909|Данияр], о дикий кочевник об истории заговорил, сунешься ты к нам, про половцев вспомнил, хаха, уйгурец несчастный какое отношение ты к ним имеешь, как были отсталыми так и остались, вам Советская власть Байканур выстроила и много еще чего, а то бы жили в своих юртах, до сих пор.;0;;Н3;3
2456;71468;189943;282878909;189818;25106701;24.04.2015 14:02;[id6309141|Antony], воду лить ты знатный умела.<br>Путать тоже умелец.  Зачет.<br>В отличии от тебя я говорил фактами и датами. Есть что по делу?<br>Тут твоих больше согласен, не умением так числом?<br>Давай по делу, факты в студию, а там поглядим на что ты горазд.;0;;Н3;3
2457;71469;189944;235920235;189818;25106701;24.04.2015 14:02;[id282878909|Данияр], Ташкент, беки вам покажут чей Ташкент.;0;;У3;4
2458;71470;189947;235920235;189818;25106701;24.04.2015 14:03;[id282878909|Данияр], вот ты чья жертва надо разобраться.;0;;Н3;4
2459;71471;189949;282878909;189818;25106701;24.04.2015 14:05;[id1701518|Ким], хорошо что ты знаешь больше чем наши люди)<br>Вам то видней)<br>Что еще?<br>Как нам жить то, подскажи)<br>А то мы уж тут в растерянности.<br>Без вас никак.;0;;Ц3;4
2460;71472;189951;282878909;189818;25106701;24.04.2015 14:06;[id235920235|Галина], беки?;0;;А3;4
2461;71473;189952;235920235;189818;25106701;24.04.2015 14:06;[id282878909|Данияр], узбеки себя так иногда называют.;0;;И4;4
2462;71474;189954;6309141;189818;25106701;24.04.2015 14:07;[id282878909|Daniar], какими фактами и датами со мной ты говорил?)<br>Каким числом берем, каких моих тут ты насчитал? А-ну дружина моя, оставьте молодца славного! Ты на поле битвы что ли пришел? Я всего лишь хотел узнать причину твоего мнения. Есть такая казахская поговорка: В своем дворе и дворняжка тигром глядит. Так видимо ты решил сегодня здесь в комментах ее отобразить в виде миниатюры.<br>На всех ополчился, начал тут, с какого-то рожна, за весь Казахстан вещать. <br>Ладно, пообщались, мирного неба над головой.;1;;А3, Ц3, Г3;4
2463;71475;189955;282878909;189818;25106701;24.04.2015 14:08;[id235920235|Галина], ты узбечка, чтобы за них говорить?;0;;А3;4
2464;71476;189963;235920235;189818;25106701;24.04.2015 14:11;[id282878909|Данияр], знакома с ними и очень хороша, самые свирепые из азиатов и в Ташкенте была, у них были конфликты и с киргизами и с туркменами и с арийцами от азиатов имею в виду таджиков, а вообще я считала казахов самыми мудрыми из азивтоа, но после твоих коментов сомневаюсь.;0;;Е1, Н2;4
2465;71477;189967;282878909;189818;25106701;24.04.2015 14:13;[id6309141|Antony], запел голосистый?<br>Задел да?<br>Сорри не хотел. Нехер и тебе лезть в мой дом. Как то без твоих учений обойдемся. Учи своих как жить и что делать. Это ты тут распелся за весь регион кто и как должен жить. Учи жить кошаков в подворотне.<br>Ты мой дом не трогай и я к тебе не полезу. Доступно, умник?;0;;Р3, Ч3;4
2466;71478;189972;282878909;189818;25106701;24.04.2015 14:15;[id235920235|Галина], благо что ты такая то мудрая)<br>Я спокоен за Россию.<br>За себя мы как то сами подумаем. Спасибо.<br>;0;;Ц3;4
2467;71479;189977;235920235;189818;25106701;24.04.2015 14:18;[id282878909|Данияр], ответь мне на один вопрос к нам приезжает много казахов и живут у нас, нормальные ребята,а почему вы русских, украинцев с Кзахастана выдавливаете?;0;;А3,Т3;4
2468;71480;189982;1701518;189818;25106701;24.04.2015 14:23;Данияр, то, что ты казах в Казазстане - явно не показатель того, что ты разбираешься в политике собственных властей! А судя по твоим  После Украины топлю против России  создается впечатление, что тебе просто скучно, погорлопанить хочется, гонор показать) Показал. А теперь расскажи, что ты знаешь о ситуации на Украине и как собираешься  топить  против нашей страны? Ты же не просто так это сказал? Или просто?;0;;Ч3, А3;4
2469;71481;189984;6309141;189818;25106701;24.04.2015 14:25;[id282878909|Daniar], какой твой дом? Куда я лез? Сходи полечись)<br>Где я указал кому-то, кто и как должен жить? Я тут подумал, может ты с каким аналогом меня параллельно общаешься? Тебя почитать, так я уже в гости к тебе собирался или квартиру выносить. Где я вообще трогал твой дом? Я даже не знаю где он территориально находится. Хотя примерно догадываюсь по степени твоей упоротости, что он может быть желтого цвета. http://vk.com/doc195130_381504678;0;;Н3;4
2470;71482;189985;282878909;189818;25106701;24.04.2015 14:31;Antony, мудрец)<br>Че так прыгаешь то?)<br>Не проще ли общаться по делу, не разглагольствуя?<br>Как считаешь?<br>Степени упоротости твой конек?;0;;Ц3;4
2471;71483;189988;6309141;189818;25106701;24.04.2015 14:35;[id282878909|Daniar], так по делу, к сожалению, с тобой пообщаться не вышло, я же изначально и хотел. Ты очень агрессивен, причем не только со мной, это весна. ??;0;;Ч3;4
2472;71484;189989;282878909;189818;25106701;24.04.2015 14:38;[id1701518|Ким], согласен, ты в политике ас)<br>Почти сэнсей)<br>Куда нам то?)<br>Ты правильно понял после Украины я  смело топлю против России. На примере Украины стала видна вся лживость и двуличность политики русских властей. <br>А громкими эпитетами лечите свою пассию)<br>Если она у вас есть, учитывая что в пятницумвы тут топите беспрерывно)<br>Я вам не враг, пока вы не собрались против меня.<br>Думайте впредь что и как писать.;0;;Ц3, Ч4, Р3;4
2473;71485;189990;235920235;189818;25106701;24.04.2015 14:39;ребята вы сцепились на ровном месте и это глупо мы каждый любим свой народ и каждый будем защищать его, а в ВОВ все были вместе перед общей угрозой давайте это помнить будем.;0;;З3, П3;4
2474;71486;189991;6309141;189818;25106701;24.04.2015 14:40;Давайте, вообще тема про Клинтон была.);0;;З3 ;3
2475;71487;189993;235920235;189818;25106701;24.04.2015 14:40;[id282878909|Данияр], заметь и украинских властей еще больше, потому что этнических украинцев нет во власти, а есть проамериканские марионетки вот и все.;0;;Щ4 ;4
2476;71488;189994;235920235;189818;25106701;24.04.2015 14:41;[id6309141|Antony], вот именно.;0;;В3;4
2477;71489;189995;282878909;189818;25106701;24.04.2015 14:43;Галина, жду фактов выдавливания русских. Очень жду!<br>И отвечать вам попрошу своих русских родственников.<br>Также попросил бы факты  приезда многих казахов .<br>И еще.<br>Если вы приедете в Астану, готов вас отвезти в пункт проживания хохлов беженцев в Астане.<br>Слабо?<br>Жду ответов по пунктам, хватит воду лить.;0;;Т3;4
2478;71490;189997;282878909;189818;25106701;24.04.2015 14:49;Antony, кому ты лепишь?)<br>Нечего сказать?-мужчина отмазок не ищет. Слабо признать слабость своих доводов. А про весну иди рассказывать на <br>Рен ТВ и иже с ними.<br>Лох это судьба)<br>Если есть что сказать по делу - милости просим, а так - ты обычный тролль)<br>А то не высшего уровня);0;;П3, Щ3;4
2479;71491;189998;6309141;189818;25106701;24.04.2015 14:51;[id282878909|Daniar], успокойся, ярый воин)<br>Мой довод прост: все твои выкрики и оскорбления - лакмусовая бумажка твоей политической культуры. Никто не тронет твой дом, что кстати с ним?<br>Будь вежливее, вежливость города берет ??;1;;Ц3, Н3, П3;4
2480;71492;189999;235920235;189818;25106701;24.04.2015 14:53;[id282878909|Данияр], что касаеться казахов у нас в Поволжье, работала вместе с Айслу, она юрист отличная девчонка. Сейчас многие из Уральска покупают у нас квартирыи это правда. По поводу выдавливания, многие русские, а сначала это были немцы которые первыми покинули Казахстан в период перестройки, думаю для тебя это не новость, а сейчас русские и украинцы уезжают, те кто прожил не один год в Казахстане, обстановка сильно изменилась, по сравнению с советским периодом, объесняют тем ,что опасаються за будующее своих детей, особенно агрессивно ведут себя уйгуры, об этом мне рассказывал таксист, который прожил в Казахстане более тридцати лет, смысла врать или кого то настраивать у меня нет.;0;;Е1 ;4
2481;71493;190001;1701518;189818;25106701;24.04.2015 15:00;[id282878909|Данияр], а ты был в Украине? Или у тебя принципиальная позиция во всем винить РФ, клоун?;0;;Т3, Л3;4
2482;71494;190005;282878909;189818;25106701;24.04.2015 15:05;[id235920235|Галина], вы сказочница или комментатор?<br>Мы сами купили 2 квартиры в Самаре и Тюмени. Это выгодное вложение. Ибо рубль не уйдет в пике. Так мы считаем)<br>В прошлом году я пригнал из России 7 авто и продал их более чем выгодно)<br>Ваш пассаж об Айсулу я не понял)<br>Докончите его.<br>А на счет русских и немцов я вам скажу что многие из них вернулись обратно)<br>Просто потому что в РФ их приняли как  чурок . Если вы не встречали своих нациков вам повезло) я бы мог вам тут скинуть массу быдлофото и видео в доказательство. Но думаю не стоит)<br>Приглашаю вас в гости к нам - посмотреть что и как)<br>Милости просим);0;;Б3, Ж3;4
2483;71495;190009;282878909;189818;25106701;24.04.2015 15:09;[id6309141|Antony], не лепи тут святошу) ни к чему)<br>Насчет вежливости готов послушать что и как. <br>Если есть что по по факту то всегда просим. А лясы точить это вам на MDK);0;;Г3;4
2484;71496;190010;200419173;189818;25106701;24.04.2015 15:11;что вы все с чурбаном спорите? пока пишет злые коменты, смотрит в окно , видит молодого барашка, возбуждается..вот и агрессивный такой.. ))));0;;Н3;4
2485;71497;190011;282878909;189818;25106701;24.04.2015 15:13;[id1701518|Ким], клоун? Клоуна в зеркале не потеряй)<br>Открою секрет тебе. Я в Украине 2 года жил в Одессе и Полтаве. <br>И покажи мне где я во всем винил РФ, чудик);0;;Е1, Ф3;4
2486;71498;190014;282878909;189818;25106701;24.04.2015 15:17;[id200419173|Игорь], русские заражены нацизмом и шовинизмом???<br>Одни чурки, хохлы, чурбаны и нелюди.<br>И после этого вы куда то лезете?;0;;Ц3;4
2487;71499;190017;200419173;189818;25106701;24.04.2015 15:20;вообще то я не про нацию, а про конкретную злобную особь. Кстати, чурки и чурбаны одно и тоже. на ДР подарили час в инете? решил показать за короткое время какой ты жалкий ушлепок?.. поздравляю получилось )));0;;Ц3;4
