2488;71500;190018;235920235;189818;25106701;24.04.2015 15:21;[id282878909|Данияр], Айслу переехала из Казахстана в Самару, вы же сами говорите, что купили квартиру у нас, вот из Уральска многие и приезжают и работают- это во первых, во вторых сказочник это ты, какие немцы к вам вернулись не смеши они все давно в ФРГ, мы своих как чурок не принимаем, чушь несусветная, это у вас они оставили все и у нас начали с нуля, потому что здесь свое родное . Что касаеться украинцев, то больше всего беженцев у нас и дезертиры из АТО, те же западенцы бегут к нам. В России украинцев больше чем в Украине и многие из них за Россию порвут если хотите знать.;0;;Е1, Б3;4
2489;71501;190020;235920235;189818;25106701;24.04.2015 15:25;[id282878909|Данияр], что то ты везде жил, а чушь несешь несусветную, вопрос зачем? Если ты жил в Украине, то должен знать, что там заправляют евреи олигархи, которые постоянно делят её как беня Коломойский. Недавно убили Олеся Бузину, самого яркого журналиста и талантливого человека, только потому, что посчитали, что он пророссийский и что это опять русские?;0;;Ф3, И4,Т4;4
2490;71502;190021;200419173;189818;25106701;24.04.2015 15:27;Галина, не стоит с дебильчиком общаться. не обращайте на него внимания, жалкий тролль он и все. Мыл где то в России сортиры, теперь вернулся на родину и всю злость неудачника пытается здесь выплеснуть;1;;Г3, Н3;4
2491;71503;190022;235920235;189818;25106701;24.04.2015 15:27;[id282878909|Данияр], к сожалению у русских нет национализма в отличие от вас всех, что ж вы тогда у нас жилье покупаете, если мы такие плохие?;0;;П3;4
2492;71504;190024;282878909;189818;25106701;24.04.2015 15:31;Галина, я вам не враг и уж тем более врать мне незачем)<br>Если вы дружны то потрудитесь писать имя человека без ошибок) нет Айслу есть Айсулу. Вас то небось никто не кличет Гаина?<br>А немцев уйма вернувшихся обратно. Если нетрудно погуглите)<br>Также и про русских непринятых на родине. Вас ждут удивительные открытия)<br>А насчет хохлов.<br>То их жаль. Их кинули грамотно. Но даже так они заслуживают достойной жизни. Мира им. И ума. А русским побольше чести и величия. <br>Достойного величия.<br>А не быдловсплеска.;0;;П3, Р3, П4;4
2493;71505;190026;1701518;189818;25106701;24.04.2015 15:33;[id282878909|Данияр], я год жил в Одессе, год в Киеве, и последние полгода в Донецке. У меня есть альбом с трофейным дневником солдата с Волыни. Почитай, как им промывают мозг на тему России и Путина. Они идут на восток Украины, охваченные дичайшим национализмом и жестокостью, куда их никто не звал! Ничем не гнушаются ни убийствами мирных, ни изнасилованиями. О мародерстве и прочем беспределе, о потоках оскорблений и унижений вообще молчу. То, что народ Донбасса взялся за оружие - вполне закономерно! Как и помощь русских народу Донбасса! В чем двуличие властей РФ? Ты просто агрессивная жертва антироссийской риторики и национализма и не более того. Жертва, понимаешь? Сиди в своем Казахстане и занимайся своими делами, а не плюйся желчью в российских соцсетях, разжигая национальные конфликты,  топитель !;0;;Е1, Ж3, П3;4
2494;71506;190027;235920235;189818;25106701;24.04.2015 15:33;[id200419173|Игорь], не все так просто, это уже пропаганда. недавно познакомилась с таксистом, который раньше жил в Казахстане имел приличное жилье и работу, сейчас там происходят процессы, что славян выдавливают с должностей, бросил все и переехал в Самару с двумя детьми, все начал с нуля, говорить потихоньку нас выдавливают.;0;;Е1;4
2495;71507;190029;200419173;189818;25106701;24.04.2015 15:35;[id235920235|Галина], вообще может. Но я про конкретного жалкого дурачка. Не вступайте с таким ни в какие споры..не отмоетесь;1;;В3, Р3;4
2496;71508;190030;282878909;189818;25106701;24.04.2015 15:35;[id200419173|Игорь], черт, слабо поговорить?<br>Зачем закрыл личку?<br>Герой на фото?;0;;А3;4
2497;71509;190035;282878909;189818;25106701;24.04.2015 15:40;[id200419173|Игорь], ты че тут мелишь? <br>Нацист поганый.;0;;Т3;4
2498;71510;190038;235920235;189818;25106701;24.04.2015 15:42;[id282878909|Данияр], Айслу Шуриева поищи если интересно, и не учи тому, о чем представления не имеешь, а то еще обидешь девочку. И про уйму немцев нам рассказывать не надо, для роли просветителя явно не годишься знаний маловато, а амбиций много. Скромность и достоинство главная черта человека, вот и начни с себя и не пости больше глупость, а то нарвешься на нациков.;0;;П3, Н3, Р3;4
2499;71511;190048;282878909;189818;25106701;24.04.2015 15:59;[id235920235|Галина], умница, тебе словарь принести?<br>Айсулу-казахское имя.<br>Не понял, вы нацистка? Что нациками пугаете?)<br>С дуба рухнули, кто ваших нациков боится?!<br>Если вы нацистка, так и надо было начинать разговор, зачем выделываться?;0;;Н3;4
2500;71512;190051;235920235;189818;25106701;24.04.2015 16:05;[id282878909|Данияр], я нет, мне она представилась как Айслу, можешь её поиcкать на mail.ru. Или ты точно упертый или бестолковый, я что будут ваши имена изучать, у человека даже электронный адрес такой, кому верить тебе или ей, конечно ей. Не надо оскорблять русских, терпение не бывает вечным, ребята молодцы, еще пощадили тебя и диалог вели, как с подростком,молодцы, а до тебя не дошло.;0;;Н3;4
2501;71513;190052;282878909;189818;25106701;24.04.2015 16:09;[id235920235|Галина], ??.<br>Не сдерживайтесь!<br>Россия вперед!<br>Жду откровенных слов!<br>Сразу бы так)<br>А то строили невинность)<br>Жду.;0;;Ц3;4
2502;71514;190053;235920235;189818;25106701;24.04.2015 16:16;[id282878909|Данияр], да надоел ты мне я уже все сказала иди и радуйся жизни!;0;;Г3;4
2503;71515;190054;12446430;189818;25106701;24.04.2015 16:30;Да с кем вы общаетесь? Дурак дураком же. У человека тупо пукан бомбит беспричинно.;4;;Н3;4
2504;71516;190065;282878909;189818;25106701;24.04.2015 16:51;[id235920235|Галина], кончились аргументы?<br>Нефиг лезть тогда с бредовыми идеями.;0;;Р3;4
2505;71517;190066;282878909;189818;25106701;24.04.2015 16:52;[id12446430|Темир], ??.<br>Ты дебил и не знаешь об этом)<br>Не буду открывать тебе тайну)<br>Ооржак);0;;Л3 ;4
2506;71518;190067;12446430;189818;25106701;24.04.2015 16:56;[id282878909|Данияр], ты словами громкими не бросайся. Рано или поздно за неразумные деяния свои поплатишься, будь уверен. Смысла в онлайн базаре с тобой я не вижу. Больше ни слова тебе не напишу, так как ты совершенно неадекватный, салажонок.;0;;У3, Г3, Л3;4
2507;71519;190074;282878909;189818;25106701;24.04.2015 17:08;[id12446430|Темир], да ты я гляжу наиадекватнейший перец)<br>За базар я отвечаю не переживай, если герой давай в личку номер скину, поговорим, выскажешь боль свою.<br>За салажонка и спросить не грех. Хотя с чертилы как ты что с гуся воды.<br>На рожу глянь свою и задумайся над тем что лепишь и за кого топишь.<br>Лох это судьба. Помни это.;0;;М3, Л3;4
2508;71520;190124;1701518;189818;25106701;24.04.2015 17:57;Обычный галимый тролль, кароч);0;;Щ3 ;4
2509;71521;190247;-25106701;189818;25106701;24.04.2015 19:57;Так и чего тогда столько с ним общались, отвечали ему?;2;;А3;4
2510;71522;190575;218647862;189818;25106701;26.04.2015 16:21;Последний президент Обама вроде как;0;;Ц3;4
2511;71523;190969;16668702;189818;25106701;27.04.2015 21:47;[id218647862|Эдуард], если на этом кончится то ты был прав.;0;;В3;4
