6257;18443;257503;280979147;257284;25106701;2015-11-02 14:30:53;[id82853210|Сергей], по твоей логике американцы тоже в Иге китайском живут?<br>Там тоже все молотки и топоры китайского производства,и не только молотки , а и многое другое .<br>Так что ты пацак,на это скажешь ?<br>Кто америкосов в китайское Иго завёл?<br><br>Или может это всемирное разделение труда?;0;;Н3;4.0
6258;18444;257504;190576448;257284;25106701;2015-11-02 14:31:04;А ты Брежневским инструментом пользуйся, он же вечный)));0;;Ш3 ;4.0
6259;18445;257505;82853210;257284;25106701;2015-11-02 14:32:07;[id190576448|Алексей], дело в том,что я в отличии от тебя Гражданин и о Родине думаю.А вот ты,-население...;0;;е3, н3;4.0
6260;18446;257506;190576448;257284;25106701;2015-11-02 14:34:16;Очень интересно, чтобы рыбу в пруд запустить нужны молоток и топор из Китая! Буду знать;0;;ш3;4.0
6261;18447;257508;82853210;257284;25106701;2015-11-02 14:37:13;[id190576448|Алексей], нужна 100 справок и разрешений от вовиной Вертикали.И не успеешь малька в пруд пустить,а уже куча всяких Вертикальных органов  и инспекций и просто уважаемых людей к тебе за данью выстроится.Ты знаешь,сколько бизнесменов в зону ушло,ни за что? Просто Вертикаль бизнес отжала.;0;;И3;4.0
6262;18448;257509;190576448;257284;25106701;2015-11-02 14:37:51;Получается наоборот: Я Гражданин, Патриот Великой России, а ты бездельник, который хочет все нахаляву, и таким как ты, я стабильно отчисляю деньги в пенсионный фонд, получается ты живешь за мой счет, другими словами ты- паразит;0;;е1, н3;4.0
6263;18449;257510;316530684;257284;25106701;2015-11-02 14:38:12;[id280979147|Марат], я в курсе просто тролль он не образованный )) он не на один вопрос ответить не может ! чушь несет жуликиворывсеукрали) Шариков он!!;0;;л3, Н3;4.0
6264;18450;257511;82853210;257284;25106701;2015-11-02 14:39:38;[id190576448|Алексей], да ты пиздобол и раб,не более.Сегодня одному Ура кричишь,а завтра его обоссышь,когда скажут и будешь следующего до слёз любить! Готовься,уже скоро Плешивый банкрот уже спёкся...;0;;л4;4.0
6265;18451;257512;190576448;257284;25106701;2015-11-02 14:39:45;Не надо рассказывать, мы скинулись, поехали купили малька, и выпустили в пруд.... Все усилия! Без бумажек и разрешения, было бы желание. А ты только языком работаешь;0;;Е1, н3;4.0
6266;18452;257513;82853210;257284;25106701;2015-11-02 14:40:52;[id190576448|Алексей], еще не вечер ! (с) Повезло пока,так молчи в тряпочку.У них кормушка сужается,завтра придут за тобой.;0;;о3, Т3;4.0
6267;18453;257514;316530684;257284;25106701;2015-11-02 14:41:53;[id190576448|Алексей], он шизофреник);0;;л3;4.0
6268;18454;257515;190576448;257284;25106701;2015-11-02 14:43:15;Заметьте, я Вас не называл ничем подобным))) как ВВП говорит: Если меня ругают, значит я прав! Что и требовалось доказать);0;;к3, ж3;4.0
6269;18455;257516;190576448;257284;25106701;2015-11-02 14:44:14;Там букет похуже будет));0;;Ш3;4.0
6270;18456;257517;82853210;257284;25106701;2015-11-02 14:45:41;[id190576448|Алексей], у меня больше нет времени на ваше развитие и образование.Дальше ,без меня! Удачи...;0;;г3;4.0
6271;18457;257519;24794470;257284;25106701;2015-11-02 14:46:07;[id82853210|Сергей], сдался... Слабачок.;0;;л3;4.0
6272;18458;257520;82853210;257284;25106701;2015-11-02 14:46:37;[id24794470|Андрей], ага...Три дебила,-это сила!!!;0;;л3;4.0
6273;18459;257521;190576448;257284;25106701;2015-11-02 14:46:54;В больнице процедуры начались?;0;;л3;4.0
6274;18460;257522;316530684;257284;25106701;2015-11-02 14:47:14;да мирош в маразме);0;;л3;4.0
6275;18461;257523;82853210;257284;25106701;2015-11-02 14:47:23;[id190576448|Алексей], остроумно! Задорного смотрите?;0;;б3,а3;4.0
6276;18462;257525;24794470;257284;25106701;2015-11-02 14:48:42;[id82853210|Сергей], выставил себя дебилом и сваливаешь. За что тебе только деньги сша платят.;0;;л3,Н3;4.0
6277;18463;257526;190576448;257284;25106701;2015-11-02 14:49:13;Раньше смотрел, сейчас времени нет;0;;е1;4.0
6278;18464;257533;190576448;257284;25106701;2015-11-02 14:53:06;Меня не интересуют Ваши физиологические особенности про жопу, как-нибудь сами с ней разбирайтесь;0;;е1, г3;4.0
6279;18465;257537;190576448;257284;25106701;2015-11-02 14:56:06;Слава Великой России!!! Путину Слава!;0;;Х4,С3;4.0
6280;18466;257539;181724904;257284;25106701;2015-11-02 14:56:39;[id82853210|Сергей], Почему Вы такой злой?;0;;а3;4.0
6281;18467;257540;82853210;257284;25106701;2015-11-02 14:56:39;[id190576448|Алексей], врача!!! Суицидник...;0;;л3;4.0
6282;18468;257542;190576448;257284;25106701;2015-11-02 14:57:36;У него нет велосипеда)));1;;ш3;4.0
6283;18469;257543;82853210;257284;25106701;2015-11-02 14:58:39;[id190576448|Алексей], зато с мозгами повезло.В отличии...;0;;Ф3;4.0
6284;18470;257546;24794470;257284;25106701;2015-11-02 14:59:39;[id82853210|Сергей], повезло - понятие относительное ахаха;0;;Ц3;4.0
6285;18471;257548;190576448;257284;25106701;2015-11-02 15:00:45;Я на свои тоже не жалуюсь;0;;е1;4.0
6286;18472;257549;181724904;257284;25106701;2015-11-02 15:00:56;Кошмар просто ужас!!Сергей со всеми ругается;0;;Т3;4.0
6287;18473;257550;82853210;257284;25106701;2015-11-02 15:01:06;[id190576448|Алексей], я уже устал вам,недоразвитым,объяснять,что Родина и Власть,это не всегда одно и тоже! А в некоторые времена,как сейчас,-прямо противоположное.А увас ума не хватает Родину и Власть отделить...;0;;л3, П3;4.0
6288;18474;257551;181724904;257284;25106701;2015-11-02 15:01:49;[id82853210|Сергей], Какая власть Вас устроит?;0;;а3;4.0
6289;18475;257553;24794470;257284;25106701;2015-11-02 15:02:18;[id82853210|Сергей], а дело не во власти, видно вам одному плохо живется;0;;ж3;4.0
6290;18476;257554;82853210;257284;25106701;2015-11-02 15:02:33;[id181724904|Александр], надоело из пустого в порожнее...Вам бы в кучу как то собраться...;0;;г3, р3;4.0
6291;18477;257555;190576448;257284;25106701;2015-11-02 15:03:10;Второй раз: Я Вас не оскорблял;1;;ф3;4.0
6292;18478;257557;82853210;257284;25106701;2015-11-02 15:03:32;[id24794470|Андрей], сегодня я живу не хуже тебя,но я в отличии от насекомого о завтрашнем дне думаю.;0;;е3,Л3;4.0
6293;18479;257558;181724904;257284;25106701;2015-11-02 15:04:26;[id82853210|Сергей], Причем здесь куча !! Мне просто интересно какая власть устроит лично Вас?;0;; а3;4.0
6294;18480;257559;24794470;257284;25106701;2015-11-02 15:05:06;[id82853210|Сергей], не заметно. Все тя здесь говном считают. Скоро в прессе про тебя писать будут про самого неудачливого блогера;0;;л3, У3;4.0
6295;18481;257560;82853210;257284;25106701;2015-11-02 15:06:32;[id24794470|Андрей], вова доигрался,завтра на рынок нефти выходит Иран и нефть будет по 10 баксов.А другого у нас ничего нет.вова все погубил,только труба,а молотки уже не можем,из Китая везем.Вот и прикинь,как будешь жить?;0;;И3, У3;4.0
6296;18482;257561;24794470;257284;25106701;2015-11-02 15:07:15;[id82853210|Сергей], хорошо буду жить. Не переживай. Сам не загнись.;0;;Ф3, У3;4.0
6297;18483;257563;82853210;257284;25106701;2015-11-02 15:07:53;[id24794470|Андрей], Иногда я вам,идиотам,даже завидую!!!;0;;л3, е1;4.0
6298;18484;257565;24794470;257284;25106701;2015-11-02 15:08:30;[id82853210|Сергей], а че только иногда?;0;;а3,Ш3;4.0
6299;18485;257566;190576448;257284;25106701;2015-11-02 15:09:06;А Вы как будете тогда жить? Смею предположить, что Вы любому интервенту двери откроете с хлебом-солью;0;;а3, Т3;4.0
6300;18486;257567;82853210;257284;25106701;2015-11-02 15:09:21;[id24794470|Андрей], догадайся...Или у дежурного доктора спроси...;0;;ш3;4.0
6301;18487;257568;82853210;257284;25106701;2015-11-02 15:09:42;[id190576448|Алексей], освободителю!!!;0;;ш3;4.0
6302;18488;257569;24794470;257284;25106701;2015-11-02 15:10:36;[id82853210|Сергей], судя по всему ты еще сам не придумал.;0;;Ц3;4.0
6303;18489;257570;181724904;257284;25106701;2015-11-02 15:10:55;[id82853210|Сергей], Ну кто этот ОСВОБОДИТЕЛЬ?;0;;Ц3;4.0
6304;18490;257571;82853210;257284;25106701;2015-11-02 15:11:00;[id190576448|Алексей], чем мне вова с Озером милее? Придут люди поумнее и честнее.;0;;а3, и4;4.0
6305;18491;257573;181724904;257284;25106701;2015-11-02 15:12:46;[id82853210|Сергей], ну Вы скажите кто кто эти кристально честные люди??;0;;а3;4.0
6306;18492;257574;82853210;257284;25106701;2015-11-02 15:13:00;[id181724904|Александр], нас в 90-х могли голыми руками взять.Но пожалели,научили огород копать и бананы выращивать! Но мы оказались необучаемы.Теперь из Рязани в Казань по визам ездить будем.И претензии не ко мне,а к вове.;0;;Т1,У1,Т4;4.0
6307;18493;257578;190576448;257284;25106701;2015-11-02 15:14:41;Предательство это называется, а это уже статья. Вот Ваша суть пребывания тут и всплыла. Самое позорное в это жизни предать своего близкого: Семью, жену, ребенка, соседа... Низшая ступень эволюции...;0;;ж3, п3 ;4.0
6308;18494;257579;82853210;257284;25106701;2015-11-02 15:14:59;[id181724904|Александр], ваши соседи.Мои.Еще чьи то...Не Боги горшки обжигают.;0;;ж3;4.0
6309;18495;257580;181724904;257284;25106701;2015-11-02 15:15:25;[id82853210|Сергей], Вы можете ответить на мой вопрос?? Кто придет на смену ?? Где и кто эти люди которые кристально честные и сделают нас счастливыми?;0;;а3;4.0
6310;18496;257581;82853210;257284;25106701;2015-11-02 15:16:09;[id190576448|Алексей], кого предательство ? Плешивый вор неудачник с поехавшей крышей,мне ни разу не Родина.Пусть катится в Гаагу...;0;;Ф3, л4;4.0
6311;18497;257582;190576448;257284;25106701;2015-11-02 15:16:42;Честные, порядочные и добрые друзья НАТО, вот его идолы и боги;0;;Ц4;4.0
6312;18498;257583;82853210;257284;25106701;2015-11-02 15:16:52;[id181724904|Александр], как ответить на глупость?;0;;а3;4.0
6313;18499;257584;82853210;257284;25106701;2015-11-02 15:17:45;[id190576448|Алексей], Да НАТО страшное уже 100 лет в Ульяновске.вова лично пригласил! Так что не ссы...;0;;Ц3;4.0
6314;18500;257585;82853210;257284;25106701;2015-11-02 15:18:56;[id190576448|Алексей], http://vk.com/photo82853210_329943293 http://vk.com/photo-25106701_385382631;0;;;
6315;18501;257586;181724904;257284;25106701;2015-11-02 15:19:04;[id82853210|Сергей], Ну Вы же сами пишите !! Что нынешнее руководство погрязло в коррупции !! Значит должен кто то придти после них? Кого Вы хотели бы видеть ? У руля нашей страны?;0;;Ж3, а3;4.0
6316;18502;257587;82853210;257284;25106701;2015-11-02 15:20:22;[id181724904|Александр], Да выборы,выборы...И они начинаются за долго до дня голосования.Свобода собраний,доступ к средствам массовой информации.А потом уже -кого?;0;;ж3;4.0
6317;18503;257590;181724904;257284;25106701;2015-11-02 15:22:32;[id82853210|Сергей], Ну Вы здесь выражаете свою точку зрения Вам никто этого не запрещает?! Выдвигайте своих кандидатов!! Это тоже не запрещено!! В чем дело то?;0;;а3, р3;4.0
6318;18504;257592;181724904;257284;25106701;2015-11-02 15:23:32;[id82853210|Сергей], Предвыборные программы агитация кто Вам мешает?;0;;а3 ;4.0
6319;18505;257594;82853210;257284;25106701;2015-11-02 15:23:43;[id181724904|Александр], В 80-х тоже казалось,что вокруг одно Политбюро и Ни-Ко-Го...Но когда дали свободу и столько людей появилось,что глаза разбежались! Один из них был Собчак,кот орый привел с собой носильщикачемоданов вову путина.Без которого вы теперь и жизни не представляете.Так будет и сейчас.;0;;ж3, и4;4.0
6320;18506;257595;190576448;257284;25106701;2015-11-02 15:24:32;Керри, Маккейн вот его кандидаты;0;;Н3;4.0
6321;18507;257597;181724904;257284;25106701;2015-11-02 15:25:07;[id82853210|Сергей], Да откуда Вам знать без кого или без чего я жизнь свою не представляю?;0;;Ф3;4.0
6322;18508;257598;82853210;257284;25106701;2015-11-02 15:25:25;[id181724904|Александр], воры не допускают к средствам массовой информации,не разрешают собрания.Сажают по надуманным предлогам оппозицию.Убивают Немцова,чуть ли не в кабинете вовы.Это свобода?;0;;Т3;4.0
6323;18509;257599;82853210;257284;25106701;2015-11-02 15:25:52;[id181724904|Александр], зная одного,познаешь весь вид.(с);0;;п3;4.0
6324;18510;257600;181724904;257284;25106701;2015-11-02 15:27:18;[id82853210|Сергей], у Вас есть факты? Если есть Вы можете обратиться в СК или Прокуратуру да куда угодно!! Что мешает??;0;;а3;4.0
6325;18511;257602;82853210;257284;25106701;2015-11-02 15:28:31;[id181724904|Александр], да какие еще факты??? Какие СК и Прокуратура??? Это охранка воров.Фикция,иммитация.Государства давно нет.;0;;б3, Т4;4.0
6326;18512;257604;190576448;257284;25106701;2015-11-02 15:29:45;А где есть государство? Пример в студию!;0;;Ц3;4.0
6327;18513;257605;82853210;257284;25106701;2015-11-02 15:29:56;Про Госдуму еще забыли...;0;;ж3;4.0
6328;18514;257606;82853210;257284;25106701;2015-11-02 15:30:08;[id190576448|Алексей], пустословие.;0;;Ч3 ;4.0
6329;18515;257607;181724904;257284;25106701;2015-11-02 15:30:29;[id82853210|Сергей], Ну скажите что КОНКРЕТНО Вы предлагаете?? Может найдутся люди которые Вас поддержат!!;0;;Р3;4.0
6330;18516;257609;190576448;257284;25106701;2015-11-02 15:31:33;Пример приведите, не надо отвечать необоснованными фразами;0;;р3;4.0
6331;18517;257610;82853210;257284;25106701;2015-11-02 15:31:46;[id190576448|Алексей], где Власть через срок,максимум два меняется.А не подделывает Конституцию со словом  подряд ...;0;;ж3;4.0
6332;18518;257611;190576448;257284;25106701;2015-11-02 15:32:31;США?;0;;а3;4.0
6333;18519;257612;190576448;257284;25106701;2015-11-02 15:32:53;Украина?;0;;а3;4.0
6334;18520;257613;82853210;257284;25106701;2015-11-02 15:32:53;[id190576448|Алексей], и это уже не Власть а узурпаторы.Преступники.;0;;Т4;4.0
6335;18521;257614;280979147;257284;25106701;2015-11-02 15:33:00;[id181724904|Александр], чего вы хотите от свидомого поцреота, поклонника Бандеры и Шухевича? <br>Сырожа поцреот Шенэвмерленда и Пиндостана,мечтает о развале России.<br>Что ещё с этого убогого?;0;;а3, л3;4.0
6336;18522;257615;190576448;257284;25106701;2015-11-02 15:33:00;Гандурас?;0;;а3;4.0
6337;18523;257616;82853210;257284;25106701;2015-11-02 15:33:37;[id190576448|Алексей], мальчик,у меня на детские шутки времени нет...;0;;К3;4.0
6338;18524;257617;82853210;257284;25106701;2015-11-02 15:34:36;[id280979147|Марат], чего,чего говоришь,козолюб горный? Кто такие?;0;;л3;4.0
6339;18525;257618;190576448;257284;25106701;2015-11-02 15:34:41;Я не увидел конкретного примера страны, в которой Вам бы хотелось жить;0;;ж3;4.0
6340;18526;257619;190576448;257284;25106701;2015-11-02 15:34:54;Дядя;0;;И4;4.0
6341;18527;257620;280979147;257284;25106701;2015-11-02 15:35:34;[id82853210|Сергей], в США уже почти 300 лет власть не меняется, у власти две партии , вся разница которых только в глубине мошны очередного дежурного кандидата в президенты, фигуры которая стала в США марионеточной уже давно.<br>Там правит бал наднациональная олигархия .;0;;И3;4.0
6342;18528;257621;82853210;257284;25106701;2015-11-02 15:35:41;[id190576448|Алексей], значит я не по адресу.За взрослого тебя принял.Думал ты книжкм читал???;0;;н3;4.0
6343;18529;257622;181724904;257284;25106701;2015-11-02 15:35:58;[id280979147|Марат], Да ясно все!;0;;ж3;4.0
6344;18530;257623;82853210;257284;25106701;2015-11-02 15:36:05;[id280979147|Марат], не физди,кклоун горный...;0;;л3 ;4.0
6345;18531;257624;82853210;257284;25106701;2015-11-02 15:37:22;[id181724904|Александр], что тебе ясно? Что кавказ на тебе еще поездить хочет? Так катай их без меня...;0;;а3, с3;4.0
6346;18532;257625;181724904;257284;25106701;2015-11-02 15:37:56;[id82853210|Сергей], А с чего ты взял что он с гор?;0;;а3;4.0
6347;18533;257626;82853210;257284;25106701;2015-11-02 15:38:08;[id181724904|Александр], так личка...;0;;Н3;4.0
6348;18534;257627;280979147;257284;25106701;2015-11-02 15:38:59;[id82853210|Сергей], нет,ты всем тут объясни как могут быть демократическими выборы, если президента назначает выборная комиссия, а не  прямые выборы как у нас?;0;;ж3;4.0
6349;18535;257628;82853210;257284;25106701;2015-11-02 15:39:51;[id280979147|Марат], слушай...Ты стрелки на Анунаков то не переводи...Разговор о России.;0;;р3;4.0
6350;18536;257629;190576448;257284;25106701;2015-11-02 15:39:56;По-моему Вы находитесь и проживаете не по адресу;0;;ж3;4.0
6351;18537;257631;82853210;257284;25106701;2015-11-02 15:40:33;[id190576448|Алексей], слишком умно для меня???;0;;а3;4.0
6352;18538;257632;280979147;257284;25106701;2015-11-02 15:41:46;[id82853210|Сергей], что,нечего сказать?<br>Только кликушествовать и лгать и умеешь!<br>И за что тебе , тролль,платят,ты же полное ничтожество как до предметного спора доходит.;0;;л3;4.0
6353;18539;257633;82853210;257284;25106701;2015-11-02 15:42:21;[id280979147|Марат], пустословие...Есть что по делу и со смыслом?;0;;а3;4.0
6354;18540;257634;190576448;257284;25106701;2015-11-02 15:42:33;Слишком тупо обсирать то место, которое Вам предоставило все благо цивилизации,  благодаря которому Вы на данный момент существуете;0;;п3;4.0
6355;18541;257635;280979147;257284;25106701;2015-11-02 15:42:50;[id190576448|Алексей], да он даже не россиянин.;0;;ж3;4.0
6356;18542;257636;82853210;257284;25106701;2015-11-02 15:43:09;[id190576448|Алексей], кто мне что представил? ОПГ Озеро?;0;;а3;4.0
6357;18543;257637;82853210;257284;25106701;2015-11-02 15:43:32;[id280979147|Марат], ага...Всю ночь язык учил...;0;;н3;4.0
6358;18544;257638;280979147;257284;25106701;2015-11-02 15:43:47;[id82853210|Сергей], по делу <br>Кто по твоему может заменить Путина на посту президента РФ!;0;;а3;4.0
6359;18545;257639;190576448;257284;25106701;2015-11-02 15:44:26;Перестаньте меня цитировать и перефразировать. Постом выше я Вам высказал то же самое;0;;Р3;4.0
6360;18546;257640;82853210;257284;25106701;2015-11-02 15:44:36;[id280979147|Марат], ты рамсы не путай,неуч..Этого пока никто не знает? Кого люди выбиркт!;0;;л3, ж3;4.0
6361;18547;257641;280979147;257284;25106701;2015-11-02 15:44:53;[id82853210|Сергей], не надоело бредни Жуковского, Коха и Илларионова повторять?;0;;Т3;4.0
6362;18548;257642;190576448;257284;25106701;2015-11-02 15:44:53;Оно-так будет точнее;0;;И3;4.0
6363;18549;257643;82853210;257284;25106701;2015-11-02 15:45:56;[id280979147|Марат], перебьешься...Сам не Бердяев...Еще дедушка кроме козы нифига не видил,а туда же!!! Не устраивает пастуха!;0;;Л3;4.0
6364;18550;257644;280979147;257284;25106701;2015-11-02 15:46:25;[id82853210|Сергей], хорошо, зайдём с другой стороны.<br>А кого бы ты хотел видеть президентом России?<br>;0;;а3;4.0
6365;18551;257645;82853210;257284;25106701;2015-11-02 15:47:24;[id280979147|Марат], да ты читать то умеешь? Любого! Честно избранного.Тебя,так тебя,но что бы честно...;0;;Н3;4.0
6366;18552;257646;181724904;257284;25106701;2015-11-02 15:47:44;[id82853210|Сергей], Мы живем в мультинациональной стране об это не нужно забывать);1;;п3;4.0
