6367;18553;257647;280979147;257284;25106701;2015-11-02 15:48:12;[id82853210|Сергей], не сбивайся на личности,убогий,по делу говори.<br>Меня твои ксенофобские фантазии не интересуют.;0;;л3, г3;4.0
6368;18554;257648;190576448;257284;25106701;2015-11-02 15:48:24;Ты живешь где? В России ( хотя не верится) у тебя есть гражданство, жилье, работа... Или тебе это не государство предоставляет?;0;;а3;4.0
6369;18555;257649;82853210;257284;25106701;2015-11-02 15:48:50;[id181724904|Александр], я вырос в СССР,гле русский,был старшим братом.Впиталось.А я себя считаю русским,в Украине не бывал,связей нет.;0;;е3;4.0
6370;18556;257650;280979147;257284;25106701;2015-11-02 15:49:19;[id82853210|Сергей], а честно это как?<br>Только того,кто устраивает Госдеп США ?;0;;а3;4.0
6371;18557;257651;280979147;257284;25106701;2015-11-02 15:50:14;[id190576448|Алексей], врёт он,и не краснеет!??;0;;щ3;4.0
6372;18558;257653;190576448;257284;25106701;2015-11-02 15:50:50;Для меня и сейчас украинец-брат ( не путать с бандеровцами и прочей нечестью);0;;е1;4.0
6373;18559;257654;82853210;257284;25106701;2015-11-02 15:50:50;[id190576448|Алексей], как в гости надумаю пригласить,сообщу.А пока...Я им зад как ты не лижу.И убить и посадить могут.;0;;Ф3, Т4;4.0
6374;18560;257655;181724904;257284;25106701;2015-11-02 15:51:00;[id82853210|Сергей], Я Вам про Украину и не пишу!! Просто Ваше выражение про старшего брата отдает национализмом !!;0;;ф3, ж3;4.0
6375;18561;257656;82853210;257284;25106701;2015-11-02 15:51:38;[id181724904|Александр], так у меня в букваре было.Впиталось.;0;;е1;4.0
6376;18562;257657;190576448;257284;25106701;2015-11-02 15:52:27;Слишком маленький ты человек, чтобы об этом думать))) Без обид.;0;;н3;4.0
6377;18563;257658;181724904;257284;25106701;2015-11-02 15:52:39;[id82853210|Сергей], Я что в не помню про такое в букваре) Может разные буквари были);0;;е1, ж3;4.0
6378;18564;257659;82853210;257284;25106701;2015-11-02 15:52:51;[id190576448|Алексей], это ты маленький.Я Гражданин!;0;;н3, е1;4.0
6379;18565;257662;82853210;257284;25106701;2015-11-02 15:53:29;[id181724904|Александр], щас погуглю,попробкю...;0;;е1;4.0
6380;18566;257664;181724904;257284;25106701;2015-11-02 15:53:48;[id82853210|Сергей], ок;0;;в3;4.0
6381;18567;257666;190576448;257284;25106701;2015-11-02 15:54:04;А если в гости, то пожалуйста, мой дом открыт;0;;е1,Д3;4.0
6382;18568;257669;190576448;257284;25106701;2015-11-02 15:54:46;Я не великий, но я Гражданин, и у меня есть своя позиция по этому поводу;0;;е1;4.0
6383;18569;257673;82853210;257284;25106701;2015-11-02 15:59:32;[id181724904|Александр], https://otvet.mail.ru/question/40226189;0;;;
6384;18570;257674;82853210;257284;25106701;2015-11-02 15:59:46;Ладно,пока.Дела...;0;;г3;4.0
6385;18571;257678;181724904;257284;25106701;2015-11-02 16:01:49;[id82853210|Сергей], А где про букварь??;0;;а3;4.0
6386;18572;257683;82853210;257284;25106701;2015-11-02 16:12:36;[id181724904|Александр], http://cosmoforum.ucoz.ru/_fr/0/3511827.jpg http://vk.com/photo-25106701_385389336;0;;;
6387;18573;257807;252652514;257284;25106701;2015-11-02 19:17:41;[id82853210|Сергей], ты хоть в курсе,что русский язык,  российским  называют свидомые?;1;;а3,Н3;4.0
