3350;6138;80598;35627207;80516;32803139;2015-03-08 23:27:02;[id168154272|Андрей], предыдущие комменты Вы, видимо, пропустили? Вы хотите, чтобы я Вам на пальцах, для умственно отсталых перевела то, о чем экономисты пишут статьи? <br>В комментах, кстати, ссылки на ПОПУЛЯРНЫЕ изложения ответа на Ваш вопрос. Еще короче и популярнее смысла нет - дошкольникам это не должно еще быть интересно.;1;;;Ч3;4
3351;6139;80599;168154272;80516;32803139;2015-03-08 23:30:50;[id35627207|Анна], ну хотя бы в двух словах. У меня под окнами летом на лавочке полно экономистов собирается. Если всех слушать, можно свихнуться. Вы своими, простыми словами скажите: отбирать всё и делить :  повышать налоги или снижать :  бороться с коррупцией, или хрен с ней :  привлекать иностранные инвестиции с технологиями, или наши лапти и так самые лучшие в мире :  деньги будем тратить на оружие или на образование :  что делать со здравоохранением.... Миллион вопросов.;2;;;Ж4;4
3352;6140;80601;45328830;80516;32803139;2015-03-08 23:52:49;вот гебня проклятая, Данте приняли гады  : );2;;;Л4;4
3353;6141;80605;109220606;80516;32803139;2015-03-09 00:09:23;[id45328830|Максим], ничего святого.);1;;;В3;4
3354;6142;80607;45328830;80516;32803139;2015-03-09 00:17:09;[id109220606|Роман], ой не говори.<br>Вот кто же Беатриче нашей демшизы?<br>Курносова смылась...;1;;;Ж4;4
3355;6143;80669;186613057;80516;32803139;2015-03-10 04:49:32;[id45328830|Максим], http://vk.com/video186613057_171250384;0;;;Ж3;4
3356;6144;80670;45328830;80516;32803139;2015-03-10 04:51:38;[id186613057|Стас], и?;0;;;А3;4
3357;6145;80672;186613057;80516;32803139;2015-03-10 04:54:03;[id45328830|Максим], вы заинтересовались и я с вами поделился;0;;;К1;4
3358;6146;80673;45328830;80516;32803139;2015-03-10 04:54:52;[id186613057|Стас], Курносовой заинтересовался?;1;;;А3;4
3359;6147;80680;71106;80516;32803139;2015-03-10 14:58:23;[id35627207|Анна], Задача России найти своем место в мировой экономике, и уйти от позорной позиции сырьевого придатка Запада.<br> Стоны слепых и глухих ватников про оппозицию без экономической программы... Ну это как Бегемоту объяснять смысл Капитала Карла Маркса));0;;;Р4, Ш4;4
3360;6148;80682;35627207;80516;32803139;2015-03-10 15:08:38;[id71106|Александр], и Вам: см. мои комментарии выше - там как раз  Стоны слепых и глухих ватников  - экономистов, политологов;0;;;Б3;4
3361;6149;80683;71106;80516;32803139;2015-03-10 15:10:57;[id35627207|Анна], Болдырев чо ватник что ли?)) Ватники это любители путинского сапога и борцы с Гейропой. А нормальные люди понимают, что с Европой нужно дружить и про свое производство не забывать. Модернизация это такое слово из совсем каких то прошлых времен...;0;;;А3, Щ4, Е1;4
3362;6150;80684;35627207;80516;32803139;2015-03-10 15:14:08;[id71106|Александр], в Вашей терминологии Болдырев типичный ватник.<br>А Вам совет - на двух стульях одной, даже очень большой жопой не усидеть, и не пытайтесь.;0;;;Ч3;4
3363;6151;80685;71106;80516;32803139;2015-03-10 15:16:43;[id35627207|Анна], А стоять на стороне путинских террористов или парашенковских карателей, мне совесть не позволяет если что. Убийцы и разжигали войны будут гореть в Аду.<br> У меня нормальная точка зрения, что Россия это Европа, но не колония Европы!;0;;;Щ4, У4, И4;4
3364;6152;80686;35627207;80516;32803139;2015-03-10 15:20:24;[id71106|Александр], понятно! Историю и географию в средней школе проспали...;0;;;Ч3;4
3365;6153;80687;71106;80516;32803139;2015-03-10 15:24:53;[id35627207|Анна], Вот именно, что не проспал. Россия всегда была частью Европы, и даже татаро-монгольская катастрофа не смогла стереть Россию с карты Европы.;0;;;О4;4
