;Unnamed: 0;Id of comment.;Id of author of comment.;Id of post;Author of post;date;text;likes;Unnamed: 7;
3566;5724;80945;79609;80944;32803139;19.03.2015 21:43;а если тока 1 этап?;0;Ж4;1
3567;5725;80946;1169819;80944;32803139;19.03.2015 21:43;[id79609|Константин], это ж сортировка, а не оценка. В любом случае можно отсортировать.;0;И4;2
3568;5726;80947;79609;80944;32803139;19.03.2015 21:44;[id1169819|Лев], сложно, если 1 период можно назвать более или менее правильным - а два других равноудаленным от этог опонятия?;1;Ж4;2
3569;5727;80948;1169819;80944;32803139;19.03.2015 21:45;[id79609|Константин], тогда в роспотребнадзор жалуйтесь :) к сожалению, в контакте можно не более 10 вариантов, всего не предусмотреть :(;1;Ш3,К4;4
3570;5728;80949;687602;80944;32803139;19.03.2015 21:56;Какая последовательность может быть?<br>Перестройка была необходима! +<br>Бандитские 90-е - общество пыталось бороться с криминалом и это почти получилось<br>Но тут пришли бандиты, организованные на государственном уровне - Гы-Бы-шники<br> - какой идиот называет это стабильностью??? Россия утоплена в дерьме ГБ-шников....;2;Ж4,Т4;3
3571;5729;80952;209523550;80944;32803139;19.03.2015 23:32;Я бы выбрала совершенно другие этапы в истории страны - времена Михаила Тверского или, например, Алексея Романова.;2;И4;3
3572;5730;80953;1741422;80944;32803139;20.03.2015 0:54;[id687602|Дмитрий], по моим наблюдениям, да и не только моим, в 90-е общество сидело обгадившись со страху и балдело от происходящего, и никакой борьбой там и не пахло. Все смотрели на криминально-олигархическую клику и слово поперёк сказать боялись.;0;Н4;3
3573;5731;80954;2668694;80944;32803139;20.03.2015 2:39;[id1741422|Сергей], в моем лице общество в 90-е работало в школе и балдело от того, что можно было делать все что угодно, и никакого миллиона взаимоисключающих указаний и идиотских бумажек не было. Страха я не помню, наоборот. А в нулевые у нас уже был пафосный педагогический конкурс под названием  Урок президенту  :(;6;Х4, Ч4;3
3574;5732;80955;168154272;80944;32803139;20.03.2015 8:59;[id1741422|Сергей], в 90-е было очень трудно материально, но была надежда и возможности. Некоторые, поураганив, даже смогли стать президентами. Теперь легче существовать, но полная безнадега. Я бы предпочел сейчас  лихие  90-е.;4;Ч4;2
3575;5733;80958;1741422;80944;32803139;20.03.2015 12:18;Да да с этим я знаком: распилил какой-нибудь завод на металлолом, оставшуюся землю продал, а с выручки погулял и купил ещё один завод под снос - шикарные перспективы, страна цветет и пахнет, хочешь - с голоду пухни, а хочешь - грабь кого только сможешь :  успехи в работе и радость семейной жизни. Это таким значит вы видите светлое будущее страны? Таким образом Болотные лидеры собирались улучшать благосостояние граждан и бороться с коррупцией? Ну вот заявите такую политическую программу и придите с ней на выборы я посмотрю кто за вас проголосует. Может вас и утаивает перспектива поживиться на тонущем корабле, но вот народ это не устраивает и если вы за честные выборы то должны отдавать себе в этом отчет.;0;Н3, Ч4;4
3576;5734;80959;1741422;80944;32803139;20.03.2015 12:22;Делай все что угодно это видимо означает, что по приходу на работу наливаешь себе чайку и говоришь:  Детки у вас сегодня выходной  - все рады и никто никому не выносит мозг....?;0;Ш4;4
3577;5735;80960;168154272;80944;32803139;20.03.2015 12:46;[id1741422|Сергей], вы по возрасту не могли быть с этим знакомы, как пишите. Похоже, что вы видите эту историю упрощённо до примитивного. Лично я в начале 90-х заводы на металлолом не  пилил , но много пилил древесины, так как занимался тогда производством столярных изделий. У меня была небольшая мастерская и 5-7 рабочих. В 2004 вынужден был всё закрыть. Убила аренда и налоги.;6;Е3,Ч4;4
3578;5736;80961;1741422;80944;32803139;20.03.2015 13:14;[id168154272|Андрей], Я эту историю знаю потому что у меня масса знакомых у которых на глазах всё разворачивалось, а некоторые и участвовали в этом, в частности я был свидетелем как выносили лаборатории ГОИ разрушая при этом ценнейшее оборудование сдавая его по цене лома. Выбирая между конторкой на 8 человек, которая пилит лес, при чём не известно как, и институтом оптики я бы с превеликой радостью оставил последний. Естественно что в 90-е никто не душил вас налогами потому что это было абсолютно не важно: ну копаются мыши в мусорной куче и пускай, все равно сейчас бульдозер проедет. Разница между 90-ми и нулевыми состоит в том что в 90-е было стремительное пике к развалу страны и гражданской войне, а в нулевые это пике удалось перевести в медленное сползание.;0;Ч4;4
3579;5737;80962;168154272;80944;32803139;20.03.2015 13:26;[id1741422|Сергей], специально для вас и других таких же, кто не видел, но от кого-то слышал, в Европейском университете по средам (в 18-00) профессор Дм. Травин читает лекции по периоду советского застоя. Исключительно полезно. Я постараюсь выложить на YouTube.;0;Р3;4
3580;5738;80964;1741422;80944;32803139;20.03.2015 13:40;Застой конечно коррелирует с событиями 90-х, которые как я уже вам говорил, а вы не пожелали услышать, я наблюдал лично, но одно дело застой а другое дело обвал.;0;Т3,Н4;4
3581;5739;80965;168154272;80944;32803139;20.03.2015 13:53;[id1741422|Сергей], обвал 90-х неизбежно вытекал их застоя. Это я вам точно говорю, как свидетель того и другого.;3;В4;4
3582;5740;80969;168154272;80944;32803139;20.03.2015 14:40;[id1741422|Сергей], если о 90-х говорить на уровне досужих разговоров, то всё уже сказал Ельцин:  Во всём виноват Чубайс . Если же разбираться по-серьезному, лучше начать с книги Е.Гайдара  Гибель империи . Там на документах и цифрах показано в каком состоянии оказался Советский Союз к середине 80-х. Я понимаю, что вы ненавидите Гайдара, но никто ещё так же документально его не опроверг.;1;Ш4, П4;4
3583;5741;80975;1741422;80944;32803139;20.03.2015 16:27;То есть вы думаете что в этой книге Гайдар даёт честную и объективную оценку своим действиям и той системе которую он ненавидел? Что же он говорит о политике дефицитных денег, которую он проводил и том как это сказывалось на стране? Что говорил он о том как совал пачки денег танковым командам, за расстрел белого дома во время ГКЧП?  Проблемы у СССР были, но их можно было решать, а не разваливать страну.;2;Ч4;4
3584;5742;80980;175118514;80944;32803139;20.03.2015 17:32;[id1741422|Сергей], наоборот, в 90-е говорить можно было о чём угодно и выражаться как угодно, даже ОМОН бить. Только это ни на что не влияло. Время было такое совершенно дурацкое, по-моему только чеченцы адекватно оценили ситуацию, остальные просто впали в ступор. Лично у меня было ощущение полного маразма вокруг и сюрреальности происходящего. Я ожидал, что до всех наконец дойдёт, что пора с этим кончать и браться за ум. Но в те годы взяться за ум значило взяться за оружие__силой прекратить бардак, поскольку всё остальное, повторюсь, ни на что не влияло. Потому я и вспомнил чеченов. В те годы я понял, что в России гражданской войны не будет никогда. У неё на это выработался железный иммунитет. Самые активные взялись тогда за оружие в частном порядке, добывая этим оружием либо блага жизни, либо место на кладбище.<br>Впрочем и сейчас мало что изменилось по сути, только нефть дороже__недовольных меньше, говно упаковано в красивые коробочки с этикетками и украшено государственными брендами.;0;Ч4;4
3585;5743;80981;2102258;80944;32803139;20.03.2015 17:38;[id1741422|Сергей], то, что было заложено в 90-ые - базовые принцпы рыночной экономики - как раз и позволило выжить при низких ценах на нефть, и повысить уровень жизни, когда нефть поднялась в цене. Более того, это и сейчас, при абсолютно провальных политических решениях несменяемого путина даёт механизмы спасения экономики от полного коллапса. Собственно, блага, которые мы имеем сейчас - оттуда. Из реформ 90-ых. А беды, которые мы имеем сейчас - из-за того, что не все реформы 90-ых были доведены до конца и реализовались. Прежде всего, мы оказались не в состоянии удержать в стране демократию.;2;Х4,Ч4;4
3586;5744;80982;168154272;80944;32803139;20.03.2015 18:17;[id1741422|Сергей], я не могу вам пересказать книгу, в которой 590 страниц с таблицами, диаграммами и сотнями ссылок на ДОКУМЕНТЫ. Вам, как и путину, удобней существовать в другой реальности, наполненной мифами и пропагандой. Но для тех, кто действительно хочет разобраться, эта книга очень полезна.;1;Ч3,Х4;4
3587;5745;80983;1741422;80944;32803139;20.03.2015 18:29;[id168154272|Андрей], Ну вам-то она плохо помогает ориентироваться в реальной политике, в вашем понимании, был неблагополучный период застоя, из которого выбрались путем хорошего падения в 90-х, потом случилось неизвестно что (Даниил что-то про демократию говорит, но после выборов Ельцина на второй срок, когда обсуждали вопрос изменения конституции, потому что у Ельцина был рейтинг 4% извините какая уж там демократия) и стало плохо.;0;Н3;4
3588;5746;80984;168154272;80944;32803139;20.03.2015 18:41;[id1741422|Сергей], в ваших словах уже что-то разумное проглядывает. Застой был действительно  неблагополучным  периодом (только не надо мне рассказывать, как хорошо жилось при Брежневе вам, новорожденному). Этот застой ЗАКОНОМЕРНО привел страну к экономическому краху, который сделал неизбежным крах политический. Гайдар провел тяжелые для людей, но абсолютно необходимые реформы, хотя и с ошибками, которые признает в своих книгах. Но  плодами  этих реформ воспользовалась Антанта, состоящая из криминала, гэбухи и номенклатуры. Народ при этом разделился на два лагеря - коммунисты и демократы, которые увлеченно мочили друг друга. Теперь мы вползаем в новый застой, и крах страны при этом также неизбежен. Вы ещё молодой, выучите китайский язык, и у вас все будет хорошо.;1;Ч4,П3;4
3589;5747;80991;29383383;80944;32803139;20.03.2015 22:41;[id168154272|Андрей], По поводу Гайдара Вам лучше обратиться к Явлинскому. Он уж точно непосредственный участник событий ,не согласный с Вашей точкой зрения (о Гайдаре) и экономист. Хотя бы уж так,для объективности.;0;Р3;4
3590;5748;80992;168154272;80944;32803139;20.03.2015 22:44;[id29383383|Вера], как только вы, для объективности прочтёте  Гибель империи , я с той же целью прочту что-нибудь из Явлинского. А что я неправильно изложил?;0;У4,К3;4
3591;5749;80993;29383383;80944;32803139;20.03.2015 22:52;[id168154272|Андрей],  Неправильно  быть не может,т.к. это Ваше мнение,но оно не совпадает с моим . Я знакома с работами Гайдара (выборочно,правда, врать не буду).;0;Ф3,О3;4
3592;5750;80994;168154272;80944;32803139;20.03.2015 22:56;[id29383383|Вера], так выскажите-же своё вИдение истории.;0;Р3;4
3593;5751;81002;2668694;80944;32803139;21.03.2015 4:16; Делай все что угодно это видимо означает, что по приходу на работу наливаешь себе чайку и говоришь:  Детки у вас сегодня выходной  - все рады и никто никому не выносит мозг....?  <br>Сергей, этими словами Вы гораздо больше сказали о себе и о своем понимании свободы, чем, к примеру, о моей работе в школе в 90-е. Я работала в 2 или 3 школах одновременно, с нагрузкой за 30 часов (при норме в 18), и все равно понимание того, что ты свободно можешь делать то, что считаешь нужным, давало кучу сил. И страха - не было. А сейчас учителя боятся всего, всего - директора, завуча, проверяющих, коих тьма, родителей, районной администрации, методистов...;3;Щ4;4
3594;5752;81003;168154272;80944;32803139;21.03.2015 9:42;[id2668694|Галина], боюсь, что сейчас Сергею не понять ценность свободы. Для этого нужно либо самому пройти через диктатуру, либо книги нужные прочитать.;0;П3;4
3595;5753;81004;2102258;80944;32803139;21.03.2015 11:27;[id168154272|Андрей], а я боюсь, что тут всё несколько хуже. Сергей уже не маленький мальчик, а взрослый сформированный мужчина, вероятно, имеющий круг общения, старших родственников, что-то читающий. И у него иные ценности. Думаю, это прежде всего потому, что его окружение не смогло почувствовать, осознать того воздуха свободы, которым мы тогда дышали. Каждому кажется важным что-то своё. Кому-то - важны были возможности посмотреть мир своими глазами, читать те книги, которые хочется, ни от кого не прячась, работать в своё удовольствие и для себя. А кто-то страдал от закрытия неэффективных производств, и отчаянно завидовал более удачливому соседу-кооператору.;1;Ч3,П4;4
3596;5754;81006;168154272;80944;32803139;21.03.2015 13:13;[id2102258|Даниил], бог с ним, с Сергеем. Тут миллионы людей, в том числе и пожившие при СССРе, настоявшиеся в очередях за туалетной бумагой, предпочитают питаться мифами и пропагандистской ложью. Они,  пожилые , обвиняя реформаторов во всех смертных грехах, забыли, что советскую экономику, неэффективную и ориентированную на войну, невозможно было  переделать  быстро и без огромных потерь. Реформаторы сделали немало ошибок, но главное они сделали правильно - дали людям свободу предпринимательства и прекратили вбухивать деньги в ВПК и безумные госпроекты. Спасибо им скажут только через много лет, и Гайдар знал, что он и его правительство - камикадзе. Именно им мы должны быть благодарны, что  Россия встала с колен . Им и Усаме-бин-Ладену, из-за которого взлетели цены на нефть. Заслуги Путина в этом нет никакой. Вот за то, что страна опять катится в ..опу мы скажем потом  Спасибо  Владимиру Владимировичу.;1;Х4, Ч4;4
3597;5755;81009;168154272;80944;32803139;21.03.2015 19:00;В Европейском Университете по средам проходят лекции профессора Травина  Добро пожаловать в застой . Полезно как молодым, так и очевидцам.<br>Первая лекция прошла 11 марта.<br><br>http://youtu.be/2fU9e5yJLFA<br>http://youtu.be/D-S7IEIt6hA<br>http://youtu.be/mqbfO6MkCtY<br>http://youtu.be/pqgWAve6pUA http://vk.com/video168154272_171218929;2;Р4;4
3598;5756;81016;29383383;80944;32803139;22.03.2015 3:53;[id168154272|Андрей], Очень неплохой анализ исторического периода https://vk.com/yuri_boldyrev?w=wall-19071927_55222 (для сравнения Вам,все же Болдырев возглавлял счетную палату,т.е. был практиком,в отличии от Травина);0;Р4;4
3599;5757;81017;168154272;80944;32803139;22.03.2015 10:14;[id29383383|Вера], спасибо за ссылку. Я начал с интересом читать, но смог дойти только до пассажа о том, что у нас либералы  занимают все ключевые посты в государственной власти, включая и пост Президента, и Парламент, и Правительство, и Центральный банк . Дальше просмотрел по диагонали. Болдырева я уже больше 20 лет воспринимаю как талантливого популиста. Вот и в этом тексте он свалил в кучу вполне разумные мысли и полный бред. Я так и не понял, он поддерживает Путина, или нет?<br> Ну, а что касается связи занимаемой должности с разумом, я много повидал талантов на своём веку. Вот один из них: http://vk.com/lozhsmi?z=video183475613_170679880%2Fe97f83621d371a0c92 P.S. В среду 25 марта в 18-00 будет очередная лекция Травина, посвященная пропаганде в СССР. Приходите. http://vk.com/video183475613_170679880;1;Ж4;4
3600;5758;81020;29383383;80944;32803139;22.03.2015 14:02;[id168154272|Андрей], Думаю,стоит перечитать не  по диагонали .;0;Р3;4
3601;5759;81032;168154272;80944;32803139;22.03.2015 15:42;[id29383383|Вера], да я бы прочитал, но, как  споткнулся  об его бред про либералов во власти, всё. Не могу себя пересилить.;0;Ч4;4
3602;5760;81033;29383383;80944;32803139;22.03.2015 17:20;[id168154272|Андрей], Потому,что жить в  возвышающем обмане  удобнее (Вам).У Вас все,что не соответствует Вашему мнению - бред. Я Вас уговаривать не стану (знаю,как это трудно).;0;Т3;4
