;Unnamed: 0;Id of comment.;Id of author of comment.;Id of post;Author of post;date;text;likes;Unnamed: 7;
3804;5355;81455;19353280;81454;32803139;08.04.2015 21:01;Какой смысл принимать участие в этом фэйке?;1;Ж4;1
3805;5356;81456;1741219;81454;32803139;08.04.2015 21:28;[id19353280|Дмитрий], свидетельствовать. Вскрывать. Обращать внимание. В частности, на демагогический и ритуальный, церемониальный характер мероприятия, проводимого за бюджетные деньги.<br><br>Наконец, хотелось бы, чтобы молодые люди, которых элементарно используют - хотя бы понимали, что их используют, отдавали себе в этом отчет.<br><br>Кроме того, не вполне понятно, ради чего это все затеяно. Это может быть не самая удачная попытка  потратить  деньги на  работу с молодежью . А могут ведь потом преподнести, например, в виде  решения  какой-нибудь избирательной комиссии. Мне кажется, в частности поэтому стоит с самого начала заявлять о правовых границах этой инициативы.;3;Р3,Ч4;2
3806;5357;81461;29383383;81454;32803139;09.04.2015 2:49;[id1741219|Виктор], Они не поймут !Все опутано сетями для молодых(молодежные советы, проекты,общ. движения - все с финансированием из бюджета). Для молодых - это игра   в  Зарницу   ,как кто-то недавно хорошо сравнил,и одновременно тешит их самолюбие. А для власти -  приручение  подрастающего поколения (ну ,кто же не будет благодарен  учителям  и спонсорам). Это уже налаженная система,можете не пытаться открыть глаза амбициозным молодым людям,обманутых (насильно втянутых) среди них единицы.;0;Б3,Ч4;3
3807;5358;81469;29383383;81454;32803139;10.04.2015 0:27;[id1741219|Виктор], Вот,пример- звучит все  правильно  http://vk.com/video-59203058_171579653;0;Р4;3
3808;5359;81470;1741219;81454;32803139;10.04.2015 1:23;[id29383383|Вера], я, наверное, не очень точно выразился.  Открывать глаза  кому-то не сильно отличается по сути и содержанию от  плетения сетей . По сути, та же пропаганда. Я, скорее, про простые вопросы, на которые непросто ответить... И  приручение  - дело тоже не такое однозначное: я и пионером был, и  посты  там занимал (в комсомол, правда, вступать не стал), и в Зеркальный ездил (хоть и не как  активист ). Но многое из моего нынешнего мировоззрения, отношения к происходящему берет корни оттуда...;0;К3,П3;4
3809;5360;81471;29383383;81454;32803139;10.04.2015 1:42;[id1741219|Виктор], Причем здесь пионеры и комсомол ? . Большинство из нас (я о своем поколении) не воспринимало это ,как идеологически направленную деятельность.Я с октябрят - активистка (по ныне),но попытка меня  приручить  - бессмысленное дело . Выбора для активных детей и подростков не было,да и разговор,насколько я понимаю, о взрослых (пусть и молодых). Да,пропаганда... Но ! Власть точно определила контингент для своей пропаганды,а Вы можете охарактеризовать тот слой ,на который рассчитана Ваша (из тех,кому  глаза открывать ) ? Простые вопросы(на которые сложно ответить) - это вечные вопросы.Они не относятся к идеологии и даже мировоззрению,скорее к системе ценностей.;0;Ч3;4
3810;5361;81472;1741219;81454;32803139;10.04.2015 1:46;[id29383383|Вера], я же и говорю, что пропагандой не хочется заниматься. Поэтому и слой определять не важно. Потом, почему Вы считаете, что сейчас такие мероприятия воспринимаются как идеологически направленные? И тогда, и сейчас есть те, кто под это попадает, и те, кто не попадает. Лично я особой разницы со своим детством не вижу (молодость моя, к счастью, вообще лишена была всей этой суеты).;0;К3,П3;4
3811;5362;81493;19353280;81454;32803139;13.04.2015 11:47;[id1741219|Виктор], твои текущие регулярные посты являются лучшим примером пропаганды, т.е. распространением взглядов, фактов, аргументов и других сведений для формирования общественного мнения или иных целей, преследуемых пропагандистами);0;Т3;4
3812;5363;81495;1741219;81454;32803139;13.04.2015 12:17;[id19353280|Дмитрий], во-первых, лично я регулярных постов не делаю. Во-вторых, я не уверен, что публикацию каких-либо материалов в этой группе можно назвать  распространением сведений . Можно ли серьезно говорить о формировании общественного мнения, доводя свои взгляды до 56 читателей в сутки (820 в месяц)? Какой-то отклик такие публикации вызывают у единиц. Даже  закон о блоггерах  устанавливает планку в 3000 уникальных читателей! Редакторы, насколько мне известно, не пытаются специально увеличивать аудиторию группы или отдельных сообщений. Но каждый интересующийся всегда может ознакомиться.<br><br>При всем своем желании я не могу относится к этой группе как к каналу пропаганды. Читателями здесь являются очень узкий круг людей, заинтересованных в весьма специальной проблематике. Эта группа - возможность делиться с ними своим мнением, находками, открытиями. Вот можно научную публикацию называть пропагандой? Это тоже распространение взглядов, фактов, аргументов, формирующее общественное мнение, но среди весьма узкого круга лиц (который, как правило, заметно шире читательской аудитории этой группы!).<br><br>Наконец, хоть это и не пропаганда, хорошо бы ответить на вопрос по поводу  преследуемых целей . Цель, в которой заинтересован лично я - изучение разных сторон избирательной системы РФ, Северо-Запада РФ и Санкт-Петербурга, ее совершенствование. Лично я публикую те сведения, факты, которые могли бы представлять интерес как для заинтересованных читателей, так и для избирательных органов. Конечно, не все, что здесь публикуется - соответствует тому образу, который эти органы хотели бы создать о себе. Но они могут пользоваться этой информацией совершенно безвозмездно для совершенствования своей работы.;0;Ф3,И4;4
3813;5364;81496;5156359;81454;32803139;13.04.2015 12:18;[id1741219|Виктор], в каком году были в лагере для активной комсы Зеркальном? Я там был где то в 75-76-м. Не в коня корм, промахнулась со мной советская власть. А вас почитаешь ,кажется, что до сих пор делу Ленина, типа, верны ??;0;Ш3,Н3;4
3814;5365;81497;1741219;81454;32803139;13.04.2015 12:21;[id5156359|Геннадий], во второй половине 80-х, несколько раз. И я там был как  пассив  - творческие коллективы, вот это все. Делу Ленина я вряд ли верен, потому что никак не могу взять в толк, в чем оно заключается. А вот на мировоззрение школьно-пионерское детство определенное влияние оказало, даже спорить не буду!;1;Е3,К3;4
3815;5366;81508;19353280;81454;32803139;13.04.2015 14:45;[id1741219|Виктор], формирование общественного мнения даже у небольшой социальной группы - это тоже формирование общественного мнения) Насколько мне известно, редакторы этой группы изначально ставили цель увеличить ее численность и предпринимали меры по привлечению новых подписчиков, но пока мы наблюдаем противоположный результат. Возможно, это связано с общей усталостью от массового потока пропаганды со всех сторон, или понижением доверия к публикациям группы, или их ценностью для читателей...<br>Публикации, имеющие сущностное содержание и познавательную новизну, легко отличить от критических однонаправленных заметок этой группы, поэтому для совершенствования своей работы избирательные органы вряд ли будут пользоваться публикуемой здесь информацией) <br>Вот если бы здесь опубликовали список наших предложений СПЧ в области совершенствования избирательного процесса, то ее содержание могло бы привлечь внимание действительно широкого круга лиц, в том числе из избирательной системы, почему не постим?);0;И4,П3;4
3816;5367;81511;1741219;81454;32803139;13.04.2015 15:09;[id19353280|Дмитрий], публикации всякие важны! Конкретно эта расценивалась редакторами не как пропагандистская, а как глубоко ироничная. Увы, иронию эту можно ощутить лишь погрузившись в обсуждение  Петербургских принципов . Сделать такую иронию очевидной и кричащей - значило обесценить ее. Было решено оставить текст более серьезным. <br><br>Изменить  критически однонаправленную  тематику этой группы возможно лишь через публикацию заметок, имеющих альтернативное содержание. Это всячески приветствуется. С другой стороны, авторы реализуют свое право на выражение своего мнения, на поиск и распространение информации. Думаю, будет не очень корректным навязывать им, какое именно  собственное  мнение им стоит выражать, разве нет?<br><br>Наконец, в этой группе сложился определенный стиль, формат. Это все же не узкоспециализированное издание. Здесь можно говорить о серьезных и сущностных проблемах, но нельзя говорить о них серьезно. Я делал попытки - такие публикации здесь не воспринимаются вообще. Думаю, всему свое место.;0;3,П3;3
3817;5368;81516;29383383;81454;32803139;13.04.2015 18:28;[id1741219|Виктор], Два вывода (может быть не самых важных)из Ваших высказываний здесь я позволю себе сделать: 1) Все-таки, очень расплывчато звучит  очень узкий круг людей, заинтересованных в весьма специальной проблематике  (гораздо более расплывчато,чем при создании группы) и ,следовательно хочется как-то его  обозначить .2) Складывается впечатление,что Вы несете груз  вины  за пионерское детство,что странно для зрелого человека (простите,это мое ощущение). в связи с этим не могу не вспомнить фразу Ю.Нагибина :   Самые большие антисемиты - это полукровки  (извините еще раз,это ассоциативно);0;Н3;4
3818;5369;81517;1741219;81454;32803139;13.04.2015 18:58;[id29383383|Вера], это как в школе: каждый учитель считает свой предмет самым главным. Но одни ученики любят одни предметы, другие - иные. Пик интереса к этой группе - в преддверии выборов и несколько дней после. Все остальное время интерес достаточно постоянный, но не столь высокий. Это объективно, на основе статистики, которую предоставляет vk.com Когда-то мы из-за этого переживали, но лично я не думаю, что это - столь серьезная проблема. Всему свое время.<br><br>Нет-нет, никакой вины за пионерское детство нет! Напротив, довольно много весьма позитивных воспоминаний. И осознание, что корни того, что я такой, какой я есть - там. Это ни хорошо, ни плохо, я не испытываю ни гордости, ни сожаления из-за этого. И я думаю, меня сложно назвать (в ассоциативном смысле, не в прямом!)  самым большим антисемитом !;0;К3,И4;4
3819;5370;81519;29383383;81454;32803139;13.04.2015 20:00;[id1741219|Виктор], Я всегда считала,что главная задача учителя - заинтересовать. И предмет может быть не главным (поддерживая Вашу аналогию),а влияние - на всю жизнь.Все зависит от степени любви к предмету самого учителя.;0;И4;4
3820;5371;81520;1741219;81454;32803139;13.04.2015 20:05;[id29383383|Вера], тут проблема еще и в том, что мы сами учимся. По сути делимся теми открытиями, которые делаем в ходе самообучения.;0;К3;4
3821;5372;81522;29383383;81454;32803139;13.04.2015 21:18;[id1741219|Виктор], Проблема ни в ограниченности знаний ,а в увлеченности и искренности. Именно на этом я акцентирую внимание. Когда-то я запомнила фразу (может банальную), что  не каждый классный историк может быть экскурсоводом  (это опять ассоциативно,простите). Как можно привлечь-увлечь,если сам сомневаешься ?!;0;И4;4
3822;5373;81541;19353280;81454;32803139;14.04.2015 12:47;[id1741219|Виктор], отметил для себя два твоих тезиса:<br>1.  авторы реализуют свое право на выражение своего мнения, на поиск и распространение информации. Думаю, будет не очень корректным навязывать им, какое именно  собственное  мнение им стоит выражать, разве нет? <br>2.  Здесь можно говорить о серьезных и сущностных проблемах, но нельзя говорить о них серьезно .<br>Но ты не дал ответ на последний вопрос:<br> Вот если бы здесь опубликовали список наших предложений СПЧ в области совершенствования избирательного процесса, то ее содержание могло бы привлечь внимание действительно широкого круга лиц, в том числе из избирательной системы, почему не постим?) ;0;Ч3;4
3823;5374;81542;1741219;81454;32803139;14.04.2015 13:45;[id19353280|Дмитрий], <br>2. Оговорюсь - нельзя говорить о них только серьезно.<br><br>Лично я не знаю, что именно передали - итогового документа не видел. Во-вторых, насколько я знаю и правильно понял, у наших предложений есть определенные недостатки (несоответствие постановлению КС РФ, в частности). Опять же, насколько я понял, на основе наших и других предложений готовится общий документ. В частности, предложения переформулируются (у нас получился список конкретных предлагаемых изменений, а готовящиеся предложения будут менее конкретны, но иметь сущностные акценты).<br><br>Мне кажется, что публиковать стоит не наши предложения, а то, что сформулирует СПЧ (или те, кто занимается этой работой).<br><br>И я совершенно не понимаю, почему этот материал (наши скомпилированные предложения, сухой технический документ, содержательная оценка которого требует определенных специальных познаний) сможет привлечь внимание действительно широкого круга лиц.;0;Ф3,И4;4
3824;5375;81550;19353280;81454;32803139;14.04.2015 15:11;[id1741219|Виктор], это концептуальная проблема - быть экспертом или критиком, созидателем или разрушителем. Быть или не быть - в конце концов!)<br>Есть два племени:<br>1. Одни ругают непогоду, клянут ее за дождь и снег, бывает, пляшут хороводы, взывают к  богу , журят его, да толку нет.<br>2. Другие скромно создают одежду, жилье и свет, систему знаний, управления, все в их руках, бог есть, но им не до него)))<br><br>Мы призывали широкую общественность для участия в выработке этих рекомендаций, многие активисты откликнулись, в результате обсуждений были выбраны наиболее эффективные, на наш взгляд. В сокрытии итогового документа от широкого круга лиц нахожу нарушение принципа открытости и проявление неуважения к участникам, как минимум, саботирование созидательного конструктивного дискурса в нашей группе, как максимум);0;Ч3;4
3825;5376;81563;29383383;81454;32803139;15.04.2015 0:27;[id19353280|Дмитрий], Всего два племени? И оба такие скучные...;0;Ч4;4
3826;5377;81564;1741219;81454;32803139;15.04.2015 0:36;[id19353280|Дмитрий], вот чего я не пойму. Ведь последний раз я что-то пытался делать с этими предложениями одновременно с тобой... Лишь в том я виноват, что не ощущаю потребности разыскивать некоторый промежуточный продукт? Куски готовящегося итогового документа, думаю, я видел какое-то время назад - но до итога там еще было далеко на мой взгляд. Лично я этой работой не занимаюсь.<br><br>Обратился к словарю антонимов: http://antonymonline.ru/<br>эксперт - невежда<br>критика - синтез<br>созидатель - разрушитель<br>быть - заканчивать, скрываться;0;Ч3;4
3827;5378;81565;5156359;81454;32803139;15.04.2015 0:44;[id19353280|Дмитрий], таким языком можно просто напугать и отпугнуть случайного читателя. А посвященные и так знают, что всё плохо и интерес к выборам с гулькин хер. Вот такой дискурс. http://vk.com/photo-32803139_362468222 http://vk.com/photo-32803139_362484298;1;Ч3;4
3828;5379;81566;19353280;81454;32803139;15.04.2015 0:59;[id29383383|Вера], согласен, скучные... Кругом черно-белое кино. Как бы вырваться из этого замкнутого круга?;0;В4,Ж4;4
3829;5380;81567;29383383;81454;32803139;15.04.2015 1:06;[id19353280|Дмитрий], Сейчас в мире существует  охота  на спецов. (это на профессионалов). Для общ. организации здесь вполне определяемые критерии. Для начала ,понаблюдайте за аудиторией (даже когда не сами выступаете). Кстати,  скука  - не такой немаловажный критерий ,особенно для молодежи, как кажется.;2;И4;4
3830;5381;81568;19353280;81454;32803139;15.04.2015 1:07;Витя, ты изложил свои доводы, почему не стоит публиковать наши рекомендации СПЧ, я изложил обратные. По поводу вины ты драматизируешь)<br>Галина мне прислала материалы, теперь я и сам вижу, что они не готовы для публикации(;1;К3,И4;4
3831;5382;81569;1741219;81454;32803139;15.04.2015 1:22;http://lenta.ru/articles/2015/04/14/pravo/;1;;
