3664;85160;174170;8564611;174079;25106701;13.03.2015 15:16;[id76805079|Александр], я знаю...Если б можно было повторить-я б никогда на месте Сталина не освобождала европу...За что погибли миллионы наших ребят? чтоб сейчас задавали вопрос что Россия типа монополизирует право на Победу? у меня такое ощущение-что только евреи благодарны-и понимают вклад СССР...А европа? она такая европа...не дает им спать спокойно тот факт что все их попытки нас пригнуть- оборачиваются разгромом...Мы им все прощаем и они век от века поднимаются- а у нас времени на передышку нет..;0;Щ4;4
3665;85161;174171;76805079;174079;25106701;13.03.2015 15:24;[id8564611|Оксана], удивляет то, что больше всего гадят на победу те, кто сильнее других в европе пострадал от войны, Польша, например...;0;Т4;4
3666;85162;174175;8564611;174079;25106701;13.03.2015 15:28;[id76805079|Александр], пшеки? так они самые позорники и есть...Речь посполитная не удалась...после войны 1812 года их государственности лишили...Хуже нет шавок которым четко указали их место..Чехов пилить они первые-а сами под Гитлера легли махом...Я как то читала мемуары Пилсудского..Очень он не политкорректно отзывался о нации своей...Да и новый их-забыла кто-помните скандал? что типа кроме как отсасывать у штатов-они больше ни на что не способны? и кстати...мне всегда было интересно почему в РФ анекдоты про чукчу- а в америке-про пшеков? народ видать не обманешь...;0;Н4;4
3667;85163;174176;8564611;174079;25106701;13.03.2015 15:30;хотя лично у меня-отношение к действиям властей и к народу в целом-это две большие разницы...Мой дед про очень хороших поляков рассказывал- они жизнь его другу спасли...Выходили...и прятали от банд 4 месяца..;0;Ж4;4
3668;85164;174180;168699879;174079;25106701;13.03.2015 15:49;http://vk.com/photo-25106701_356286144;3;Е1;4
3669;85165;174183;235920235;174079;25106701;13.03.2015 15:57;[id90551571|Сергей], не надо я лучше чем вы осведомлена в этом вопросе, и не будьте попугаем повторяя пошлые банальности.;0;Б3;4
3670;85166;174200;76805079;174079;25106701;13.03.2015 17:19;[id8564611|Оксана], ну да, везде есть хорошие люди, просто где-то их меньше, где-то больше...;0;Б3;4
3671;85167;174201;76805079;174079;25106701;13.03.2015 17:21;[id8564611|Оксана], кстати, вы случайно не знаете этого поляка? http://vk.com/tomekpl;0;А3;4
3672;85168;174202;8564611;174079;25106701;13.03.2015 17:22;[id76805079|Александр], нет;0;Б3;4
3673;85169;174203;8564611;174079;25106701;13.03.2015 17:22;[id76805079|Александр], а почему вопрос?;0;А3;4
3674;85170;174206;76805079;174079;25106701;13.03.2015 17:24;[id8564611|Оксана], с ним подискутировать - одно удовольствие))) яростнейший русофоб, занимается пропагандой и, по слухам, воевал в составе нацгвардии украины...;0;И4;4
3675;85171;174207;8564611;174079;25106701;13.03.2015 17:25;[id76805079|Александр], да и Бог с ним...мало ли уродов сейчас на просторах незалежной носится...Обращать внимание на всякую гавкалку- ни здоровья...ни желания-нет!;0;Г4;4
3676;85172;174213;176477073;174079;25106701;13.03.2015 17:43;Господин поляк таки не читал учебников истории, по которым нас учили. Либо врет умышленно. В любом случае непорядочный человек.;3;Т4;4
3677;85173;174857;29931127;174079;25106701;16.03.2015 15:47;Чтя газета? Польская? Все ясно. В параллельной вселенной Третий Рейх уничтожает польская кавалерия, а США и Англия им просто помогают.;0;Ш2;3
