6700;69703;192128;212553600;191969;25106701;01.05.2015 17:07;[id82853210|Сергей], ты где, алкаш, я не закончил с тобой беседу.;1;;;Л3;4
6701;69704;192129;212553600;191969;25106701;01.05.2015 17:09;[id82853210|Сергей], это доказательство что ты невменяемый алкаш, что еще у тебя есть, вываливай. ??;1;;;Л3;4
6702;69705;192132;212553600;191969;25106701;01.05.2015 17:11;[id82853210|Сергей], ты наркоман? Какие фашисты? Путин собирает съезд марсиан. Гугл об этом еще не знает. http://vk.com/photo-25106701_363773301;0;;;Л3,Ц4;4
6703;69706;192134;212553600;191969;25106701;01.05.2015 17:13;[id82853210|Сергей], когда у тебя начались проблемы с наркотиками? отвечай быстро.;1;;;Н3;4
6704;69707;192135;9511140;191969;25106701;01.05.2015 17:13;[id155672209|Рауф], я могу еще все писать с прописной буквы. И какая связь? Неужели я так вас отсутствием запятой напугала? Бегом к психиатру. А потом это так убого про учителя, то же самое, что   а еще в очках ;0;;;Н3;4
6705;69708;192137;212553600;191969;25106701;01.05.2015 17:14;[id82853210|Сергей], скоро мы возьмем тебя за задницу, нам нужны продукты, мы умираем с голоду, скоро гнида, скоро доберемся до твоих запасов. ??;0;;;М3;4
6706;69709;192139;9511140;191969;25106701;01.05.2015 17:16;[id82853210|Сергей], привет! На работу вышел? А что не на шашлыках?;1;;;Ц3;4
6707;69710;192140;212553600;191969;25106701;01.05.2015 17:16;[id82853210|Сергей], ты не принял сегодня лекарства, или принял их с алкоголем, пёс... От этого все твои проблемы.;1;;;Ц3;4
6708;69711;192143;212553600;191969;25106701;01.05.2015 17:18;[id82853210|Сергей], да-да, волна народная сметет Путена, я гдн-то слышал об этом... ?? http://vk.com/photo-25106701_363773337;0;;;Ц4;4
6709;69712;192145;212553600;191969;25106701;01.05.2015 17:18;[id82853210|Сергей], ты идиот? какие фашисты отморозок? ??;0;;;Л3;4
6710;69713;192147;212553600;191969;25106701;01.05.2015 17:19;[id82853210|Сергей], ))));0;;;А1;4
6711;69714;192149;9511140;191969;25106701;01.05.2015 17:19;[id82853210|Сергей], мы уже как-то переписывались. Увидела знакомое имя;0;;;Д3;4
6712;69715;192150;212553600;191969;25106701;01.05.2015 17:20;[id82853210|Сергей], Путен же заполонил страну чуркаме, ты же забыл же, он Чечне дань платит, ну, вспоминай, так это все ложь, да? Путен на самом деле теперь фошызд? Давай, мечи идеи.;1;;;Н4;4
6713;69716;192153;212553600;191969;25106701;01.05.2015 17:23;[id82853210|Сергей], вот это серьезный материал которому я должен довярять? ?? ?? Ну ты и одноклеточное<br><br>В Питере прошёл съезд европейских фашистов.<br><br>Ни единого сюжета об этом событии в телевизоре.<br><br>Арестовано несколько антифашистов. <br><br>Провокатор отпущен, и и присоединился к «уважаемому» собранию. <br><br>Тот, кто сдал сегодня Питер<br>Под нацистский съезд,<br>Тот о павших ноги вытер,<br>Что лежат окрест.<br>Нам, блокадникам, медали<br>Нынче раздают.<br>Мы в войну его не сдали,<br>А они сдают.<br><br>Александр ГОРОДНИЦКИЙ,<br>житель блокадного Ленинграда<br><br> <br><br>23 марта 2015 года;0;;;С3;4
6714;69717;192154;212553600;191969;25106701;01.05.2015 17:23;[id82853210|Сергей], не молчи, я тебя еще не отпускал. ??;0;;;Ч3;4
6715;69718;192156;212553600;191969;25106701;01.05.2015 17:24;[id82853210|Сергей], какие факты, кретин?  Одна либеральная бабка сказала  — это твои факты? Ты утырок? ??;1;;;Л3;4
6716;69719;192158;9511140;191969;25106701;01.05.2015 17:25;[id82853210|Сергей], не помню, но были оппонентами)));0;;;Ш3;4
6717;69720;192159;212553600;191969;25106701;01.05.2015 17:25;[id82853210|Сергей], ?? ты опять, кретин?;0;;;Г3;4
6718;69721;192161;212553600;191969;25106701;01.05.2015 17:27;[id82853210|Сергей], это похоже на стихи. Почему это набор слов не в рифму но в столбик? ??;1;;;Ч3;4
6719;69722;192165;212553600;191969;25106701;01.05.2015 17:30;[id82853210|Сергей], ты кретин же ?? ?? ??;0;;;Л3;4
6720;69723;192167;212553600;191969;25106701;01.05.2015 17:30;[id82853210|Сергей], мне теперь со скидкой заплатят за то что общался с умалишенным. ??;1;;;Н3;4
6721;69724;192169;212553600;191969;25106701;01.05.2015 17:31;[id82853210|Сергей], ?? ?? ?? скажи это еще раз и у Путина проступит украинская свастика на лбу и так мы примиримся с усраиной ?? ?? ?? ??;0;;;С3;4
6722;69725;192172;212553600;191969;25106701;01.05.2015 17:36;[id82853210|Сергей], смотри что у меня есть - доказательство того что Путин фашист, воюет против российской армии вна усраини в составе Азова ?? http://vk.com/photo-25106701_363772602;0;;;С3;4
6723;69726;192174;3024891;191969;25106701;01.05.2015 17:38;разочарование.... это когда 200 коментов.... думаешь вкуснятина ... а там один всего лишь троль... считаю это признак кризиса еврозоны )));2;;;Н4;4
6724;69727;192175;212553600;191969;25106701;01.05.2015 17:39;[id82853210|Сергей], стоп, я тебя еще не отпускал. ?? http://vk.com/photo-25106701_363772857;0;;;И3;4
6725;69728;192179;302559485;191969;25106701;01.05.2015 18:48;Интересно, почему Wall Street Journal беспокоится о российском борще, но закрывает глаза на своих жителей: http://vk.com/audio2000500658_363747026 http://vk.com/photo-25106701_363779886;0;;;Б2;3
6726;69729;192180;198229052;191969;25106701;01.05.2015 19:06;The Wall Street Journal днище!! Решили докапаться до борща через пенсионера???? Аргумента по лучше не придумали. Вот лоси??;0;;;Т2;4
6727;69730;192181;51430676;191969;25106701;01.05.2015 19:21;Ваши санкции провалились, успокойтесь уже шакалы;0;;;Л2;4
6728;69731;192182;51430676;191969;25106701;01.05.2015 19:23;[id12025189|Дмитрий], хохол лучше о своей стране переживай;0;;;Л3;4
6729;69732;192183;2608030;191969;25106701;01.05.2015 19:42;[id155672209|Рауф], ну не знаю как у вас в городе, но у нас не хуже! Мне до Польши 34км., а до Литвы 70км. и по этому бываю там часто.. Они также жалуются как и мы (маленькие зарплаты, большие налоги и т.д.);1;;;Ж3;4
6730;69733;192189;302217075;191969;25106701;01.05.2015 22:44;[id51430676|Геннадий], ну зачем так .ты у кацапов отнимаешь последнюю надежду http://vk.com/photo-25106701_363808979;0;;;Ц3;4
6731;69734;192191;302217075;191969;25106701;01.05.2015 22:49;ПУТЬ В НИКУДА<br><br>Скажу честно: За всю свою не очень длинную жизнь именно сейчас я смело могу утверждать, что Россия выбрала путь в никуда. Русский народ собственными же руками загоняет себя в пропасть и рабство. Пару лет назад я бы так не сказал, но сейчас говорю. Ведь то, что творится в стране и в головах людей - это глупо, мерзко, пагубно. Что стало причиной такой резкой деградации населения России? - События в Украине. Началось все с того, как одурманенное пропагандой российское население возненавидело революцию достоинства украинского народа, поверило в телевизионные мифы про американские деньги, бандеровцев и фашистов и прочие пропагандистские штампы. Телевизионная картинка заложила в России нужное путинскому курсу общественное мнение, а именно: ненависть к свободе, высокомерие, псевдопатриотизм, любовь к вождю и озлобленность в отношении тех, кому царь не нужен. Так получилось, что сообщества  Антимайдан  и дружины антимайдановских гопников в России стали появлятся уже во время украинской революции. Это нелепо: Майдана в России не было, а антимайдан уже начал зарождаться. Разве может быть что-то подобное в нормальной стране с трезвым населением? Вы только вдумайтесь, население России забило на массу внутренних проблем в своей стране и взяло за основу идею борьбы с революцией в Украине - другом государстве.<br><br>Дальше - хуже. Ненависть к свободе. Радость от аннексий чужих территорий. Визуальная ура-патриотическая картинка по телевизору, вопли  крымнаш , нелепые культы, поклонение государю. Культ Путина достиг небывалых доселе высот в России. Убогие граффити на стенах домов, нарисованные в честь  возвращения Крыма в родную гавань . Нелепые патриотические мемы и картинки. Какие-то  вежливые люди . Дебильные лозунги. Ненависть и озлобленность народа России в сторону Украины, Америки, Европы. Автомобили с надписями  Обама чмо  и  На Берлин . Глупцы и моральные уроды, которые с удовольствием каждый день смотрят сафари на украинцев по федеральным каналам и радуются. Деление на патриотов и предателей. Все эт;0;;;Ж4,И4;4
6732;69735;192193;302559485;191969;25106701;01.05.2015 22:50;[id302217075|Слава], цэ Зрада!;0;;;Ц3;4
6733;69736;192194;302559485;191969;25106701;01.05.2015 22:50;[id302217075|Слава], в России  ПОЖАРЫ , а на Украине перемогэээ!1!;1;;;С3;4
6734;69737;192197;51430676;191969;25106701;01.05.2015 23:29;[id302217075|Слава], как раз Европарламент и мечтает угробить население России, чтобы свергнуть ненавистного Путина , но Запад в который раз пролетает. Население только ещё больше сплочается вокруг Путина. Что бы Запад ни делал, все выходит ему же во вред. Феерические идиоты )));2;;;Щ4;4
6735;69738;192198;302217075;191969;25106701;01.05.2015 23:48;[id51430676|Геннадий], Да ты не просто феерический идиот .как можно сплачиваться вокруг вора и убийцы? Ты в своем уме??7;0;;;Т3;4
6736;69739;192199;51430676;191969;25106701;01.05.2015 23:56;[id302217075|Слава], Кто у нас главный убийца за последние годы? Обама идёт с отрывом, его 100000 убитых мирных жителей никому не переплюнуть. Югославия, Ирак,Афганистан,Сирия не дадут соврать.;2;;;Ф3,Т4;4
6737;69740;192201;16499396;191969;25106701;02.05.2015 0:27;[id302217075|Слава], а  ты клеветник;1;;;Т3;4
6738;69741;192202;302217075;191969;25106701;02.05.2015 0:45;[id51430676|Геннадий], школота .погугли когда была Югославия .и операция  Буря в пустыне   что в Ираке .Обама тогда еще в колледже учился .Еще один балбес малолетний;0;;;Н3;4
6739;69742;192261;279930254;191969;25106701;02.05.2015 12:43;Хочу напомнить, что это сумасшедший Путин ввёл запрет на ввоз продуктов;0;;;Т4;4
6740;69743;192288;51430676;191969;25106701;02.05.2015 13:43;[id302217075|Слава], вот и вылезла твоя сущность быдла. Какая разница кто президент. Кровь 100000 мирных жителей на руках США и это главный показать того, кто именно фашист в наше время;0;;;Л3,Т4;4
6741;69744;192290;51430676;191969;25106701;02.05.2015 13:47;[id279930254|????], хочу напомнить, что это был ответ на санкции Запада, которые были введены по лживому поводу;0;;;Ф3,Л4;4
6742;69745;192296;279930254;191969;25106701;02.05.2015 14:11;Повод - аннексия Крыма и поддержка сепаратистов на востоке Украины, это ложь разве ? И ответные санкции бьют в первую очередь по россиянам, но правительству как всегда плевать;0;;;Т4;4
6743;69746;192297;51430676;191969;25106701;02.05.2015 14:18;[id279930254|????], Никакой аннексии Крыма не было, крымчане САМИ выразили желание присоединиться к России и через год это подтвердили опросы, проведенные международными организациями. Ликбез: санкции были введены именно из-за наличия наших войск на Украине , а не помощи ополченцам. А наличие нашей армии не смогло доказать даже ЦРУ и разведка Евросоюза. То есть санкции основаны на лживых утверждениях;0;;;Ф3,Т4;4
6744;69747;192300;51430676;191969;25106701;02.05.2015 14:21;[id279930254|????], и разведка ЕС обвинила США во лжи:<br>Глава военной разведки Франции <br>Кристоф Гомар<br>выступая перед Национальной ассамблеей страны, заявил, что спецслужбы США снабжали НАТО и своих союзников ложными данными о наличии российских войск на Украине. А в действительности…<br><br>- Мы действительно установили, что русские не размещали ни командных пунктов, ни органов тыла, в том числе полевых госпиталей, которые позволили бы совершить военное вторжение, при этом подразделения второго эшелона ни разу не двигались с места, - заявил шеф разведывательной службы Франции;0;;;Щ4;4
6745;69748;192301;279930254;191969;25106701;02.05.2015 14:29;Я уже сказал, если крымчане так сильно хотели в Россию, это делается через ООН специальными процедурами, а произошедшее - агрессия чистая, это оккупация чужой территории силой оружия, аншлюз, не иначе. А наличие россиян на востоке Украины уже давно известно абсолютно каждому, элементарно пленные и сами заявляющие там об этом россияне.;0;;;Т4;4
6746;69749;192302;279930254;191969;25106701;02.05.2015 14:33;Да даже вот - http://vz.ru/news/2015/3/2/732118.html;0;;;;
6747;69750;192303;118728225;191969;25106701;02.05.2015 14:34;[id279930254|????], а с каких пор Крым чужая территория для России ?;0;;;А3;4
6748;69751;192305;279930254;191969;25106701;02.05.2015 14:35;С таких пор, что он принадлежит Украине;0;;;И4;4
6749;69752;192306;118728225;191969;25106701;02.05.2015 14:37;[id279930254|????], Крым принадлежит прежде всего тем людям которые там родились, выросли и проживают, а не Украине.;1;;;И4;4
6750;69753;192309;8022988;191969;25106701;02.05.2015 14:40;[id279930254|????], уже нет, процедура референдума было проведена местным правительством так как Крым - это АР, а то что ООН не признала результаты, так в этом нарушении виновата сама оон, так как право на самопределение является базовым.;0;;;Ф4,Т4;4
6751;69754;192310;51430676;191969;25106701;02.05.2015 14:41;[id279930254|????], что же они эти  доказательства  не показывают? Даже французская разведка обвиняет их во лжи или опять фотку из соцсети покажут ))))));0;;;Н4;4
6752;69755;192311;118728225;191969;25106701;02.05.2015 14:42;[id279930254|????], и почему люди с Киева должны указывать как жить людям в том же Севастополе, или в той же Керчи ? Территория принадлежит любому государству, ровно до тех пор, пока непосредственно сам народ там проживающий с этим согласен. Никто не в праве приходить и указывать людям что им делать и как жить. Если уж они решили воссоединиться с соседним государством, где их национальность, культура и язык являются основными, а не где они национальное меньшинство, это их право.;0;;;Ж4;4
6753;69756;192312;279930254;191969;25106701;02.05.2015 14:42;Справедливо, но по нормам международного права так не делают. Если вдруг вот, не знаю, Южная Корея введет войска на Сахалин и проведет референдум (а там много корейцев и много недовольных жизнью), разве эта территория станет считаться территорией Кореи? Нет, только тщательные процедуры под наблюдением ООН и независимых сторон могут его сделать территорией Кореи.;0;;;И4;4
6754;69757;192313;51430676;191969;25106701;02.05.2015 14:43;[id279930254|????], так действовали в соответствии с международными нормами, благодаря Косово, которое также получило независимость в нарушении мандата ООН;0;;;И4;4
6755;69758;192314;279930254;191969;25106701;02.05.2015 14:43;А кто это право проверял ? Там разве референдум провидила ООН? Там не было наблюдателей, да и если это воля народа, то зачем солдаты ?;0;;;Н4;4
6756;69759;192315;279930254;191969;25106701;02.05.2015 14:44;Один человек обвиняет, второй заявляет о доказательствах. Вы сами можете найти что угодно. Некоторые даже проводили опросы местных жителей и привозили паспорта РФ;0;;;Щ4;4
6757;69760;192316;51430676;191969;25106701;02.05.2015 14:45;[id279930254|????], пленные под угрозой пыток расскажут что угодно, а вот доказательств наличия армии РФ нет и даже разведка Франции обвинила США во лжи по этому поводу. Так что санкции основаны на лживых обвинениях;0;;;Ф4,Т4;4
6758;69761;192317;118728225;191969;25106701;02.05.2015 14:46;[id279930254|????], в международном праве прописано право народа на самоопределение. Про Южный Сахалин, где ты там увидел корейцев ? Да может они есть, 1-2 %, 5 % максимум, но не 70 % русских как в Крыму.;0;;;И4;4
6759;69762;192319;279930254;191969;25106701;02.05.2015 14:46; Консультативное заключение было оглашено 22 июля 2010 года на открытом заседании в Большом зале правосудия во Дворце Мира в Гааге. Это заключение не имеет обязательной силы. Суд единогласно решил, что он обладает юрисдикцией по делу, девятью голосами против пяти (судьи Томка, Корома, Кит, Скотников, Беннуна) решил выдать консультативное заключение, и десятью голосами против четырех (судьи Томка, Корома, Скотников, Беннуна) решил, что декларация независимости Косова не нарушает международного права. ;0;;;Ж4;4
6760;69763;192321;51430676;191969;25106701;02.05.2015 14:47;[id279930254|????], опросы? ))))) так почему даже разведка Франции заявила о том , что США лгут о наличии армии России на территории Украины;0;;;Ф4;4
6761;69764;192322;279930254;191969;25106701;02.05.2015 14:47;Мы никогда не узнаем, их ли это право, говорит об этом только российская сторона, заинтересованная.;0;;;И3;4
6762;69765;192323;118728225;191969;25106701;02.05.2015 14:47;[id279930254|????], а чем отличается тоже Косово от Абхазии, Приднестровья, Южной Осетии;0;;;А3;4
6763;69766;192325;118728225;191969;25106701;02.05.2015 14:48;[id279930254|????], налицо политика двойных стандартов, американцы верещат о международном праве только тогда когда им выгодно, в других же случаях о нем благополучно забывают.;0;;;Т4;4
6764;69767;192326;279930254;191969;25106701;02.05.2015 14:49;Не разведка Франции, а один человек, кстати.;0;;;Ч3;4
6765;69768;192328;279930254;191969;25106701;02.05.2015 14:49;Более чем достаточно кому? Это либо делается по всем требованиям международного сообщества, либо не имеет никакой силы.;0;;;Б3;4
6766;69769;192329;8022988;191969;25106701;02.05.2015 14:50;[id279930254|????], были аккредитованные оон международные наблюдатели, этого должно быть более чем достаточно.;0;;;Б3;4
