6767;69770;192330;279930254;191969;25106701;02.05.2015 14:50;Более чем достаточно кому? Это либо делается по всем требованиям международного сообщества, либо не имеет никакой силы.;0;;;Б3;4
6768;69771;192333;118728225;191969;25106701;02.05.2015 14:52;[id279930254|????], кто мешал Украине принять русский язык и культуру, как вторую государственную ? а теперь они ноют, типо пошла агрессия на них. Я же ничего удивительного тут не вижу, государство постепенно обретает этнически украинские границы, то есть те территории где большинство украинцев остаются, а русскоязычные земли, с непризнанной с точки зрения государства культурой бунтуют, вот и все.;0;;;И4;4
6769;69772;192334;118728225;191969;25106701;02.05.2015 14:54;[id279930254|????], присоединение Крыма, даже по воли народа, через международные процедуры как ты говоришь невыгодно прежде всего  хозяину мира  США, поэтому это утопия, никогда и ни за что они бы такого не допустили, поэтому говорить об этом даже глупо.;0;;;И4;4
6770;69773;192335;51430676;191969;25106701;02.05.2015 14:55;[id279930254|????], перечитай свою копипасту. Это заключение не имеет обязательной силы. Ты сам себя идиотом выставил. <br><br>Резолюция Совета Безопасности ООН 1244 была принята на 4011-м заседании Совет Безопасности ООН, подчёркивая суверенитет и территориальную целостность Союзной Республики Югославии и, вместе с тем, предоставление существенной автономии и реального самоуправления для Косова<br><br>Независимость Косово нарушило резолюцию 1244 ООН, где говорится только об автономии;0;;;Ж4;4
6771;69774;192336;8022988;191969;25106701;02.05.2015 14:55;[id279930254|????], международное сообщество не может  требовать , они уже один раз потребовали с Косово, так там в результате даже референдума не было - просто парламент принял решение...;0;;;Ж4;4
6772;69775;192337;51430676;191969;25106701;02.05.2015 14:57;[id279930254|????], этот один человек глава разведки Франции вообще-то;0;;;И4;4
6773;69776;192338;118728225;191969;25106701;02.05.2015 14:57;[id279930254|????], зачем солдаты ? а затем чтобы украинская армия не пришла  наводить порядок , как это произошло на Донбассе, лучшая иллюстрация того, что было бы, если бы не было наших войск.;0;;;У4;4
6774;69777;192706;44929181;191969;25106701;04.05.2015 10:06;[id51430676|Геннадий], кстати УК РФ запрещает наемничество, но могу поспорить, что ни один из этих наемников(а они получают бабки, хоть это и не основная причина по которой они приехали) не будет осужден. http://vk.com/video-36775802_171633809;0;;;У4;4
6775;69778;192708;51430676;191969;25106701;04.05.2015 10:12;[id44929181|Дамир], так это же добровольцы, а не наемники. Люди по зову сердца приехали мстить фашистам за Одесскую Хатынь;0;;;И4;4
6776;69779;192711;44929181;191969;25106701;04.05.2015 10:18;[id51430676|Геннадий], денежное вонаграждение, пусть и из негосударственных фондов, они получают, а по поводу фашизма... Ты знаешь, признаки фашизма есть и у нас и у Украинцев, но я хочу тебе сказать, что наше телевиденье нам врет ибо в Германии небыло фашизма. Там был режим который хуже, но так как социализм был для совка святым, то народу начали врать про  фашистскую Германию  лгут и до сих пор. Но фашизма там не было. Как его сейчас нет ни на\в Украине ни в России, но признаки обе страны имеют.;0;;;Ж4;4
6777;69780;192713;51430676;191969;25106701;04.05.2015 10:25;[id44929181|Дамир], зарплату им не платят, следовательно они добровольцы. На Украине фашизма намного больше, чем в России . В России не проводят факельные шествия в столице и не сжигают людей заживо http://vk.com/photo-25106701_364062039;1;;;П4;4
6778;69781;192727;44929181;191969;25106701;04.05.2015 11:11;[id51430676|Геннадий], http://echo.msk.ru/blog/statya/1462172-echo/ это по поводу добровольцев, там же и про зарплаты и их прикрытие в виде путевок добровольцев почитать можешь. По поводу Одессы, да кошмар, однако хронология событий там была такова, что пророссийские активисты напали на колонну майдановцев, втч с применением оружия, но получили отпор, не спорю, отпор был через чур жесткий, однако, среди майдановцев были и те, кто стреляли по выпрыгивающим людям и те, кто наоборот помогали им вылезти(кстати эти видео почему-то по первому не показывали) но преступление есть преступление, да, жестко, но это госпереворот. Фашизм... Я тебя прошу почитай что такое фашизм... То что на Украине, это воинственный национализм. Ну у нас скины и футбольные фанаты тоже не редко гостей из средней азии убивают, да и отношение к украинцам уже лет 20 было на уровне  салоеды, хохлы, горилка, мова угарная  но при этом  хто не скаче той москаль  и  путин hello ла-ла-ла  сразу вызывает у Россиян гнев. Дж. Оруэлл в помощь.;0;;;Ж4;4
6779;69782;192921;51430676;191969;25106701;04.05.2015 16:24;[id44929181|Дамир], ну и? Прочитал я статью. НИ ОДНОГО факта в статье нет, по поводу выдаче зарплат добровольцам. Следовательно они воюют не за деньги, а добровольно. Так что никакие они не наемники. По Одессе уже было показано хорошее видео, где было четко показано, часть украинских ультрас были с красными повязками, как раз они и стреляли по своим- ультрас с красными повязками провокаторы. Так что все это зверство и организовала именно власть Украины. Это подтвердил даже Порошенко.<br>Порошенко признался, что это  мы  остановили сепаратистов и сожгли их в Одесской Хатыне<br>http://youtu.be/AbT52rxdpPs;0;;;Т4;4
