10860;30014;243812;53899488;243413;25106701;11.09.2015 20:07;[id1630004|Михаил], F-35 однозначно в разы эффективнее против ПВО, чем любой существующий ударный самолет. <br>Причем тут стоимость самолета и с-400 ? Авиация действует в трех координатах. Наземные пво - статичны. <br>В брэо F-35 заложены маршруты, все данные поступающие со спутников, БПЛА, других самолетов - все в интегрированном виде подается пилоту.<br> 1.Баки сбрасываются . 2. Дозаправка . В перспективе радиус может быть увеличен, когда доведут новый адаптивный двигатель.<br> С чего вы решили, что 35 слаб в маневренном бою (надо понимать ближний бой на пушках в пределах визуальной видимости) я тоже не знаю. Я например видел ролик, где F-35b летел на очень высоких углах атаки задом наперед.;0;И4;4
10861;30015;243824;53899488;243413;25106701;11.09.2015 20:37;http://vk.com/video53899488_171670246;0;И4;4
10862;30016;243826;53899488;243413;25106701;11.09.2015 20:40;https://www.youtube.com/watch?v=uZbqkxjAK8E;0;И4;4
10863;30017;243829;53899488;243413;25106701;11.09.2015 20:43;Любопытные ссылки, опровержение мифов создателя 35 Локхид Мартин и попытка анализа на русском языке.);0;Х3;3
10864;30018;243845;1630004;243413;25106701;11.09.2015 21:14;[id53899488|Сергей], относительно маневренности молния проигрывает сушке и проигрывает сильно.Ищите и читайте,это тайна полишинеля).Насчёт баков.При конфликте молнию будут вести с авианосцев.При приближении к цели во время сброса баков у ПВО будет достаточно данных чтобы спрогнозировать куда движется самолёт,а малозаметность это не абсолютная незаметность.Дозаправщик про который вы упомянули вообще демаскирует молнию полностью.Дальность полёта,кол-во вооружения,маневренность все это принесено в жертву малозаметности.Но не стоит забывать про не самый большой радиус поражения ракет.У той же сушки он пока больше.Та же сушка может совершать резкие манёвры и сбросы-наборы скорости,что даёт неплохой шанс запутать ракету.Ну и чем больше электроники на самолёте,тем опаснее для него рэб,вот это как раз аксиома.;0;И4;4
10865;30019;243858;1271446;243413;25106701;11.09.2015 22:17;http://vk.com/video1271446_873359;0;И4;4
10866;30020;243869;53899488;243413;25106701;11.09.2015 22:32;[id1630004|Михаил], Что читать? То что вижу я - это , что в конфигурации чистого истребителя с половиной запаса топлива F -35 и Су-35 практически равны по тяговооруженности.<br> И еще раз повторяю - разрабатывается двигатель нового поколения, который может быть установлен и на 35. Радиус увеличится на треть.<br>Но самое главное - сверхманевренность и даже просто маневренность с появлением новых всеракурсных ракет ближнего боя , шлемом с круговым обзором делают резкие маневры ненужными. Это именно то новое, что отличает F-35 от предыдущих поколений. Информационное превосходство будет обеспечивать преимущество.;0;Ж4;4
10867;30021;243875;53899488;243413;25106701;11.09.2015 22:37;[id1630004|Михаил], Вы видео посмотрите по моей ссылке. Особенно устойчивый полет на 120 градусах угла атаки.;0;Р3;4
10868;30022;243886;53899488;243413;25106701;11.09.2015 22:43;[id1630004|Михаил], А без малозаметности нет шансов против перспективной ПВО. PAC-3 MEADS C-400 . Вы же сами об этом писали. <br>Что с того, что вы возьмете больше бомб, если не сможете выполнить боевую задачу? Кроме того 8т макс нагрузки это столько же , сколько и у су-30 или Супер Хорнета. ВСе оружие, например SDB - высокоточное. Одна бомба - одна цель.;0;И4;3
10869;30023;243897;53899488;243413;25106701;11.09.2015 22:48;[id1630004|Михаил], Сушка не сможет его обнаружить на приличной дальности. И маневренность ей будет нужна только , чтобы увертываться от AIM-120 . У семейства су30 эпр 15 м кв по сообщениям индусов. У су-35 поменьше на порядок или около того, но это несопоставимо больше , чем у 35.;0;И4;4
10870;30024;243963;1630004;243413;25106701;12.09.2015 6:19;[id53899488|Сергей], разница между сушкой и молнией в обнаружении небольшая),превосходство в дальности ракет за сушкой),для того что бы запустить ракеты по сушке молнии надо /войти в зону обнаружения российского истребителя.Так как' маневренность молнии ниже,превосходство за сушкой).Превосходство в малозаметности  вообще отпадает.Получается,что пятое поколение проигрывает 4++)).;0;И4;4
10871;30025;243980;53899488;243413;25106701;12.09.2015 7:58;[id1630004|Михаил], Да, боюсь, что разница в обнаружении такова, что 35 обстреляет су-30 с дистанции 100 км, а су-30 обнаружит его на дистанции 10 км. <br>Это не мои измышления, а данные обнаружения f-22 рафалем и f-15. При том, что это были f-15 с АФАР. По дальности ракет AIM-120D посмотрите. <br>А что касается дальнобойных ракет типа феникса - то они малоэффективны. <br>Для ПАК- Фа делают новые - сделают- посмотрим. Не забывайте, что на 35 может через 10 лет прописаться и лазерное оружие и новые версии ракет средней дальности. <br>Кроме того 35 будут действовать в единой сети со всеми системами оружия, включая sm-6 , бпла , информационное, системное превосходство на порядки.<br> Это то , что вы не понимаете, упорно цепляясь за параметры, которые были определяющими в 4 поколении, в то время, как прогресс, в первую очередь электронных систем, сенсоров и технологий малозаметности сдвигает акценты. <br>Маневренность сухого не факт, что будет выше , например в 2025 году, когда 35 станет основной машиной. Да и сейчас о маневренных характеристиках судить рано. Про Рэптор весь рунет писал, что это утюг, а оказалось, что самый маневренный самолет, так, что и с молнией может повтрится та же история. <br>Те видео, что я видел, не производят впечатления утюга. Кроме того, сушку и молнию надо сравнивать в одной конфигурации- если вы сравниваете 35 в конфигурации ударника, а сухого, как истребитель и с разным запасом топлива- то грош цена такому сравнению. <br>Что такое поколение 4++ вообще не ясно. ) Это просто маркетинг. Есть поколение 4+. Методологически это проэцирование свойств 5 поколения на конструкции 4.<br> А 4 поколение с тележками плюсов - только реклама без всякого смысла.;;В3;4
10872;30026;244118;53899488;243413;25106701;13.09.2015 9:55;Знаем. Против Германии воевала коалиция превосходившая ее по ресурсам многократно. На каждый немецкий танк приходилось по 5-7 танков союзников из которых половина американских. И так по всему спектру - удивительно разве, что как немцы столько продержались.;0;В3;4
10873;30027;244123;1271446;243413;25106701;13.09.2015 10:48;[id53899488|Сергей], ну так и Германия была далеко не одна ...;0;Ж4;4
10874;30028;244125;53899488;243413;25106701;13.09.2015 11:03;[id1271446|Владимир], Экономический потенциал союзников многократно превосходил страны оси. Реально после вступления в войну США, было понятно, что спасти Гитлера может только чудо. К 1943-1945 превосходство было уже абсолютно подавляющим во всем. Немцы пытались противопоставить количеству качество и тевтонский дух, но ,конечно, все уже было предрешено.;0;И4;4
10875;30029;244126;1271446;243413;25106701;13.09.2015 11:09;[id53899488|Сергей], тем не менее, 78% войск оси было разбито на советско-германском фронте. Можно иметь высокий экономический потенциал, но далеко не полностью вкладывать его в войну, как это делали США.;0;Ч4;4
10876;30030;244127;53899488;243413;25106701;13.09.2015 11:18;[id1271446|Владимир], Да бросте ) Все гораздо сложнее, чем вы думаете. <br>Вермахт разбили на восточном фронте, люфтваффе на западном, кригсмарине разбили тоже англосаксы, а заодно их союзников японцев, которые , если бы не тратили ресурсы - открыли бы против ссср второй фронт, стратегические бомбардировки англоамериканцев подорвали немецкую промышленность - соответственно не давали немцам производить оружия столько, чтобы хоть как то держаться. <br>американцы не полностью вкладывающиеся, как вы говорите в войну, произвели вдвое больше самолетов, чем ссср, больше танков и сау, снабжали всю коалицию практически всем - от топлива, порохов до самолетов и бронетранспортеров и локомотивов, да еще при этом пекли авианосцы , как пирожки и построили самый мощный флот в мире. Так , что смотрите на вещи системно.;0;И4 Р3;4
10877;30031;244147;1271446;243413;25106701;13.09.2015 13:00;[id53899488|Сергей], вы ещё скажите что Германия вообще жертва...напали на неё на бедную.;0;Ш3;4
10878;30032;244148;1271446;243413;25106701;13.09.2015 13:03;[id53899488|Сергей], и по поводу танков не совсем так.... возьмём основные средние : шерманов в годы второй мировой произвели под 50 тыс штук, а Т-34 было выпущено примерно 60 тыс )) - так что не больше.;0;Б3;4
10879;30033;244153;53899488;243413;25106701;13.09.2015 13:51;[id1271446|Владимир], СССР и США произвели примерно по 100 тыс танков и сау с 1941-1945, сша произвели несколько больше бронетехники, чем СССР.<br> И это только танки и Сау. Бронетранспортеры СССР вообще не выпускал - все были американского производства, аналогично значительная часть автопарка.<br> Германия с 1939 по 1945 - всего около 50 тыс. <br>Добавим еще Великобританию, Францию на начальном этапе - соотношение посчитайте сами. По тягачам, локомотивам, топливу, патронам, артиллерии соотношение еще более грустное для немцев. <br>Самолетов США построили в два раза больше СССР, причем это были куда более продвинутые машины, в том числе  не имеющие аналогов  Б-17 или под конец Б-29.;0;И4;4
10880;30034;244154;53899488;243413;25106701;13.09.2015 13:55;[id1271446|Владимир], Причем тут жертва или нет? Мой тезис в том, что антигитлеровская коалиция многократно превосходила Германию и ее союзников, в ресурсах - и в технике, и в людях, и в экономическом потенциале - во всем. И львиную долю этого превосходства обеспечили США, чего ни Гитлер, ни Сталин не ожидали, произведя колоссальное количество буквально всего - от еды до авианосцев и стратегических бомбардировщиков. Это и предопределило поражение немцев в войне.;0;П3;4
10881;30035;244199;1271446;243413;25106701;13.09.2015 18:01;[id53899488|Сергей], Франция вообще на вермахт работала по существу ))));0;Ш4;4
10882;30036;244200;1271446;243413;25106701;13.09.2015 18:02;[id53899488|Сергей], тем не менее основной самолёт, с которым воевало люфтваффе был не Б-17 и не Б-29, а простой трудяга Ил-2;0;Б3;4
10883;30037;244201;1271446;243413;25106701;13.09.2015 18:03;[id53899488|Сергей], я понял, ваш тезис в том что немцы были вообще умственно отсталыми, раз затеяли эту авантюру.;0;И3;4
10884;30038;244203;53899488;243413;25106701;13.09.2015 18:54;[id1271446|Владимир], Германия и ее сателиты произвели с 1939 по 1945г около 50 тыс танков и сау. СССР, Великобритания и США - около 250 тысяч только с 1941 по 1945. <br>Естественно к этому количеству прибавить французские танки выпущенные в период 1939 - 1940г. Вклад французской промышленности после разгрома Франции вермахтом - был ничтожен.;0;И4;4
10885;30039;244204;53899488;243413;25106701;13.09.2015 18:56;По существу война шла с 1 сенября 1939г вообще то. И в 1939-1940 французская армия была одной из самых больших в Европе и мире.;0;И4;4
10886;30040;244207;53899488;243413;25106701;13.09.2015 18:59;[id1271446|Владимир], На восточном фронте вообще никогда не дислоцировалось более 20% люфтваффе. Более того, восточный фронт был для люфтваффе второстепенным. Основные усилия были для них именно с англо-американской авиацией.;0;И4;4
10887;30041;244208;1271446;243413;25106701;13.09.2015 18:59;[id53899488|Сергей], ну да, на восточном фронте они вообще воевали между делом .... я понял.;0;Ш3;4
10888;30042;244209;53899488;243413;25106701;13.09.2015 19:02;[id1271446|Владимир], При чем здесь не самый удачный штурмовик Ил-2, которые несли огромные потери - легкая добыча для немецких истребителей, мне неясно вообще...;0;Б3;4
10889;30043;244210;53899488;243413;25106701;13.09.2015 19:05;[id1271446|Владимир], Вы откройте профильную литературу и почитайте, тогда поймете. Если вы думаете, что мне интересно вам врать и нести отсебятину, то ошибаетесь. Я же не виноват, что у вас в голове стереотипы .;0;Р3;4
10890;30044;244211;53899488;243413;25106701;13.09.2015 19:09; понял, ваш тезис в том что немцы были вообще умственно отсталыми, раз затеяли эту авантюру <br> А их никто не спрашивал. Решения принимались имевшим всю полноту власти авантюристом, который был уверен в своем беспрерывном везении и собственном гении. Кроме того никто в 1941 не мог представить возможности американской экономики - вот и Гитлер ее недооценивал.;0;И4;4
10891;30045;244212;53899488;243413;25106701;13.09.2015 19:12;[id1271446|Владимир], Для вермахта восточный фронт был мясорубкой, но основные усилия именно люфтваффе были на западном фронте.;0;И4;4
10892;30046;244216;1271446;243413;25106701;13.09.2015 19:50;[id53899488|Сергей], А теперь тупо взглянем на потери ВВС разных стран : <br><br>Британия - 15,200 самолётов , 57 000 убитых<br>Америка - 42 000 самолётов , 40 000 убитых<br>СССР - 48 000 самолётов, 34 500 убитых <br><br>Германия - 86 000 самолётов , 58 000 убитых <br>Япония - 49 500 самолётов, 61 000 убитых <br><br>так что стереотипами я как раз считаю преувеличивание  тевтонского духа  , известного ещё со времён Чудского озера. <br><br>дело не в стереотипах , а в том что я не пытаюсь оправдывать действия рейха, которые никак не могут быть возложены на одного единственного человека и в том что я не соглашусь с утверждением о том, что на нашу страну они шли со шнапсом и с блинами. <br>Ну и да, наибольшее количество потерь именно вермахта ( включая бронетехнику ) от авиации также приходится на восточный фронт, что делает утверждения о неудачности модели Ил-2 как-минимум спорными. Так же и количества бомбо-тонн сброшенные союзниками следует помножить на плохое прицеливание с огромной высоты ... большая часть уходила   в молоко   , в то время как штурмовая авиация РККА работала более точно , те же фанерные У-2 со своими 300 кг наносили вполне себе значимый ущерб . <br><br>Немецкая авиация за 27 дней боёв с 22 июня по 19 июля 1941 года потеряла 1284 самолёта всех типов(http://militera.lib.ru/h/ww2_german/31.html), что больше чем за два месяца боёв в «Битве за Англию». Причём количество советских лётчиков, начавших войну 22 июня 1941 и встретивших День Победы в итоге значительно превзошло количество таких же лётчиков в люфтваффе.;0;Ж4;4
10893;30047;244232;53899488;243413;25106701;13.09.2015 23:10;[id1271446|Владимир], Сша построили больше 200 000 самолетов, включая тяжелые стратегические -из которых один стоит , как несколько истребителей. Это не считая англичан. <br>СССР - около 100 000. Причем тут общие потери? Вы вклад англо-американской авиации сравните в эти потери, и советской, а не сравнивайте у кого потери выше. А заодно вклад в разрушение немецких заводов, которые танки делали и пушки, немецкой инфраструктуры и тд.;0;И4;4
10894;30048;244233;53899488;243413;25106701;13.09.2015 23:15;[id1271446|Владимир], По поводу чудского озера.. А вы в курсе, что с немецкой стороны там принимали участие около 30 рыцарей и две сотни кнехтов? Против в несколько раз превосходящих сил новгородцев. Которые кстати вторглись на земли Дерптского епископата и тот запросил помощи ордена, основные силы которого во главе с магистром были в походе на литовских язычников и потому не мог выставить сколько ни будь серьезные силы?;0;Ж4;4
10895;30049;244234;53899488;243413;25106701;13.09.2015 23:21;Неудачность Ил-2 в том, что они несли огромные потери . В отличие от американских многоцелевых самолетов или соответствующих модификаций FW-190. Потому , что броня с одной строны защищала, а с другой - она же делала легкой добычей истребителей. Если сравнить эффективность по отношению к потерям, то ни немцы , ни американцы таких потерь не имели при решении тех же задач.;0;И4;4
10896;30050;244235;53899488;243413;25106701;13.09.2015 23:24;И по поводу действий рейха. Я вообще не давал ни действиям, рейха, ни союзникам никаких этических оценок.;0;К1;4
