10825;29979;243672;1630004;243413;25106701;11.09.2015 16:17;[id53899488|Сергей], материалы дешевле не станут,а современное ПВО скорее всего ведут преимущество пятого поколения к нулю,вообще тенденция идёт именно к закрытому небу,авиация со временем станет вообще невыгодной к применению.Слишком дорого будут стоить потери.;0;И4;4
10826;29980;243677;53899488;243413;25106701;11.09.2015 16:23;Алан, Изначально именно, как конкурент для будущего F-15A. Точнее не столько конкурент, сколько альтернатива. Как и будущий F-16. И тот, и тот, возникли под впечатлением от Вьетнама. Но на том этапе тяжелый истебитель в роли завоевания господства в воздухе выигрывал у легкого при прочих равных поэтому F-15 стал безальтернативен в этой роли. но оказался слишком дорог и избыточен - поэтому его дополнили легким F-16 . А флот выбрал будущий F-18 по причине большей надежности двухдвигательного самолета. Вот и все. Не верите - проверте.);0;И4;4
10827;29981;243684;1630004;243413;25106701;11.09.2015 16:30;[id53899488|Сергей], ну я не Алан,)а разница между хорнетом и пятнадцатым именно в маневренности.Хорнет вообще чем то похож на 29 миг.Пятнадцатый и в модификации С и в модификации D слишком тяжелы.У них выигрывали даже су-27 в модификации УБ.А Хорнет более серьёзный противник.;0;И4;4
10828;29982;243690;53899488;243413;25106701;11.09.2015 16:34;[id1630004|Михаил], Ну так , а альтернатива какая ? )) Тенденция ведет к полностью автономной непилотируемой и опционально пилотируемой авиации. А на данном этапе F-35 естественно и дешевле ,и эффективнее, чем модернизация самолетов, исчерпавших свой ресурс или закупка их новых модификаций, которые стоить будут столько же, а против той же ПВО менее эффективны в разы.;0;П3;4
10829;29983;243692;53899488;243413;25106701;11.09.2015 16:36;[id1630004|Михаил], Маневренность разная. F-15 имеет высокую тяговооруженность и малую нагрузку на крыло, F-18 выходит на большие углы атаки.;0;И4;4
10830;29984;243694;53899488;243413;25106701;11.09.2015 16:40;[id1630004|Михаил], Это при том, что в случае морпехов все равно пришлось бы делать новый самолет на замену харриеру, так и стоит ли овчинка выделки?;0;Ж4;4
10831;29985;243699;1630004;243413;25106701;11.09.2015 16:44;Сергей, тенденция в свете развития рэб в перспективе даже использование бла сведет к минимуму.А  низкая стоимость пятых всяко больше чем у четвёрок.А преимущество преодоления барьера четвёрок при оказании им информационной поддержки их ПВО крайне маловероятно.;0;И4;4
10832;29986;243705;53899488;243413;25106701;11.09.2015 16:51;[id1630004|Михаил], Мы не знаем какими будут эти самые БПЛА, верно? Какими возможностями будут обладать. Но ясно, что другого пути нет. Если представить себя на месте ввс США, а не стороннего наблюдателя - то ясно, что F-35 безальтернативен. По крайней мере в ВВС и КМП. Да и во флоте тоже нужен малозаметный самолет, а пока доведут до ума UCLASS пройдет много времени. К тому же , чем больше 35 закупят- тем ниже стоимость серии.;0;П3;4
10833;29987;243707;1630004;243413;25106701;11.09.2015 16:55;Кстати одно время в тренде была изменяемая стреловидность крыла,например как на миге-23 или f-14 tomcat.В итоге от неё отказались.С малозаметностью та же история.Это тренд ,который эксплуатируют Локхид,Боинг,Грумман при помощи лобби в конгрессе.Вот и все.Само по себе это непрактично,хоть и очень красиво смотрится на бумаге.Если бы так было на самом деле и рапторы и двойки широко использовались бы.Но этого нет.Значит есть сомнения.Но американский впк не может эти сомнения озвучить.Вот и гуляет по просторам их интернетов мнение о том что рапторы всех порвут,примерно то же самое что и мнение украинцев об оплоте).;0;И4;4
10834;29988;243709;53899488;243413;25106701;11.09.2015 16:56;[id1630004|Михаил], Это сейчас 35 дороже. По понятным причинам. Преодоление технических трудностей, детских болезней, эффект неопределенности будущего программы, самые первые серии без полного коплекта оборудования. Выйдут на конвеер, будут клепать сотнями - цена упадет.;0;П3;4
10835;29989;243713;1630004;243413;25106701;11.09.2015 17:01;[id53899488|Сергей], мы просто знаем,что в данный момент дешевле современная наземная ПВО,чем воздушная составляющая.Самолёт всяко дороже.И я не вижу чем он незаменим.Тигр тоже был лучше и Шермана и т-34,но сколько было выпущено тигров и сколько их противников.Лучшее враг хорошего;0;П3;4
10836;29990;243715;53899488;243413;25106701;11.09.2015 17:02;[id1630004|Михаил], Это все же разные вещи.) Пока альтернативы малой заметности нет. Точнее это только гиперзвук. Но понятно, что это дорогое удовольствие и скорее это будут  космические серебряные пули  , чем твактические самолеты. Ракеты да, а вот массовая рабочая лошадь ввс - нет.;0;Б3;4
10837;29991;243716;1630004;243413;25106701;11.09.2015 17:06;[id53899488|Сергей], может быть и другая возможность,например проблемы с двигателем томката решали лет десять.Так вот возможно пока регат проблемы этот самолёт просто устареет .Примеров масса.Что с кораблями,что с самолетами;0;И4;4
10838;29992;243717;53899488;243413;25106701;11.09.2015 17:06;[id1630004|Михаил], F-22 негде и незачем было использовать. То, что у него резко снижена заметность - это очевидно, то, что другие страны, в том числе Китай, тоже пошли по этому пути тоже очевидно. Если бы малая эпр не давала преимуществ - конструкторы всего мира, не только американские не старались бы ее минимизировать. Возможно в будущем появится что то новое.;0;И4;4
10839;29993;243720;53899488;243413;25106701;11.09.2015 17:09;[id1630004|Михаил], Что значит дешевле? ПВО должно выполнить свою задачу- защитить прикрываемые обьекты. Инициатива будет у авиации. Если ваша сторона проиграла господство в воздухе - никакие наземные комплексы ее уже не спасут.;0;П3,М4;4
10840;29994;243723;1630004;243413;25106701;11.09.2015 17:11;Сергей, может быть и другая возможность,например проблемы с двигателем томката решали лет десять.Так вот возможно пока решают проблемы этот самолёт просто устареет .Примеров масса.Что с кораблями,что с самолетами;0;И4;4
10841;29995;243724;53899488;243413;25106701;11.09.2015 17:11;[id1630004|Михаил], Ну правильно. Только F-35 и есть Шерман или Т-34. Как раз он и будет массовым - 3000 штук - это как раз тот размах.;0;В3;4
10842;29996;243726;53899488;243413;25106701;11.09.2015 17:16;[id1630004|Михаил], Будут 35 доводить , у них выхода нет. В ВВС и у морпехов самолеты требуют срочной замены. По двигателям они делают ADVENT да и родной вроде доведен. По крайней мере это не ПАК -Фа с его двигателями 2 этапа . Кроме того было 2 альтернативных двигателя. Так что замена найдется.;0;И4;4
10843;29997;243728;53899488;243413;25106701;11.09.2015 17:19;35 незаменим тем, что делать новый самолет на замену харриеру, закупать F-16V и Silent Hornet будет худшим решением, чем F-35;0;И4;4
10844;29998;243729;1630004;243413;25106701;11.09.2015 17:22;[id53899488|Сергей], как вы собираетесь подавить авиацию,не подавив ПВО?Авиация и ПВО ряда стран действуют в комплексе.;0;Ж4;4
10845;29999;243731;1630004;243413;25106701;11.09.2015 17:24;[id53899488|Сергей], принести в жертву самолёты технология которых отработана,недостатки устранены,которые стоят дешевле и ненамного уступают тридцать пятому?Сомнительно.Не настолько он революционен,чтобы ради него отказываться от четвёрок.;0;П3;4
10846;30000;243732;53899488;243413;25106701;11.09.2015 17:25;[id1630004|Михаил], ПВО состоит как из наземной компоненты, так и истребителей. Наземные комплексы не имеют инициативы. Они стационарно прикрывают свои обьекты. Если господство в воздухе вы проиграли - они вас уже не спасут, как это произошло, например в Югославии.;0;П3;4
10847;30001;243736;1630004;243413;25106701;11.09.2015 17:33;[id53899488|Сергей], вы приводит в пример осколок страны,ослабленную этническими конфликтами,с порушенной структурой ПВО.На вооружении которой была устаревшая техника.А если и была современная то она была в недостаточном количестве.Давайте не будем забывать и про абсолютное численное превосходство в авиации и судах.Это не пример.;0;Ч3;2
10848;30002;243737;53899488;243413;25106701;11.09.2015 17:34;[id1630004|Михаил], Была статья как раз на эту тему еще за 2005 г или около того к сожалению сходу не вспомню источник. Там были расчеты ввс сша как раз на эту тему. Что делать со стареющим парком. Там были все выкладки вплоть до количества транспортных самолетов на развертывание, стоимость жизненного цикла, ремонт и прочее. Выхода было три. <br>1. Продолжать содержать стареющий парк стоимость чего растет<br> 2. Закупать новые модификации существующих самолетов <br>3. Новая машина с нуля.<br> Так или иначе пошли по всем путям- но подсчитано, что выйти из спирали возрастающих расходов на содержание стареющего парка можно было только с новым самолетом, причем многоцелевым и унифицированным - то есть F-35. Читал давно, 10 лет назад. Вспоминать источник лень, чесно говоря. Но суть такая.;0;И4,П3;4
10849;30003;243738;53899488;243413;25106701;11.09.2015 17:39;[id1630004|Михаил], Если бы там были С-300, картина бы не изменилась. То есть потери НАТО были бы возможно выше, но результат войны это бы не изменило. Без авиационной составляющей наземное ПВО не сможет предотвратить поражение.;0;П3;4
10850;30004;243742;1630004;243413;25106701;11.09.2015 17:45;Сергей, все дело в количестве с-300  на квадратный километр)),математика простая.Была бы численность миг-29 выше и стояли бы скажем с-300 в достаточном количестве,операция даже бы не началась.Поэтому Многоцелевые самолёты хороши против условного Ирака или Турции,но не против России и в обозримом будущем Китая.Ваша статья писалась,когда противостояния с Россией особо не было,а на повестке стояли всякие моджахеды и пираты.Сейчас он абсолютно не соответствует тем задачам,которые стоят перед ВВС США.;0;И4;4
10851;30005;243747;53899488;243413;25106701;11.09.2015 17:54;[id1630004|Михаил], Я вам толкую простые и логичные вещи, а вы все время выводите меня на патриотическую дорожку. Авиация априори имеет инициативу. Именно самолет решает кого атаковать, где и как. Неважно чья американская или китайская или российская или украинская. Просто по определению. Если господство в воздухе вы проиграли - наземная компонента вас не спасет.;0;П3;4
10852;30006;243752;53899488;243413;25106701;11.09.2015 18:02;[id1630004|Михаил], Многоцелевые самолеты хороши тем, что позволяют решать много задач. В результате можно обойтись меньшим количеством машин. F-35 может выполнять ударные задачи без прикрытия специализированных истребителей. Может постоять за себя в воздушном бою. Легко переоборудуется под новые задачи, что дает гибкость применения. Вообще все тактические боевые самолеты начиная с 90-х годов все больше становились многоцелевыми. Это и Супер Хорнет, и Рафаль, и Су-30 - все. F-35 просто логичное продолжение этого ряда. Только с резко повышенной живучестью за счет интегрированного брэо, малозаметности.;0;И4;4
10853;30007;243764;1630004;243413;25106701;11.09.2015 18:18;[id53899488|Сергей], где патриотическая дорожка?Упоминание России вызывает аллергию?Но Россия упоминается в контексте самого вероятного противника.А что касается априори)),да нет и никогда не было никакого априори.Всадники персов считали себя лучшими пока не встретили македонских и греческих гоплитов,рыцари считали себя солью армии пока не познакомились с английскими лучниками и позже с огнестрельным оружием,японские адмиралы до конца цеплялись за линкоры вместо авианосцев.Примеров масса.А вы мне про какие то константы говорите.;1;Ф3,Щ3;3
10854;30008;243785;1630004;243413;25106701;11.09.2015 19:07;[id53899488|Сергей], гибкость применения в определённых условиях.США уверенно двигаются в сторону фантома.В первый раз это ни к чему хорошему не привело.И в данный момент их малозаметность это больше дань моде,чем необходимость.А вышеприведённые вами самолёты как на подбор ,все превосходят f-35 в маневренности.;0;И4;4
10855;30009;243786;53899488;243413;25106701;11.09.2015 19:09;[id1630004|Михаил], У меня вызывает  аллергию  только отсутствие объективности и нелогичность.) Наземный комплекс ПВО - всегда статичен. Он не даст вам инициативы. Да, может увеличить противнику издержки, цену победы, но инициативу не даст. Если господство в воздухе перешло к вашему противнику - он будет владеть инициативой. Он будет вас атаковать где хочет и когда хочет и так, как хочет и засыпет ваше пво хармами , гарпунами и тому подобным - инициатива будет у него. Поэтому авиация и космическая компонента так важны.;0;Ж4;4
10856;30010;243787;53899488;243413;25106701;11.09.2015 19:12;[id1630004|Михаил], А Франция, Россия, Великобритания тоже двигаются в сторону фантома , начиная с 1990г ? Поскольку тренд к универсальности прослеживается с тех времен. С появления высокоточных средств поражения, которые изменили сам способ применения авиации и сделали ее главной силой на поле боя.;0;Ж4;4
10857;30011;243788;53899488;243413;25106701;11.09.2015 19:19;[id1630004|Михаил], 1. Дальность обнаружения обратнопропорциональна квадрату эпр. То есть при равных БРЛС, ракетах и всем прочем у кого меньше ЭПР - тот первым обнаружит противника и первым его обстреляет за пределами видимости. Дальше либо вступит в ближний бой, либо уклонится от него. <br>2. Пока рано судить о маневренности F-35. Возможно он окажется маневреннее и F-16 , и F-18. А от F-35B вообще в плане маневренности стоит ждать сюрпризов. Так, что я бы не был так категоричен. Тем более, что самолет еще будет модернизироваться и не раз.;0;И4;4
10858;30012;243790;53899488;243413;25106701;11.09.2015 19:29;Кроме того, имея шлем с возможностью смотреть сквозь самолет интегрированную информацию для пилота, AIM-9X , можно более чем компенсировать недостаток маневренности в ближнем бою, тем более , что по идее самолет будет иметь дело с более заметными противниками, а значит сможет от такого боя и уклониться и все решить за пределами прямой видимости.;0;И4;4
10859;30013;243806;1630004;243413;25106701;11.09.2015 19:53;[id53899488|Сергей], стоимость самолёта и например с-400,примерно одинаковая,но так как чертежи до сих иногда меняются,то и стоимость может возрасти.Радиус действия молнии ограничен,флот образно говоря засыплют гранитом).Для того чтобы не подставлять авианосцы он полетит с баками(прощай малозаметность),при попадании в зону действия ПВО уже не стоит говорить об инициативе,он становится жертвой.Причём ему ещё надо будет обнаружить комплекс ПВО.Авиация главная на поле боя только против стран ,которые не могут дать сдачи в воздухе(свежий пример-Донбасс).По поводу маневренности,на данный момент в маневренном бою молния слаба-это факт.И когда это компоненту доведут до ума никто не знает.Ну а про отказ встроенных систем вооружения во время исполнения сложных фигур не слышал только ленивый.Поэтому я не стал бы столь упорно защищать этот прототип,следующий самолёт может стать удачнее.Но это уже будет не молния.Тоже самое касается армат,пакфа, и прочего и прочего.Это концепция.А говорить что молния всех порвет преждевременно,малозаметность ещё себя нигде не показала.;0;И4;4
