;Unnamed: 0;Id of comment.;Id of author of comment.;Id of post;Author of post;date;text;likes;Unnamed: 7;
10785;29939;243415;1271446;243413;25106701;11.09.2015 11:24;от пилота тоже много зависит ... от тактики ..., от наземки, от численности ...;3;И4;1
10786;29940;243423;98040645;243413;25106701;11.09.2015 11:41;Немцы с  Тиграми  проиграли....;3;И4;3
10787;29941;243424;235146531;243413;25106701;11.09.2015 11:41;В зависимости от боевого опыты пилотов...;0;И4;2
10788;29942;243429;53899488;243413;25106701;11.09.2015 12:06;[id252652514|Алан], ))) Это твой пост попытка соединить все гуляющие по рунету стереотипы.) Лучше почитай что нибудь серьезное о программе JSF , желательно не только на русском языке.;4;П3,Р3;4
10789;29943;243474;1630004;243413;25106701;11.09.2015 12:50;[id53899488|Сергей], какие стереотипы?То что f-35 дорог это факт,то что многие страны которым их навязывали не очень стремятся их получить тоже факт.То что сама разработка неудачна уже признано на Западе.То что самолёты f-35 по сравнению с самолётами четвёртого поколения гораздо менее надёжны и более привередливы в обслуживании тоже факт.По поводу f-117 ,действительно у него срок службы получился коротким.И не раз было написано про неудачную аэродинамическую модель этого ударного самолёта.Про эффективность f-117 вообще трудно судить,так как он ни разу не преодолевал современную систему ПВО.;2;И4;3
10790;29944;243480;1630004;243413;25106701;11.09.2015 12:52;[id70101599|Елена], вы утверждаете или спрашиваете?;0;А3;2
10791;29945;243501;53899488;243413;25106701;11.09.2015 13:24;[id1630004|Михаил], Какой еще факт? ))) Программа рассчитана на несколько десятилетий с полным жизненным циклом, с выпуском нескольких тысяч машин. Она только начала реализовываться. Когда выйдут на полномасштабное производство - цена снизится. Кто там на западе что признал? )) Я вообще не знаю ни одного американского самолета , который при своем появлении не был раскритикован вдоль и поперек, причем своими же - и уровень этой критики часто непрофессиональный и неконструктивный. Например C-17 или F-18. Ну и что в результате? И тот , и другой успешные проекты.;0;И3;2
10792;29946;243521;53899488;243413;25106701;11.09.2015 13:49;[id1630004|Михаил], Альтернативой JSF было бы создание как минимум трех разных узкоспециализированных машин, что уже для конца 90-х было анахронизмом. Стоимость разработки, эксплуатации такого разношерстного парка была бы такой, что ввс сша не смогли бы ни поддерживать нужную численность, ни решать эффективно стоящие перед ними задачи. Многоцелевые самолеты позволяют быстро переориентироваться на новые задачи. В условиях необходимости замены тысяч F-16 F-18 и прочих - единственным выходом была суперпрограмма и создание многоцелевых унифицированных машин - другого выхода не было. Это массовая рабочая лошадь, а не специализированная замена F-15 в роли завоевателя господства в воздухе в количестве пары сотен тяжелых двухдвигательных машин или  серебряная пуля  F-117 в количестве полусотни.;0;И4;3
10793;29947;243524;53899488;243413;25106701;11.09.2015 13:50;[id252652514|Алан], Я в украинских мемах не разбираюсь и мне до них нет дела. Меня интересует истина, а не идеология.;0;Г1;4
10794;29948;243529;53899488;243413;25106701;11.09.2015 13:57;[id252652514|Алан], Потому, что у фантома не было AIM-9X и AIM-120D, системы датчиков и шлема F-35, радикально сниженной ЭПР.;0;И4;3
10795;29949;243534;53899488;243413;25106701;11.09.2015 14:01;[id252652514|Алан], Разговор был о F-35, который вы совершенно незаслуженно опустили ниже плинтуса.) Спор на тему украинцев, русских, американцев или евреев - это совершенно другая тема. Но если вам интересно- то я вообще сторонник глобального единого человечества в чем вижу единственный выход для всех.;0;Ф3,И1;4
10796;29950;243538;53899488;243413;25106701;11.09.2015 14:03;[id252652514|Алан], Естественно, архитрудно. Кто же спорит? Даже для самой продвинутой в этом плане фирмы, такой , как Локхид Мартин. Но выхода то не было. Все посчитано еще в 90-е годы.;0;И4;4
10797;29951;243582;53899488;243413;25106701;11.09.2015 14:44;[id252652514|Алан], Западная пресса пишет много глупостей. Будем их повторять, потому, что они нам нравятся ибо совпадают с нашими хотелками или думать беспристрастно и самостоятельно ?;0;Ч3;4
10798;29952;243586;49742100;243413;25106701;11.09.2015 14:50;[id1630004|Михаил], от большого обилия электроники надежность всегда страдает. Просто самолет не доведен до нормального качества. Единственное, что слышал про него, то что не все истребители поднимаются в воздух, якобы большая доля аварийных ситуаций или что то типа того.;0;И4;4
10799;29953;243590;53899488;243413;25106701;11.09.2015 14:53;[id252652514|Алан], Нашлемка была еще на позднем фантоме.) При подавляющем информационном превосходстве (что обеспечит брео F-35) и резко сниженной эпр, у машин предыдущих поколений не будет шансов навязать ближний бой. И сам ближний бой F-35 будет серьезным противником для кого угодно имея AIM-9X , сенсоры совершенно другие возможности , которые дает новый шлем в сочетании с современными ракетами. А в перспективе на эти самолеты пропишут и лазеры воздушного базирования. Да и собственно маневренные характеристики у него на уровне. Угол атаки - 60 градусов. А вертикалка, так и вообще уникальна - вспоминаем возможности харриера. Так , что все не так просто -  утюг, неудачный , время все расставит по своим местам. Я вот , например, думаю, что это будет успешный и главное безальтернативный на том этапе проект. Вот БПЛА - вот там уже можно строить три разных  специализированных - там другая специфика.;0;И4;3
10800;29954;243593;53899488;243413;25106701;11.09.2015 14:56;[id252652514|Алан], Моя логика проста. Есть серьезные журналы, специализированные, есть серьезные книги и монографии, а есть писания дилетантов и информационный мусор, неважно какого происхождения - западного, восточного, северного или южного.;0;П3;4
10801;29955;243597;1630004;243413;25106701;11.09.2015 15:03;[id53899488|Сергей], американцы уже на полном серьезе готовятся сворачивать свои намерения по переоборудованию ВВС самолётами пятого поколения и пытаются сформировать концепцию шестого поколения.По поводу многоцелевого самолёта там сейчас тоже много споров.Многоцелевик хорош в конфликте против третьих стран.Он действительно выгоден.Но в конфликте против хорошо вооружённого противника такие самолёты превращаются в продукт про который говорят  ни мясо,ни рыба .Так же высокая стоимость одного самолёта,а так же стоимость его обслуживания,плюс капризный характер не дадут быть ему рабочей лошадью.Я не думаю ,что американцы будут перевооружаться на этот самолёт.Те же самые хорнеты и иглы имеют ещё возможность к модернизации.Для американцев это гораздо выгоднее.;1;И4;3
10802;29956;243598;53899488;243413;25106701;11.09.2015 15:04;Я уже не говорю, что F-35 пройдет неоднократную модернизацию, замену двигателей, вообще изменится неузнаваемо - см жизненный путь F-16;0;И4;3
10803;29957;243599;53899488;243413;25106701;11.09.2015 15:09;[id1630004|Михаил], 6 поколение идет на замену F-22 и F-18E/F Это тяжелая двухдвигательная машина , которую проектируют Локхид Мартин и Боинг. Возможно между ними проведут тендер и выберут лучший проект - и для ВВС, и для ВМС. Но это ни в коем разе не массовая машина на замену F-16 . F-35 видимо будут заменять БПЛА нового типа уже ближе к середине века.;0;И4;4
10804;29958;243601;1630004;243413;25106701;11.09.2015 15:11;[id53899488|Сергей], по поводу фантома,тут дело не В шлеме,а опять же в концепции ВВС США на тот момент.Он был многоцелевой.Но он был   перетяжелен.Он был современнее  МиГов(15-21),но если те были чистыми истребителями с понятной концепцией применения,то фантом проигрывал в маневренности в ближнем бою,а будучи зачастую привязан к бомберам он ещё заранее уступал и инициативу.Результатом осмысления воздушной войны над Вьетнамом стал отход от много функциональности самолётов.Венец ВВС США в плане аэродинамических характеристик-хорнет.;0;И4;4
10805;29959;243603;53899488;243413;25106701;11.09.2015 15:16;[id1630004|Михаил], Наоборот дороже. Эксплуатация разнотипного парка дороже. Стоимость жизненного цикла - дороже. Поддержание старых самолетов в строю дороже . Чисто в отношении задач - намного дороже, поскольку требует больше машин на вылет. Многоцелевой самолет может выполнить задачу SEAD , затем когда ПВО подавлена нести оружие на подвесках, легко переконфигурируется для разных миссий - непосредственная поддержка, удары по наземным целям , пво , не требует прикрытия истребителями, как за счет большей живучести малой ЭПР и брэо, так и за счет собственных истребительных возможностей - меньшим количеством машин на ТВД- решаем больше задач. Меньшее количество машин- меньше необходимых транспортников, персонала. Все это подсчитывали еще в конце 90-х, начале нулевых.;0;И4;4
10806;29960;243605;53899488;243413;25106701;11.09.2015 15:22;[id252652514|Алан], Если бы вы читали то, что читал я, вы бы были куда менее радикальны в оценках.) Потому, что по логистике, новым решениям и в проектировании, в производстве по программе JSF было написано много нормальных , грамотных статей. Это была и остается революционная программа , веха в проектировании боевых самолетов.;0;П3;4
10807;29961;243606;1630004;243413;25106701;11.09.2015 15:23;[id53899488|Сергей], а если ПВО не подавлено?Если ПВО не с-200 ,а с-500?А если придётся ввязываться в многочисленные воздушные бои?А если вылеты должны будут идти нон-стопом.Вы только что косвенно подтвердили мой тезис о том,что ф-35 разрабатывается в основном против противника третьего мира.;0;В3;4
10808;29962;243609;53899488;243413;25106701;11.09.2015 15:25;[id1630004|Михаил], Если ПВО не подавлено- значит надо его подавливать.) Для чего на тактических самолетах 5 поколения радикально снижена ЭПР. Это и называется задача SEAD.;0;И4;3
10809;29963;243610;1630004;243413;25106701;11.09.2015 15:25;[id53899488|Сергей], я слышал что проекта локхида относится к 5++ в перспективе.Но опять же далеко не факт,что когда будет готов прототип,он не будет уже морально устаревшим.;0;И4;4
10810;29964;243612;53899488;243413;25106701;11.09.2015 15:28;[id1630004|Михаил], Если F-35 для третьего мира, то все остальные видимо для 23 мира. Поскольку ЭПР у них больше на порядки, информационная составляющая просто не идет ни в какое сравнение. Я думаю, что ответом на появление более совершенных комплексов ПВО и ПРО, будут гиперзвуковые системы, которые в этой роли заменят ушедшего на пенсию F-117;0;И4;4
10811;29965;243614;53899488;243413;25106701;11.09.2015 15:30;[id252652514|Алан], Изначально программы называлась JAST) F-22 cоздан по программе ATF. И программа ATF так и осталась в истории , как ATF );0;И4;3
10812;29966;243616;1630004;243413;25106701;11.09.2015 15:31;[id53899488|Сергей], ничем не доказано,что мало заметность будет играть определяющую роль.Потенциал мало заметности низок,тогда как системы обнаружения и рэб не стоят на месте.И даже спецы в США ещё не могут придти к выводу о том,что лучше,построить три су-35 или один ф-35.Мне почему то кажется что три сушки или хорнета выполнят задачу гораздо лучше чем тридцать пятый у которого не доказанных достоинств пока больше чем фактических;1;Ж4;3
10813;29967;243623;53899488;243413;25106701;11.09.2015 15:34;[id252652514|Алан], Ну судьба неудачная.) Оно и понятно. Потому, что на уровне технологий 70-х сделать легкий и тяжелый истребитель с равными характеристиками было невозможно из-за веса брэо. Легкий в любом случае бы проиграл тяжелому.;0;И4;4
10814;29968;243625;53899488;243413;25106701;11.09.2015 15:38;[id1630004|Михаил], Проводились учения с участием F-22A , Рафалей, Супер Хорнетов, F-15. Кроме того по пути снижения заметности идут абсолютно все страны - все проекты будущих боевых самолетов малозаметные - и китайские , и японские, и корейские, и ПАК-Фа, и все БПЛА - все делаются с прицелом на снижение заметности во всех диапозонах.;0;И4;3
10815;29969;243629;53899488;243413;25106701;11.09.2015 15:43;[id1630004|Михаил], Да не будет F-35 стоить , как 3 Су-35. ) Су -35 американского производства - это F-18 E/F. F -35 будет массовой машиной и потому будет дешеветь. В 20-е годы, когда выйдут на массовое производство, среди 4 поколения у него конкурентов уже не будет, а среди 5 еще не будет.;0;И4;3
10816;29970;243630;1630004;243413;25106701;11.09.2015 15:43;[id53899488|Сергей], только соотношение малозаметность-маневренность у всех разная.так же все страны наращивают свой потенциал ПВО.По этой причине у самолётов пятого поколения практически нет шансов стать основными.В России  сушка будет основным а пакфа скорее самолётом для спецопераций.;0;И4;4
10817;29971;243632;1630004;243413;25106701;11.09.2015 15:44;[id252652514|Алан], вот именно,цена и страх потерять дорогую игрушку не пустят рапторов в серию.;0;Щ4;4
10818;29972;243633;53899488;243413;25106701;11.09.2015 15:47;[id252652514|Алан], F-22 выпущен малой серией, потому, что программу порезали из за краха СССР. Как и ряд других программ- например подводных лодок Сивулф. Естественно, цена выросла. Кроме того, F-22 не мог нести во внутренних отсеках бомбы JDAM , был тяжелым двухдвигательным самолетом. Хотя думаю, что произвести 350 штук было реально .;0;И4;4
10819;29973;243636;53899488;243413;25106701;11.09.2015 15:50;[id252652514|Алан], Это не тоже самое, а вероятная альтернатива для F-15A . И как таковая альтернатива он был неуспешен. То, что флот предпочел двухдвигательную машину вместо однодвигательной - это другая история.;0;Ф3;3
10820;29974;243638;1630004;243413;25106701;11.09.2015 15:50;Сергей, это уже голословно,тут можно сказать,что на сушку будет поставлено какое то оборудование,что невелирует цифровое приемущество тридцать пятого,но это же несерьёзно).Пока сушка превосходит тридцать пятого в маневренности и уступает разве что в малозаметности,но это повторюсь сомнительное достоинство.А по поводу цены,время идёт ,а не рапторы,ни В-2 дешевле не стали.Нет никаких тенденций к тому ,что тридцать пятый подешевеет.;0;Б2;3
10821;29975;243641;53899488;243413;25106701;11.09.2015 15:54;[id1630004|Михаил], Чем меньше заметность- тем выше живучесть. Как против наземной, так и против воздушной составляющей ПВО. Это в России у 5 поколения нет шансов стать основными в обозримом будущем, а в США 5 поколение сначала дополнит 4+ и заменит 4, а затем будет вместе с 6 паралельно и наконец заменено 7. По крайней мере такава логика развития боевой авиации в США.;0;П3;3
10822;29976;243650;53899488;243413;25106701;11.09.2015 16:02;[id1630004|Михаил], Не получиться. У 4 поколения планер не позволит разместить оружие на внутренней подвеске. Даже конформные отсеки не дадут паритета. Нужен новый планер с нуля. Аналогично с Брэо. У F-35 сенсоры позволяют видеть через обшивку - реализовать это на 4 поколении нереально. В сочетании с ракетами AIM-9X особая маневренность не нужна, тем более самолет оптимизирован на бой на дальней дистанции. Кроме того мы еще не знаем толком какой маневренностью обладает F-35. Или будет обладать в будущем.;0;Б3;4
10823;29977;243656;53899488;243413;25106701;11.09.2015 16:05;[id1630004|Михаил], Естественно не подешевели поскольку вместо 100 B-2 сделали 21, вместо 750 F-22 сделали 180. Вот они и не подешевели. И понятно почему эти программы были сокращены. Холодная война закончилась. Изменились задачи. Если программу F-35 порежут - тоже не подешевеют, но я не вижу для этого оснований.;0;И4;4
10824;29978;243662;53899488;243413;25106701;11.09.2015 16:11;[id1630004|Михаил], Тенденция, что 35 подешевеет в том, что ему нет альтернативы. Это раз. Грядет новая гонка вооружений . Это два. Тренд на разоружение на западе заканчивается- и скоро маятник качнется в противоположную сторону.;0;Ж4;4
