10897;30051;244479;1271446;243413;25106701;14.09.2015 19:09;[id53899488|Сергей], ну не 100 000 , предположим, а 157 000 ( всё таки преуменьшение в 1.5 раза это некрасиво ) , во-вторых следует учитывать годы производства и годы бомбардировок ... к примеру если брать самый тяжёлый 1941 год , то с утра 22 июня по 31 декабря 1941 года боевые потери немецкой авиации составили 4 543 самолёта, из них 3 827, или 82%, - на Восточном фронте. По лётному составу потери убитыми, ранеными и пропавшими без вести – 7 666 человек, из них 6 052 или 79% - на Восточном фронте. И я считаю что провал блицкрига , в т.ч. по авиации - это в основном заслуга СССР, а не союзников. - Так же и пик производства военной техники союзниками приходился уже на завершающие стадии войны, и это ещё бабушка надвое сказала кому они предназначались - немцам ,или СССР . Дата открытия второго фронта тому яркое подтверждение ....... <br>Также и операции по бомбометанию стали по-настоящему эффективными далеко не сразу , вначале тактика и техника довольно долго обкатывались на  оккупированных территориях  .Да и задачи были совершенно разные у авиации , в т.ч. и немецкой - на западе перехватчики-ПВО , на востоке -поддержка наземки и  вольная охота  .... соответственно и для уничтожения наступающих колонн немецкой техники Ил-2 был незаменим и успешно справлялся с этой задачей. <br>По поводу чудского озера - да, я в курсе , что в этой битве погибло больше именно рыцарей, чем в любой другой битве за всю историю. ( да , может всего несколько десятков , но даже это была редкость в других войнах ) .;0;Ж4;4
10898;30052;244484;53899488;243413;25106701;14.09.2015 19:33;[id1271446|Владимир], Ок. Хотите точных цифр - пожалуйста. <br>Итак советская промышленность произвела. <br>Ил-36 тыс . <br>ЯК-37 тыс. <br>Ла-22 тыс.<br> Пе-2 - 11 тыс. <br>Итого с 1941-1945 136,8 тыс.<br> По годам.<br>1941-15 тыс. 1942-25 тыс. 1943- 35 тыс. 1944- 40241. 1945 1-4 - 20900.<br> За тот же период времени в США произвели 297 тыс самолетов <br>из которых 14 тыс были поставлены СССР.<br>Из них 12726 Б-17. 4547 Б-29. <br>15 тыс мустангов. 13738 P-40 , Дуглас DC-3 и С-47. были массовыми транспортниками - поставлялись и в СССР, где первый назывался ЛИ-2, а второй остался со своим названием.<br>Это я еще не добавляю Великобританию.;0;И4;4
10899;30053;244489;53899488;243413;25106701;14.09.2015 19:44;Вообще то в Битве за Англию Великобритания в одиночку без всяких лендлизов продержалась в 1940г при том, что в это время СССР был де факто союзником Германии.<br> Речь вообще то о том, что львиную долю перевеса в ресурсах коалиции дало вступление в войну США, что предопределило поражение Германии. Что касается авиации союзников, то Б-29, Спитфайры, тандерболты, мустанги однозначно сильнее советских машин. Причем стратегические бомбардировщики и транспортники вообще вне конкуренции. И уровень подготовки был выше. И надежность техники.;0;И4;4
10900;30054;244490;53899488;243413;25106701;14.09.2015 19:51; этой битве погибло больше именно рыцарей, чем в любой другой битве за всю историю.  <br>Там всего участвовал 31 рыцарь - столько входило в состав клина. <br>Я понимаю конечно, что в учебниках пишут такие глупости, но надо и с головой дружить.<br> Даже если все 30 погибли - то неужели за все крестовые походы, включая разгром под Мансурой или за всю столетнюю войну в сражениях гибло меньше 30 рыцарей? )) <br>Да только после битвы при Куртре фламандцы развесили 700 золотых шпор снятых с французских рыцарей. При Креси, Пуатье, Азенкуре - просто рыцарское кровопускание. На самом деле битва на чудском озере - это мелкий эпизодический эпизод, раздутый государственной пропагандой до невероятных размеров.;0;Ж4;4
10901;30055;244491;53899488;243413;25106701;14.09.2015 20:03;[id1271446|Владимир], Вообще то именно в 1941 доля американских самолетов и была наибольшей. Кроме того без авиационного бензина, советская авиация вообще не смогла бы летать. Тут можно глянуть. Про пороха еще Жуков высказался.<br>http://www.battlefield.ru/value-of-lendlease/stranitsa-3.html;0;И4;4
10902;30056;244512;1630004;243413;25106701;15.09.2015 2:53;Сергей, афар скоро появится на миг-35,и его появление на сушке гораздо вероятнее появления молнии с лазером.В этом превосходство молнии будет нивелировано.А что касается малозаметность,то вы не привели ни одного примера,когда самолёт с технологией стелс смог проникнуть через современную систему ПВО.По поводу раптора я уже писал ,что его маневренность ,которая сопоставима с 35сушкой ,часто выходит ему боком.Отказывает вооружение спрятанное для придания малозаметности в корпус во время исполнения сложных фигур.Ваша мантра про снижение стоимости молнии,пока только мантра.Стоимость самолёта растет и вместо запланированных 150лимонов там уже все 400.Тенденция к росту сохраняется.Так же растёт стоимость эксплуатации этого самолёта.Тенденция по прежнему двигается в сторону повышения.По поводу цифровых технологий -это всего одна сторона медали,вторую вы упорно не хотите замечать-это рэб.Который на сушке выше всяких похвал.К томуже молния самолёт наступления,а сушка в случае чего будет действовать в спарке с наземными ПВО.Нет у молнии никаких шансов.А ваша претензия про сравнение самолёта с малым запасом топлива с самолётом у которого таких проблем нет просто странная.Это проблема молнии .Поэтому я сравниваю их как раз в тех условиях в которых они окажутся.Ролику от создателей молнии Советую смотреть очень критично.Он рассчитан на широкое мнение.Видете ли молнию финансировали много стран,и в данный момент очень немногие готовы взять этот  дешёвый  и архипередовой самолёт на вооружение.А профессионалам виднее.Кстати а почему рапторы,если они такие крутые(они на самом деле хороши),не участвовали ни в одной операции?По идее каждый передовой самолёт до этого старались тестировать,а тут суперраптор торчит на земле больше чем в небе.Прям как наша авиация в девяностые.;0;И4;4
10903;30057;244517;53899488;243413;25106701;15.09.2015 7:35;[id1630004|Михаил], И что даст миг-35 афар? Сейчас уже у всех есть афар. И F-15 F-18E/F F-16E F-22 F-35 , европейские самолеты - у всех есть афар. <br>Это не изменит картину совершенно. Ну обнаружение будет грубо говоря не на 10 км, а 20км. <br>А малозаметные самолеты обстреляют его амраамами с дистанции больше 100 км. Чтобы нивелировать превосходство F-35 нужно сделать новую машину с внутренним размещением оружия, с подобной мощностью обработки данных, интегрированным БРЭО, встраивающим все в одну сеть, включая БПЛА, способностью наводить ракеты-перехватчики с кораблей и многое другое.;0;Ж4;4
10904;30058;244518;53899488;243413;25106701;15.09.2015 7:39;[id1630004|Михаил], По рэб в сша тоже работают. Смотрите Growler который заменяет старые машины, F-35 тоже продвинут в этом отношении. Рэб не противоречит малой эпр, а только дополняет.;0;И4;3
10905;30059;244522;53899488;243413;25106701;15.09.2015 8:46;  Нет у молнии никаких шансов   Похоже мантра у вас.) У меня только беспристрастный анализ .);0;Ш3;4
10906;30060;244523;53899488;243413;25106701;15.09.2015 8:51; А ваша претензия про сравнение самолёта с малым запасом топлива с самолётом у которого таких проблем нет просто странная   <br>Это не моя претензия, это необходимое условие сравнения. Сравнивают самолеты в одной конфигурации. Если берете Су-35 в конфигурации истребителя, то и F-35 тоже в конфигурации истребителя. То есть с половиной запаса топлива, амраамами на внутренней подвеске. Вот у вас будут разные значения массы снаряженного самолета. Это общая методика сравнения.;0;И4;4
10907;30061;244832;1271446;243413;25106701;15.09.2015 19:20;[id53899488|Сергей], - забыли про легендарный У-2 ))) это отдельная героическая страница в истории авиации. , ну и про моих любимых Ишаков вполне сносных на малых высотах ( где и идут бои поддержки ) и виражах на горизонталях ,особенно когда за штурвалом не новички. Ещё были , конечно ,Миги .. Лагг-и ... и более другие самолёты. Про периоды советую вам дать статистику по производству самолётов не в 1944-1945-м , а в 1941-1942 , наиболее ожесточённые и критические годы войны в СССР . Те же мустанги в СССР не поставлялись ,потому как бои шли совершенно в других условиях , а аэрокобра поставлялась и почти не использовалась в ВВС Великобритании, потому что не удовлетворяла условиям тех боёв - яркий пример разной тактики и разных боевых задач. В СССР немцы имели преимущество на высоте , русские - на малых высотах , а в Битве за Британию у союзников было преимущество на высоте, а у немцев - на средних высотах ...... это если совсем в двух словах. В любом случае война выигрывалась на земле, а не в воздухе. <br>- если бы СССР был союзником Германии ( даже в то время ) - то никакой Великобритании бы уже не было , это так - лирика. <br>- да я и не оспариваю важность ленд-лиза , я оспариваю тот факт что союзники без СССР бы справились - это раз ,и тот факт что помощи могло бы быть и больше , и приходить она могла раньше - если бы они так уж сильно хотели помогать , тем более что ленд-лиз это далеко не безвозмездная помощь изначально .... после войны Сталин значительно уменьшил контрибуции Германии, оценив их в стоимость ленд-лиза и фактически переадресовав платежи по нему - немцам. Ну и США тогда  скостили  этот долг , решая свои стратегические интересы в Германии. Фактически за ленд-лиз Советский союз расплатился тем, что восстанавливал всё сам. <br><br>- поймите, я не преуменьшаю роли Великобритании или США в войне , но лично меня раздражает отношение современных англичан и американцев к роли СССР во Второй Мировой. Недавно буквально проводились исследования общественного мнения , опубликованные на БиБиСи ... в которых ме;0;И4;4
10908;30062;244833;1271446;243413;25106701;15.09.2015 19:26;[id53899488|Сергей], что касается Чудского Озера ..то во первых - рыцари бывают разные , те очень дорогие, лошади в дорогих доспехах, тяжёлые, знатные по одному чуваку из каждого замка - это одно, те в крестовых походах и с золотыми шпорами в столетней войне - это другое. <br>второе - я в общем то согласен со статьёй в Луркоморье, но тем не менее считаю , что историческое её значение было достаточно велико. Отсюда и такое количество преувеличений.<br>ну и всё-таки согласен на цифру в 50 ...а не в 30 ... ( изначально было их 70 , но 20 вынесли в Пскове );0;Ж4;4
10909;30063;244862;53899488;243413;25106701;15.09.2015 20:13;[id1271446|Владимир], Лагги включены в самолеты типа ЛА. Ишаки уже не производились.<br> По 1941г - я дал статистику. <br>СССР был союзником Германии с раздела Польши и до 22 июня 1941г. Решающим был вклад каждого из членов большой тройки - СССР, США и Британской Империи.<br> Выход из коалиции хотя бы одного из трех , означал бы ее развал, оккупацию СССР и переход противостояния в новую фазу с возможным переходом в атомную. <br>Ну это мой вывод, не согласны - не навязываю.<br> А то, что решающий перевес в ресурсах коалиции против Гитлера дало именно вступление в войну США - это просто факт. <br>Достаточно посмотреть на долю США во всем произведенном - кораблях, самолетах, автомобилях, локомотивах, патронах - список будет долгим. <br>А что касается моральной стороны вопроса.. То выяснять чей вклад в общую победу больше - это очень некрасиво и отдает комплексами. Победа общая. И австралийский солдат , погибший в бою ничем не ниже советских солдат.;0;Р4;4
10910;30064;244864;1271446;243413;25106701;15.09.2015 20:15;[id53899488|Сергей], ну вот если бы все так и говорили что победа общая - то вопросов никаких )) я согласен .......... а пока общаюсь со всякими западно-европейцами и американцами и слышу от них то, что я слышу - буду отстаивать родное болото.;0;К3,О3;4
10911;30065;244865;53899488;243413;25106701;15.09.2015 20:18;[id1271446|Владимир], Я статьи в Луркоморье не читал.) Есть статья в журнале Цейхгауз №6 <br>А. Кирпичникова. Ледовое побоище. Если интерестно - прочитайте. Я считаю ее самой толковой и с хорошей аналитикой.;0;Р3;4
10912;30066;244866;1271446;243413;25106701;15.09.2015 20:20;[id53899488|Сергей], ну видимо тот кто постил в Лурке именно её и читал ... просто цитата для примера - так что советую глянуть , идеологически она от вашей версии не отличается.<br><br>Не имея точных цифр из русских летописей и немецких хроник касаемо Ледового побоища, попробуем оценить численность немецкой «свиньи» на основе других битв, описанных более детально. В распоряжении историков имеется уникальный документ — воинское наставление — «Приготовление к походу», написанное в 1477 г. для одного из бранденбургских военачальников. В нем подробно описано три варианта построения «свиньёй» и приводятся типовые названия отрядов-хоругвий: «Гончая», «Святого Георгия» и «Великая». При этом указывается, сколько воинов составляют клин и сколько — поддерживающую его колонну, которая включала в том числе кнехтов (ср.: фаш. Knecht — «слуга, работник :  холоп».) Среди кнехтов находились слуги, входившие в состав боевой свиты рыцаря: обычно лучник или арбалетчик и оруженосец. Во время боя эти воины, экипированные не хуже рыцаря, приходили на помощь своему господину, меняли ему коня.<br>К достоинствам колонно-клиновидной хоругви относится ее сплоченность, фланговая прикрытость клина, таранная сила первого удара, четкая управляемость. Теперь можно сопоставить Ледовое побоище с наиболее крупным сражением русских и немцев тех времён — битвой при Раковоре от 1268 г. В этом сражении, как упоминает русская летопись, выступал немецкий «железный полк великая свинья». Именно этот отряд упоминается в ливонской «Рифмованной хронике», которая сообщает, что в битве участвовало 34 рыцаря и ополчение. Если это число рыцарей дополнить командиром, то будет 35 человек, что точно соответствует составу рыцарского клина одного из отрядов из «Приготовления к походу» 1477 г., причём самого маленького из трёх. В том же «Приготовлении» приводится число кнехтов такой хоругви — 365 человек. Не стоит забывать, что часть рыцарей погибла или попала в плен ещё раньше, при взятии Пскова и штурме других городков — Копорья и Изборска, так что общее число рыцаре;0;И4;4
10913;30067;244868;53899488;243413;25106701;15.09.2015 20:28;[id1271446|Владимир], Да, это оно.) Ну это не только эта статья. Можно глянуть и первоисточники , они в этой статье упоминаются. Ну на самом деле вы же понимаете, кто разбирается в военной истории - утверждения, что там погибло больше рыцарей, чем за всю историю - это смешно. Кстати рыцари там были  провинциальные  если на то пошло, на задворках Европы - а под Куртром был цвет французского рыцарства Филиппа Красивого в лучших доспехах, как и положено самому могущественному и богатому королю Европы. Да и масштаб совершенно несравним. Глянте Креси , Пуатье - там тысячи рыцарей участвовали, а не десятки.;0;И4;4
10914;30068;244870;1271446;243413;25106701;15.09.2015 20:29;[id53899488|Сергей], ну тем не менее моё гражданское самолюбие задевает тот факт , что это - таки был тоже своего рода  крестовый поход  ))))))) пусть и небольшой;0;К4;4
10915;30069;244872;53899488;243413;25106701;15.09.2015 20:33;[id1271446|Владимир], Аналитик должен абстрагироваться от эмоций. ) На самом деле орден меченосцев долго и нудно воевал с литовскими язычниками. А Новгород и орден перманентно совершали против друг друга набеги. Как немцы на новгородцев, так и наоборот.;0;З4;4
